,reviewerID,asin,reviewerName,helpful,reviewText,overall,summary,unixReviewTime,reviewTime,Sentiment
24,A2D8CUJPOSRPNA,764006770,Erik North,"[3, 4]","Largely forgotten among the horror movies of the 1970s, and vastly overshadowed by STAR WARS, the 1977 horror film THE CAR, despite looking and feeling dated in places, works fairly well in its narrow format the way a great many horror films do. Instead of piling on the blood and gore, like too many horror films after HALLOWEEN would do, THE CAR is more of a suspense shocker based on supernatural themes, predating the Stephen King-based CHRISTINE by six years.As has been mentioned, THE CAR is a long, black, and quite frankly evil limousine that has its sights set on the town of Santa Ynez in southwestern Utah. James Brolin is the town's deputy sheriff who must cope with and stop this limousine before it kills any more people (in the film's opening sequence, it actually kills two cyclists in Zion National Park). What he WON'T believe in, despite the imploring of his fellow deputy (Ronny Cox), is that this car doesn't have a driver but rather is possessed by a demonic force. When it chases a local schoolteacher (Kathleen Lloyd) into a cemetary, it won't barge through (it nevertheless succeeds in killing her in her home). Brolin still doesn't believe in it even after the film's fiery climax.Though not necessarily blessed with originality, being as it is a combination of THE OMEN and DUEL, THE CAR nevertheless moves with velocity, thanks in large part to an ensemble cast that includes John Marley, R.G. Armstrong (a Peckinpah regular), Roy Jenson, and John Rubinstein. Director Elliot Silverstein, whose credits include CAT BALLOU and A MAN CALLED HORSE, makes the most of the plot with very good special effects, including the explosive finale; and he is helped by a good score from Leonard Rosenman (Oscar-winner for adapting music for Kubrick's BARRY LYNDON in 1975), which incorporates the ominous Gregorian chant Dies Irae.Though not a masterpiece per se, THE CAR is nevertheless far better than some might give it credit for. It deserves a look for any horror film fan looking for something more than a standard-issue blood-and-guts slasher film.",4,The Devil Is In The Driver's Seat,1099353600,"11 2, 2004",-0.3018
25,A3SO0F8B7BSPGZ,764006770,Fireball Fireball_SP2,"[4, 22]","Automatically this movie gives off a typical seventies version of a horror movie, complete with skin tight jockey shorts, fading pastel colors and scooby doo hair doos. The beginning leads the viewer to believe that something evil is learking off in the distance, like a predator seeking it's prey. Yet how far can one go with a black car, with tinted windows who spends most of the movie gunning people down, off the roads. Never is there any evidence that someone is behind the wheel, for all the viewer knows it could be a 16 year old with a remote control out for kicks. It's VERY far fetched, and annyoing to watch, as no one is clever enough to just blow the stupid thing up, until the very end. Not to mention all the graded, loud music that sounds like someone scraping together pieces of metal...it's not enough for any true horror fan to stand for a whole hour and a half....not to mention there was never any hope for a sequel...&quot;Car The Revenge??&quot; Give me a break!N.C.",1,Can we say cheese??,1065225600,"10 4, 2003",-0.2622
26,A1BB3Z1GCGNM32,764006770,FlopFilm,"[0, 0]",I remembered this film as a youngster back in the 70s. I have Christine and remembered this film. The Car made me think of sitting home and watching it on television back in the day.,5,"You can run, but you can't hide.",1386028800,"12 3, 2013",0.0
27,A3P6QJSXNTFPG2,764006770,Georgia,"[0, 1]","I had thought that I'd seen scary movies in my time, but this one really is a nail bitter...It starts off fast, then zooms through with a scare a minute...It's just a great film...Georgia",5,Movies I love...,1317859200,"10 6, 2011",0.0644
28,A3CQ8ZNAXZIK3O,764006770,Gil,"[1, 3]","I've seen this movie a really long time ago but for some reason still remember it even though it wasn't such a great movie . As a kid I thought at times it was very unbelivable , but lets face it , if you are going to make a movie about a killer car you should prepare to make some sacrafices like why all those pepoles insist on staying on the road when being cahsed by it when they can go sideway ?",3,look both ways before crossing the road,992476800,"06 14, 2001",-0.618
29,A32DRQPNRD8G6G,764006770,Glynn,"[3, 3]","Not much to say about this other than it is a cool movie and the car is awesome. When I was young, when the movie came out, I just knew that when I grew up I was going to have a car just like it. Well, I don't, but at least I can watch it on DVD. Anyway, it is a bit cheesy and over acted, but all in all, it is a great movie for any horror/scary movie fan. Once my friends found out that I had bought it, they all wanted to come and watch it again. Even after some 20 years or so, it still gave me some of the original feelings that I felt when I was 7 and saw it for the first time. I highly reccomend this to anyone interested in purchasing it. If I could, I would give it 10 stars.",5,Guilty Pleasure,1010620800,"01 10, 2002",0.414
30,A315I4RKNVTUYJ,764006770,Harlem Champ Harlem Champ,"[1, 1]","I remember seeing this classic as a kid in the 1970's, and i had loved it, so last week i ordered it to see if it could still hold up in this modern day of CGI special effects and shock-horror. It was captivating then, and it grasped my attention when i watched it today. The Car is a suspenseful little film, with quite solid acting, and an eerie atmosphere although 90% of the action takes place in the daytime, when the vast skies are bright, blue, and clear, and the dirt, and desert cinematography are brilliant and picturesque... maybe thats what gave me an unsettling feeling, that somewhere in this small, slow paced, quiet, desert town, something indestructible, fast, and evil appeared, in the daylight...The Car is, in my opinion, what a good horror flick is about; suspenseful moments, good music, acting and camera angles, and especially in which that it frightens us without the overwhelming use of purposeless shock- violence that overflows the majority of modern day horror films. Now, i really dig horror films and all genres of film, but nowadays i really look forward to being scared by atmosphere, concept, story-line, and a build up of suspense, kinda like a Steven King short story..No CGI here, no explicit gore, just conjured up notions that some possessed car is running over people, (all we usually see is white sheets with some blood on them) and that makes it more frightening, but we do see the car killing people... the fact that this vehicle, which physically looks evil, is tearing through this town unmercifully. The killer in this movie is solid steel, gas and rubber, and it makes you think, that as human beings we are just mere flesh and blood, and that it's pretty hard to fight a crazed vehicle..HaHaHaHaThere are some pretty good performances here, actors with expressive, facial expressions like James Brolin and his girlfriend, and supporting roles with Ronny Cox, and John Marley from the Godfather, plus, some really cool stunt scenes, great sound effects... and that damned horn!!!If you like atmospheric, creepy 70's horror films, i recommend The Car... it's a film classic.",5,Nightmares on wheels... The 1970's at it's best !,1299888000,"03 12, 2011",0.0151
31,A3N9HFKXRV05QJ,764006770,Heather Hammers,"[0, 1]",This is one of the oldest movie that i've seen before and this movie keeps getting better and better all the time.,5,Awesome,1358035200,"01 13, 2013",0.7003
32,A3FUBUJAIGM87T,764006770,HorrorMan HM,"[3, 4]","When I was a kid, horror movies certainly felt different to me. Now, some things have changed, and some things have not. I still know garbage when I see it, but some things just do not have the same feel anymore either. Such is the case with The Car. I suppose that's natural, but I still have somewhat of an affinity for this movie. When I was kid, I was scared of The Car. It seems rather bland now, for sure, but back in the ole days....The Car is about a mysterious car that kills people for no apparent reason whatsoever. In the same vein as Duel and Christine, The Car comes across in a mysterious fashion in the sense that we do not know who is driving the car, and we do not know why the killings are taking place. Then again, does it matter? Isn't that the point? No motive makes it scarier that way and it's better theater. After all, when things get spoon-fed to us and explained to us, what's left for the imagination? Just take Rob Zombie's inferior Halloween remake for example. Who cares why Michael Myers acts the way he does? Who cares why he marked Laurie Strode for death? Does it make it better for us to know why? No, it just takes the horror right out of it when this happens. The Car does not have this problem, and even though it is confined by its own self-imposed limitations, it has a certain charm that allows the movie to work on some levels.Indeed, The Car does a pretty good job of letting the imagination run wild, at least to a certain point. True, it doesn't take long for the savvy horror movie fan to figure things out, but there's often a kind of beauty in the simplicity of it all. I do not want to make out that The Car is some kind of superior horror movie because it's not. I'm sure as hell not drunk enough to give it five (5) stars. Yet, it stills has a certain identity that makes it worth watching. You could do far worse than watching The Car on a late Saturday night. The acting is okay, and the production values are good, but if for nothing than the nostalgia of it all, there is a reason that I like The Car. Does it scare me now? Certainly not, but it takes itself seriously, and there is a certain degree of suspense and style which is about all you can ask for anymore when it comes to horror movies nowadays...hell, you can't even get that in today's horror movies.In conclusion, I affectionately give The Car 2.5 Stars although it probably deserves only two (2). Of all the automobiles run wild movies, I'd rank them as follows: (1) Duel, (2) Christine, (3) The Car and (4) Maximum Overdrive. Still, with that being said, I'd rather watch The Car any day of the week than any of today's trash. I don't know what that says for today's movies, but it aint good, and I'm certainly not the only one. After all, any sophisticated and seasoned horror movie lover would undoubtedly echo my sentiments.",2,"2.5 STARS: Before Christine, there was The Car!",1250467200,"08 17, 2009",-0.042
33,AGL6I197WEJ49,764006770,imagine beyond,"[0, 1]","in the wake of duelhere comes a nice little horror moviesilly, yes, but most enjoyable !By the way, the car is great looking as is the picture on this dvdenjoy as a guilty pleasure !",4,silly but most enjoyable !,1307232000,"06 5, 2011",0.9359
34,A1QMNQAXM75KJC,764006770,J. C. Bednar J.C. Bednar,"[0, 0]","Watched this movie as a kid when it first came out in the 1970s. In fact, remember watching this at the local drive-in theatre. Movie is about a demon-possessed car that terrorizes a small Utah community for no particular reason. The 1970s had all kinds of mind-boggling horror films that made not much sense, but that is what makes them so much fun to watch - there even was a made-for-TV movie about a demon-possessed bulldozer, &#34;Kill Dozer&#34;!! Been wanting to view the horror movies that I grew up on and this was one of them.Anyway, local sheriff James Brolin is suddenly confronted with quite a few brutal murders and must try and figure out what is going on. He must try to protect the community, his 2 daughters, his school teacher girlfriend (who succeeds in antagonizing The Car), all the while trying o figure out a way to destroy this metallic monstrosity. Finally, a solution is figured out with the help of local drunkard and brute of a husband, R.G. Armstrong, and 2 other deputy sheriff's that manage to live long enough.An OK horror movie from the era of OK horror movies of the 1970s. Purchased via Amazon and package/product arrived in great shape and about 3 days earlier than expected. Giving this movie 3 stars for it did bring back some memories and I can tell why this was one of my favorite movies of the era.Remember, when you here that certain HORN BLARE, The Car is after you!!!!!!!!!!!!!!!!!!!!!!!!!!!",3,OK horror movie from the 1970s.,1393718400,"03 2, 2014",0.0347
35,A28GBLQSNZ8CJF,764006770,Jeff Brower jeff brower,"[1, 1]","The movie The Car is very well done it is all about this black demon looking Car that is not driven by anyone but the Devil himself, and it starts by running over these 2 bicylists a boy and a girl as well as plenty more people then it scares the school band and the teachers while they are involved with a special event and it runs over more people including the sheriff of this small town and the deputy as well as kills more people in the town then some of the townspeople wants to get revenge on the car so they decide to blow it up and the chase is on when the deputy gets the car to chase him then the car finally explodes and is sent back to where it came from back to Hell. so I highly recommend this movie if you have not bought it yet. you will indeed like it and want to see possibly again and again.",5,The Car from Hell,1300147200,"03 15, 2011",-0.0234
36,ANX8ZGEXE70EO,764006770,Jennifer M. Hensley Thomas Hensley &#34;B-Ho...,"[1, 1]","'The CAR' ( an awesome, customized, death-machine of a black sedan), is a number one favorite of mine when it comes to watching murderous, demonic automobile flicks. Heck, its ranked high with me when it comes to 70's Cult Horror. The main reason for this, its mysterious. Plain and simple. You never know where the car comes from or why 'IT' does what it does. I stress the word, 'IT', because I'm not even sure if 'IT' has a demon driving the car. My guess is that the car IS the demon. A demon disguised in the form of a car. How awesome is that! You only know that it's purely and simply evil. It kills because it can. It is if Michael Myers were to be reinCARnated, he would be THIS car. 'The CAR' might not be every horror fans cup of tea; maybe because these days, it just seems everyone has to have all the answers. Everyone needs a backstory to everything. Well, sorry, that's not what Horror is always about in some cases. The mystery to a scary story is what makes it horrific! 'The CAR' is perfect for building tension, too. Just when you think the demonic car has been out witted, think again! The tag line for this flick is perfect. - What evil drives...THE CAR! Oh, and James (The Amityville Horror) Brolin does an excellent job as always as so do the other actors and actresses. In my opinion, 'The CAR' is essential to ones Horror collection!",5,I want this CAR!,1265673600,"02 9, 2010",-0.0765
37,A1NI0VOVXZBM7Y,764006770,Jose Lopez Jose Lopez,"[2, 6]","The Car is a Mean Looking Cannibalized Lincoln(Or StinkinCar-Ford),the acting except for The Native Americans and the brunette is Terrible,plot even for an 70's Horror movie is laughable and the End seemed like a Comedy.And Annoyingly Bab I mean Brolin with his SmugMug as the so-called star,The car is the Star(Thanks George Barris.)And What really grinds my gears is the quote at the start of the film,A Horror movie that is amusing and funny.",1,The Car-five stars for the car-0 for acting and for the Quote at the start of the movie.,1330387200,"02 28, 2012",-0.0238
38,A2X1FP1ZOCPHXD,764006770,Josh Muha,"[0, 1]","When I first saw the movie, I did find it pretty intense to see. Even though, it is a horror film about a black car that is mainly a killing machine. But, a big GOOD JOB to George Barris who designed and built this mean machine",5,The Car: Awesomely Intense Movie,1353801600,"11 25, 2012",0.1374
39,A2ZE73RFY0GD3K,764006770,J. Reynolds,"[19, 23]","&quot;The Car&quot; manifests James Brolin's absolute summit of the acting craft, reflecting the finest performance he ever gave in one of the best films ever made -- about a driverless car that kills people and cannot be stopped. (Before you denounce this concept as implausible, take a look at &quot;Yentl.&quot;) Brolin's delivery in &quot;The Car,&quot; his use of his features, expressions, voice and body to totally immerse himself in the character of a small-town law officer facing the challenge of a lifetime, is unparalleled by any other work in his career. This film should be required viewing in every school of drama in the nation, to demonstrate to young actors what they could become if given the right opportunity.And it was terrific seeing young Ronny Cox in this movie too, fresh off his broke-arm, drowned-in-the-river portrayal in &quot;Deliverance.&quot; (At one point in &quot;The Car,&quot; we see Cox weeping -- and you just have to think he was actually upset from watching Brolin's performance on the set, which so easily enabled him to produce tears.)&quot;The Car&quot; (a film FAR superior to Kill Dozer, though the concept is the same) was James Brolin's peak, the apex of his entire acting portfolio. There really was nothing left for him to do after this, but marry Barbra and witness her incomparable participation in the aging process.",5,James Brolin's Absolute Summit As A Thespian,1085443200,"05 25, 2004",0.0081
40,A3V4SVISFZUSYD,764006770,Keith Kovacik Mac4Brains,"[0, 0]","The creepy part about this movie is within its simplicity. A car arrives to terrorize a small sleepy town in the mid west. It kills several people and in ways that is does not make sense to the people in the town. For an example it killed one woman by crashing through her home. No one was able to understand how it sliced a home in half 5 feet off the ground with no apparent ramp. At another point in the movie it does a fishtail turn to the side and rolls over two police cars flattening them and kills the cops inside, only to wind up back on its wheels and it keeps going down the road, with barely a scratch. In the end they decide to blow up a whole canyon to burry the thing since it has killed off most of the cops in the sleepy little town. A bit of a hint to whom might be driving the car at the end but I don't want to give it away.The movie ends with credits while the car makes a trip to some kind of generic American city. So many victims and so little time, kind of reminds me of an old computer game called Carmageddon.This was a movie that was made back when big budgets were not always needed to make a good movie. The movie does not clearly dictate if anyone is in the car or not, but kinda hints that no one is. This movie might even be what inspired Steven King to write Christine. In the end this movie would have been a classic and a hit in the theaters if it did not come out at the same time as Star Wars.",5,A hit that was over shadowed by Star Wars,1236124800,"03 4, 2009",-0.3002
41,A1R4XP76SOQGSD,764006770,kelsey t kel,"[0, 2]","I love this movie so much, when I was a child my mother took me tosee this film and I was terrified by this demon car, I like the fact thatit is not like today's movies with all the special effects, it has realacting like the movies of the 70's did.A young James Brolin did a good acting job in this film, I am an adult now and I still get butterflies in my stomach from watching this film,it is a good movie to have in my dvd collection, I love it and I definitely recommend it if you want to be entertained and a little scared.",5,One of my favorite horror films,1211414400,"05 22, 2008",0.9656
42,A27P0MW8TE1JQP,764006770,Kevin J. Loria,"[11, 11]","The late-night classic from the 70's returns. Out on the rural highways and byways speeds Satan's evil sedan running down the unwary, no matter how righteous. This beautiful B horror film, wheeled in with the wave of Devil movies, including the Exorcist, in the 70's. But the twist here is that a driver-less CAR is doing Satan's bidding! There's also some strange parallels to a certain shark movie released the same year. There's loads of shots of the CAR prowling the desert roads, sweet point of view shots from the evil vehicle's interior, and the glorious HORN FROM HELL literally scaring the be-jesuz' out of those motoring-mortals. The music is a little dated, as is the production value, but the premise is so classic, it is worth owning, especially to shake-up a horror movie marathon or a when cars attack themed evening.Classic moments include the CAR struggling unable to cross onto hallowed ground to get it's victims and the ultimate fate of the Satan's ride.Futurama satirises The Car and The Howling in an episode called The Honking. The made-for-TV Herbie remake with Bruce Campbell has a Car homage with an evil VW beetle made by Nazis.",4,The DEVIL CAR returns!!! Satan's Tricked-out Sedan!,1202342400,"02 7, 2008",-0.4463
43,A1MUN0M965UR4O,764006770,Kooshmeister,"[3, 3]","Oh great brothers of the night, who rideth out upon the hot winds of Hell, who dwelleth in the Devil's lair; move and appear!The small Utah town of Santa Ynez is, in time-honored horror movie fashion, have its tranquil peace shattered. Teenagers Pete Keil and Suzie Pullbrook's leisurely early morning bike ride is rudely interrupted by a spectral black sedan which crushes Suzie against a guardrail and knocks Pete screaming off of a high bridge. Subsequently, it also brutally runs down a hitchhiker.The local police, led by Sheriff Everett Peck, attempt to deal with the situation. But when Peck becomes the car's fourth victim in a hit and run right outside of the police station, Deputy Wade Parent must step up to the challenge. As the son of a sheriff himself, Wade has a lot to live up to. He's a recent divorcee, with custody of his two daughters and is also dating their teacher, Lauren Humphreys. Everyone takes Everett's death pretty hard, and with Wade as sheriff-by-default, he makes it the personal mission of Santa Ynez's police department to bring the mysterious motorist to justice.But the intimidating sedan is more than meets the eye (and no, that doesn't mean it's a Transformer). After terrorizing Lauren's class and chasing them into a cemetery, where it refuses to follow, a high-speed police chase ensues wherein the car proves not only bulletproof, but apparently indestructible, as it takes out two police cars using its own momentum by doing a barrel-roll over them and crushing them. Wade himself becomes convinced there may not even be a driver in the thing after all, especially after he and he alone gets a glimpse past the car's tinted windows...The Car is what modern horror movies wish they could be. Now, granted, the idea of an evil, driverless car (a customized black Lincoln Continental) running around killing people is more than a bit silly. But what made me really like this movie was the manner in which the human characters confront the situation. Naturally, they initially assume the car has a human driver, and go about attempting to stop him as they would any other lunatic with vehicular homicide on his mind. But after evidence surfaces that this car isn't what it seems to be comes to light, they change their tactics drastically.There's no Nudge nudge, wink wink self-referential humor or even any real comic relief characters (except for the hitchhiker at the start, who is actually funny and exits the picture before he has a chance to become even the least bit annoying), and everyone generally plays it totally straight, making the absurd plot work. And the final chase sequence and the showdown with the car out in a desert canyon is well worth seeing.",5,There was no driver in the car!,1313280000,"08 14, 2011",-0.2238
44,A346ZE66XLBEVR,764006770,K. Williams,"[2, 15]","The acting is terrible in this movie, which I also blame on the director. About the only special effects in this movie is done by speeding up the film to try to give the illusion of speed, which looks terrible. This film was definitely done on a low budget and it shows. About the only thing worth watching in this film are the women who are wearing very tight pants.The overall plot is not bad though. In fact, I would like to see this film remade with some decent acting and direction, a substantial budget to create the special effects, and a little more substance added to the story.Overall, if you are bored with nothing to do, then watch this movie. Otherwise, your time and money is better spent somewhere else.",2,Bad acting and bad directing,1209254400,"04 27, 2008",0.1863
45,A3GD9BKIUT3I89,764006770,L. Cabos,"[1, 1]","Yes, it is cheesy,more than a tad goofy but I still find a soft spot for this picture. I first saw it at a theatre in Minneapolis when it was released and while, ok, it is a combination of JAWS, DUEL and something ripped out of Hell. Great to see it out in a dvd better than the previous edition (and at a nice price -- unlike the out of stock version). If you are looking for something meaningful to watch -- this ain't it. Still as Howard Hawks (or was it John Ford?) once said, Messages are for Western Union.",4,The Car Returns!,1206403200,"03 25, 2008",0.1201
