,reviewerID,asin,reviewerName,helpful,reviewText,overall,summary,unixReviewTime,reviewTime,Sentiment
0,A3A1OA237FOZFK,B00004YVAJ,#1 Amazon Fan,"[0, 0]","I have had one of these on my key chain for over 15 years now; it's only been replaced 3 times and I use it almost daily. It comes with a removable plastic toothpick and tweezers. I love having a toothpick handy after eating out somewhere and the tweezers work very well. The tweezers do not have the strongest grip because they are very thin and therefore a bit flexible, but I have never had them fail to work and they have very sharp edges for getting out the finest hair and/or splinter.The knife and fingernail file/screwdriver are obviously useful in many instances; the only problem I've ever had is that if you are trying to remove/loosen a very tight screw it might close on you if you press too hard. The implements do not 'lock' into place, so you have to use some caution.The scissors were originally my primary reason for purchasing these and are fine enough to help trim your cuticles and strong enough for smaller cuts. They are definitely not super strong but definitely cut paper and thin plastic easily.Overall, these are a terrific gift for just about anyone and a great purchase for yourself. I've seen them in the store for upwards of $14 but you can get these for less frequently on sale at Amazon.",5,Great Gift & Awesome Every Day Tool for Yourself,1204243200,"02 29, 2008",0.4203
1,A2FII3I2MBMUIA,B00004YVAJ,1K3,"[0, 0]","I bought a few of these for my family. I think I still prefer the rally over this model since it gets rid of the scissors and adds a screwdriver instead. Still, there is a reason why this is a &#34;classic&#34;! You won't be disappointed with this small keychain knife. I would suggest adding an extra keyring so the knife sits flush with your keys. The one keyring it comes with will cause the knife to sit perpendicular to your keys, adding bulk.",5,Classic.,1355097600,"12 10, 2012",0.0749
2,A1HRYC60VTMYC0,B00004YVAJ,Ace,"[1, 1]","I have had and used a Swiss army Knife for almost 40 years. They are wonderful -- I still have and proudly use the one I bought 35 yrs ago -- it's in fine condition (well, the scissors spring is another story...)And for FOURTEEN years I carried a little Swiss Army Knife in my pocket -- the little blade so sharp that even after 14 yrs I could stil slit open boxes and take them apart with this small but mighty vorpal sword. No matter that the scissors spring broke - that has happened on all of mine, and the scissors always worked, with or without spring -- but the rest of the knife stayed intact -- the toothpick rescuing me from awkward situations and the tweezer plucking an errant eyebrow, holding a small part like a mini vise, or rescuing the cotton ball in my ears that sometimes decided that it wanted to meet the other cotton ball halfway (kids, don't try this at home!)I rarely use the lttle screwdriver/file combo, but when I do, it delivers. I like to hold the plastic body of the knife and the bottom edge of the screwdriver at the same time while I am torquing up some screws as I feel that this way I will be delivering an equal amount of energy to a bigger area of the whole unit, thus putting less of a strain on the screwdriver blade.I loved mini-knife #1 -- and almost lost it a number if times, but this time, alas, it is gone..... and I can only hope someone found it and will cherish it as much as I did. How did I lose it? I bought a pair of pants from (NOT Amazon) .... and they were so horrible that the pockets literally tried to regurgitate their contents. I no longer wear those pants, as I almost lost my work ID and bus pass too.Yes I will always miss Mini-Knife #1, and am sad that my faithful friend is gone but I am so happy that I was able to get a replacement - Long Live Swiss Army Knives!!!",5,Loved....and then...LOST!! So I ordered an exact duplicate,1351123200,"10 25, 2012",0.185
3,A3SXM4W15LEIED,B00004YVAJ,A. Dude,"[0, 0]","So you gain a nice, checkered, flatter surface on your classic SD. You lose your toothpick and your tweezers. Sound like a good deal on a multi tool that is that thin and small to begin with?Honest, I was about to order one. How cool would it be to have a larger Alox tool AND it's little brother? How cute would that be if they matched?! But, then I thought about how not having the extra few tools would stink, added to the fact that the classic SD is already super tiny to begin with. So tiny, it literally will disappear if misplaced.. It just didn't make any sense to me.My guess is that if you have an Alox style companion to this, you might want it. But I do, and I don't want it for the reasons listed. It simply doesn't add any value when you lose tools on an already super slim product. You're paying more for less, essentially. I don't like throwing money away, so I'll stick with my classic SD cellidor scales for now. My honest opinion of course. Take with a grain of salt.",2,Don't like it as much as the cellidor SD,1358726400,"01 21, 2013",0.1666
4,A11QRDUT3EV7IA,B00004YVAJ,Amazon Customer and Jason Potts,"[0, 0]","OK, so my main complaint on this knife is, it is seriously the smallest knife known to man. I realize there is a size listed in the description, but honestly, who really expects a Swiss Army Knife to be so small the blade is nearly microscopic? I'm not even sure what task you could actually accomplish with this toy - maybe opening a letter? I got this, intending to give it to my 9-year-old on a father-son camping trip, as a sort of right-of-passage on his journey to becoming a man. Somehow, I don't think it will have quite the impact I was hoping for, given that I lose the knife in my own hand, it's so small.Again, I know there is a description that gives 2 1/4&#34; as a length, but seriously, nobody needs a knife this small. I would return it, except I'm not sure it's worth the cost of return shipping.",2,"What is this, a pocket knife for ANTS!!?",1403654400,"06 25, 2014",-0.0042
5,A26VBYL4T0J9WI,B00004YVAJ,Andy,"[0, 0]","Bought this knife for a friend, the price was good, and it shipped quickly, I have no worries about the quality as I have carried the same one on my key ring for the past seventeen years, and its still going strong.",5,Great for anyone.,1386547200,"12 9, 2013",0.8941
6,A32T2H8150OJLU,B00004YVAJ,ARH,"[0, 1]","I received this knife as a gift a few years ago, and it's been a nearly constant companion of mine ever since. It's not too big, bulky, or heavy to carry in my pants pocket, and it's extremely useful.It's got two cutting blades - a long one and a short one, it has a can opener/small standard screw-driver, a bottle opener/larger std screwdriver, a punch, a phillips-head screwdriver, a built in pair of tweezers, and a plastic tooth pick. I've used the tweezers several times while hiking or camping to remove splinters, etc.This would be a great knife for a boy scout, an adult scouter, or anyone that likes having a pocket knife handy.The steel is high quality, it holds an edge nicely, and sharpens up quite quickly.All in all I have found my knife to be a top-notch item. I'd certainly buy another one if this one were lost, and I'd choose this as a gift for a close friend.5 stars!",5,"I carry it wherever I go (um, except to the airport).",1231718400,"01 12, 2009",0.4611
7,A1X5RAIMX4ZSLJ,B00004YVAJ,BadPotato,"[2, 2]","I will always have a Victornox Swiss in my pocket. They are small, sharp and they have a toothpick and tweezers. Couldn't ask for more. For what I need a pcoket knife for these are fantastic, fairly durable, at least for my uses. If I were doing anything more heavy duty I would carry an Old Timer. But the size of the Victornox and the functionality, I have kids, makes this a sweet tool for me.",5,Great pocket tool,1266796800,"02 22, 2010",0.195
8,AT1T9DMR7V5W6,B00004YVAJ,**** be fair ****,"[1, 13]","ORIGINAL:It is like a Yellow Ferrari :) The color in the picture is faithful to reality. All tool are excellent as expected but beware that this is very small knife. A true keyring thin short knife and micro scissors :)UPDATE:After first use, I noticed that the keyring is at the wrong end of the knife and right end of the scissors. Maybe this knife in reality is a nail-clipper (scissor to clip and file to smooth out and the knife is a novilty that goes with the name. I am updating my review to 1 just so they may listen otherwise the knife is worth 3.5 stars max 4.ACTIONI think we should all update our ratings to 1 for Victronix to listen up or as one of the reviewer said already that he has contacted them since 2o years ago but no one listen.",1,Keyring at WRONG end,1370649600,"06 8, 2013",0.1471
9,A30L3MT5R27336,B00004YVAJ,Bill Welte stickeen,"[0, 0]","I got these as stocking stuffers for my step-kids (they're adults, actually). All of them loved the knife and more than one told me how handy it was and wondered how they got along without them.",5,bought 4,1357084800,"01 2, 2013",0.2997
10,A27AF4DLLOBQDQ,B00004YVAJ,B. Marshall Bronco Fan,"[2, 2]","If you carry one of these, you'll forget you have it. The Alox are extremely thin. High quality.",5,Great every day knife.,1201478400,"01 28, 2008",-0.0754
11,A3KZUAA4F2VQ2A,B00004YVAJ,Book Reviewer,"[0, 0]","Made a great gift to the girlfriend who never had a pocket knife. Now she finds reasons to use it all the time.I should have gotten it in pink, I was told.Great quality product at a reasonable price.",5,Good value,1402963200,"06 17, 2014",0.3953
12,ACIGG98OXH0IP,B00004YVAJ,Brian Turntine,"[1, 1]","This knife works fine, but its much smaller than I anticipated. Please read the dimensions to be sure of what you're buying. Its smaller than a Chapstick tube. This is not the standard size pocket knife as I thought I was buying. I will try and take a photo and post later for comparison. Price wasn't bad, good quality product, just smaller than I was expecting.",3,"Swiss Army quality, miniature size.",1403827200,"06 27, 2014",0.129
13,A12RTXVWYEE3H8,B00004YVAJ,brystler,"[0, 0]",Baby McGyver all the way baby. No need for a big clunky knife when this little one does it just as good. Bonus is that if I lose it then it is inexpensive to replace. Still haven't destroyed or broken one of these. My biggest trouble is forgetting I have it in my pocket when I go to the airport. A few airport security guards now have one nice knife in their pocket.,5,Baby McGyver all the way baby,1388880000,"01 5, 2014",0.2083
14,ABMH1JAWEFY62,B00004YVAJ,B. S. X.,"[0, 0]","Always there for you in a pinch! Also, I love the scissors for trimming my nails and snipping the occasional hangnail. One belongs on every key-ring.",5,Indispensable,1404432000,"07 4, 2014",0.2123
15,A1GNQZ1GV3CW8X,B00004YVAJ,Bubobubo,"[0, 0]",I have had these for many years.They are always dependable little pocket knives.I have one on every key chain in the household.,5,Great,1329868800,"02 22, 2012",0.0
16,A19FRW264WZTGP,B00004YVAJ,Bunson Honeydew,"[0, 0]","Obviously if you do a lot of cutting or need a companion on the trail, this is not the knive for you.If you need an easy to carry companion for every day use and something light for the office, this is for you.I can't tell you how many times I've 'spruced up' before a meeting, needed to put out a splinter, etc. I've had mine for years! It's a great investment.",5,Great sidekick,1233532800,"02 2, 2009",0.3216
17,A2OEZIIK61GDW0,B00004YVAJ,California Doug,"[0, 0]","I didn't know they made white ones until my friend showed me his.Victorinox may be rivaled, but never equaled or beaten!!This is the EDC size including knife and scissors if you wear a suit and can't carry anything bigger.",5,White Classic,1359331200,"01 28, 2013",0.3293
18,A567HBSX35U7X,B00004YVAJ,Call me KID,"[0, 0]","Got it today, way quicker than I expected or was said, it's so cute, it's tiny, got it as a gift for my fathers b-day who has all mac stuff, laptop, phone and think ipod, so this goes along with his style, didn't take it out of the box so as not to finger print it up, though it is really cute and think he will like it. Has toothpick and tweezers. Assuming like my old faithful swiss is sharp as can be though won't find out till he gets it.",5,it's so cute,1311724800,"07 27, 2011",0.5236
19,A342TBVDN0KLDZ,B00004YVAJ,cbass cbass,"[0, 0]",I love these things!! This one was bought as a gift for a niece and I hope she loves hers as much as I love mine. It is really handy. I keep it on my key chain. I don't know what I'd do without it.,5,Swiss Army Knife,1360713600,"02 13, 2013",0.3255
20,A3OXHLG6DIBRW8,B00004YVAJ,C. Hill CFH,"[2, 2]","We own three of these little Victorinox Swiss Army Knives, two of them on our car key rings and another one for my son. This knife has a good collection of tools, including a very good pair of mini-scissors (really!), a nail file and small flat head screwdriver, tweezers, plastic toothpick, and knife.The knife blades were a little duller than I expected, but a few quick passes with my sharpenerAccuSharp 001 Knife Sharpenerput a very good edge on them.We also have several of the larger Victorinox knives as well (includingVictorinox Swiss Army Champion Plus Pocket Knife) and have never been disappointed with any of their products.Highly Recommended!CFH",5,Handy Little Knife - Highly Recommended!,1266624000,"02 20, 2010",0.5653
21,A19ZMZPAR177WN,B00004YVAJ,Chris Retired high level IT manager with the...,"[0, 0]",Just like my other knives I keep one in each car and in my pocket at all times. Love it.,5,Swiss to the rescue,1376611200,"08 16, 2013",0.499
22,A10ZFE6YE0UHW8,B00004YVAJ,C. MacPhail,"[0, 0]","A marvel of compact utility (3/4 oz. -- 2-1/4 long). Put it on your key chain. Except when going through airport security.All handy, especially the toothpick and knife blade. The scissors makes a good nail trimmer in a pinch.Somehow mine is extremely sharp after years of use.- - - Pricing - - -An amazing deal for 11 bucks. Compare alternate amazon listings for the best deal.",5,Perfect for Your Key Chain,1332115200,"03 19, 2012",0.3171
23,A9WHWBYW5XQVW,B00004YVAJ,Corey C.,"[0, 0]","I wear this on my keychain. It has come in handy so many times that I can not count them all. What cracks me up is when, from time to time, someone at the office will ask if I happen to have any scissors, not expecting me to say &#34;yes.&#34;",5,Nice little knife,1353283200,"11 19, 2012",0.0
24,A33UJKYS2F71IO,B00004YVAJ,Dadude34,"[0, 0]","Would make a great first pocketknife for your young ones, or for the car, or maybe even a keychain. Quality product as you would expect from Victorinox. Knife comes really sharp (non-locking), and scissors are surprisingly sharp as well. Highly recommend!",5,Can't Go Wrong,1398038400,"04 21, 2014",0.4024
25,A2QNMPNXW1QAQ5,B00004YVAJ,Darren He in Boston,"[5, 5]","Bought this as a joke/gift for my girlfriend. Yes, it is a bright, hot pink, not a more subdued tone. It is surprisingly small - no longer than two inches in length. I personally own a Swiss Army One-Hand Trekker Lockblade, though, so this may be why I expected a larger tool. The blades are very sharp, and the knife works beautifully, My girlfriend and I are both pleased with this knife.",5,Bought it for my girlfriend,1165881600,"12 12, 2006",0.2892
26,A1JX05R0XF48AN,B00004YVAJ,Dave.E david,"[0, 0]",this is so far the best knife i have owned in my entire life. this is a great knife to go camping or fishing with. this is also an awesome knife for EDC and self defense. i feel prepared and safe with this knife in my pocket.my favorite thing about is that it's made in Switzerland. this is the best knife you will ever own!!!,5,best knife you will ever own!,1344816000,"08 13, 2012",0.5749
27,A22CIR3Q0OUQ2,B00004YVAJ,David Thai,"[0, 0]","Quality Product. Simple, Non-Bulky (Great for putting on keys). Whenever I have to open a package from Amazon, I use this. The box is no match for the knife.",5,Very Handy Tool,1358467200,"01 18, 2013",0.1267
28,A2G4MGVWR20OOI,B00004YVAJ,D. Brown,"[0, 0]","I've owned a couple of these over the years and recently received a new one for Christmas. They are excellent and I carry it on my key chain every day. It's lite, small, well crafted and offers a variety of very useful tools for everyday tasks. And at around $12 they're basically giving them away. For me, it's the perfect key chain tool.",5,Perfect,1357689600,"01 9, 2013",0.4263
29,A2IFY6958MRGEM,B00004YVAJ,D. Deutsch Chance favors the prepared mind.,"[0, 0]",I bought this little knife as a birthday gift for one of my son's friends. The boy is about 12 and loves this knife. I believe that most boys of that age love pocketknives and this innocuous liitle knife fits him perfectly. One of the nice things about giving this knife as a gift was the nostalgic reminder of my own experiences at that age. Now let's hope he's less accident prone than yours truly...,5,Makes a great gift,1343520000,"07 29, 2012",0.68
30,A28WZ4GPNUHK9O,B00004YVAJ,D. Edwards,"[0, 0]","Great gift for an outdoor kind of girl who happens to be part Irish. I got it for a friend of mine for Christmas, and she loved it. It's a good price for a quality SAK from Victorinox too. Either way, there's nothing like a Swiss Army Knife with or without the shamrock.",5,Great gift idea,1200787200,"01 20, 2008",0.438
31,A2VLUFXB2DRHNE,B00004YVAJ,Den,"[0, 0]",These little tools are the absolute best thing you can keep in your pocket for everyday use (but don't bring it with when flying). I have had them for years and they continue to work as if they were brand new. I keep a few handy for gifts as well. They are well worth the money. Highly recommended.,5,The best of the best,1311552000,"07 25, 2011",0.2771
32,A16I6WJUEBJ1C3,B00004YVAJ,doctorsirena doctorsirena,"[0, 0]","This is a great girlie knife. It has the same tools/functionality as the classic Swiss small army knife but looks much nicer. It is clear medium pink translucent with opaque pastel pink and medium lavendar color camo spots. I have not kept it in my pocket, so I can't comment on how the design holds up while rubbing against keys. I keep it on my desk to open boxes or use the other tools when needed. The knife is super sharp, at least when new.",5,Super cute version of a classic,1315612800,"09 10, 2011",0.3665
33,A3CJ7MHAS9IMAM,B00004YVAJ,Dom Miliano,"[6, 6]","I was on a tour bus in Bavaria with 40 of my closest friends when a woman said, Ouch, I broke a nail! I grabbed my Swiss Army Classic, flipped open the nail file and offered it to her saying, This should help. And it did - she was happy but it took about 30 minutes to get it back. That's because someone else used the screw driver to fix his glasses. Another person used the tweezer to pick at a splinter. A fourth person used the scissors to cut some threads and so on throughout the bus. Over the rest of the week, I must have loaned my classic to nearly everyone on the tour.I used to be able to bring it along when I flew, but those days are gone. Now, when I check luggage, I pack it with my toiletries - otherwise, it's always with me. I must use mine every day for something or other. I especially love the scissors. They are sharp and work great at opening CDs, cutting articles out of the paper and snipping loose threads. What else in the world is so good and so inexpensive? Note, I didn't say cheap - because this knife is definitely not cheap.",5,"Indispensable, don't leave home without it",1128384000,"10 4, 2005",0.1903
34,A19800ROWPNGMQ,B00004YVAJ,Doyouremember,"[0, 0]","This is the best keychain pocket knife you can buy. All the basic tools on it are very useful everyday , the scissors are probably the most useful, especially in a office environment.",5,The perfect keychain pocket knife,1385164800,"11 23, 2013",0.6933
35,A30J7WQV0ZNRXG,B00004YVAJ,D. Reinstein marindavid,"[151, 153]","For many years now, I have carried one of these small Swiss Army knives on each of my two key rings - one for work and one for home. Barely a day goes by when I do not take one of them out of my pocket to use once or twice - to quickly file down a broken nail, to tweeze out a small splinter, to cut open a small item with the scissor of something larger by cutting the wrapping tape with the knife blade - the toothpick is used daily! I cannot imagine being without one. Of course, I own larger and more multi-purpose knives, but when it comes to carrying something this handy on a key chain or ring, you just can't beat them!There are two major (authorized) manufacturers of Swiss Army knives: Victorinox, the maker of this particular favorite of mine and Wenger, a reliable alternative brand that makes many similar and some even nearly identical models. I have used both over the years and have found there to be absolutely no appreciable differences in the quality, durability or pricing of the knives. With so many models to choose from, it probably makes sense to decide which features you need and then shop both brands for the best price you can find. But back to the knife at hand, the SA Classic SD Pocket Knife.This is the one of the smallest knives in the Victorinox line. Measuring only about 2 1/4 long and about 1/4 wide, it adds little by way of heft to a key ring. It is a compact knife containing a total of 6 equally compact tools. This is not for the big things. This is a small knife with small tools to deal with small things. With expectations appropriately set, it is unsurpassed in it's usefulness as a basic daily tool.The ToolsThere are compartments on the outer casing of knife - each containing a small appliance. One is home to a small white toothpick that I have found to be entirely satisfactory - except that after a year or two of use, I seem to lose them. I think the molded shape wears a bit over time and repeated use and no longer holds itself snugly in the allotted compartment. They can be easily and inexpensively replaced though at any fully stocked retailer of the knives. On the opposite side of the knife is a compartment housing a micro-tweezer. Because it is so very small and light, it cannot be used as a regular tweezer, but only for light-duty needs. These include, I am pleased to report, removing small splinters and picking up objects too small for my increasingly clumsy fingers!There are three tools that fold into the knife itself, one of which has two uses - actually providing a total of four useful mini-tools. These include 1) a flat spring loaded scissor, a regular blade and a nail file (which, as a guitar picker, I use almost daily) topped with the fourth tool, a screw driver head, small enough to be used for either flat screws or Phillips head screws - providing that they are small enough. Don't misunderstand - the smallness of the tools does not render them either token or useless, but their size is a factor in their usability in real day-to-day life.MaintenanceThis is nearly a non sequitor, but in the interests of completeness, I will briefly address it.Years have gone by before anything beyond simple removal of dust and cleaning the instruments is required. One time, a blade seemed to be sticking just a tad and a quick and very short burst of WD40 took care of it - permanently. The knife is build to last until you decide you no longer want or need it.ValueThere are few things in life built for frequent use without planned obsolescence being figured into their design. This little pocket tool set is, happily, among them. For somewhere around $9., you can have something actually skillfully made that will serve you well and for a good long time. How many things can any of us really say that about?I love mine and would feel not only unprepared, but somehow naked - or at least disabled - were I to leave home without one.",5,I Would Feel Unprepared For My Day Without It!,1179014400,"05 13, 2007",0.1345
36,A2BYV7S1QP2YIG,B00004YVAJ,Dr. Oceanfront Oceanfront,"[1, 1]",I have been carrying a Swiss Army knife on my key rung and backpack for as long as I can remember.There is hardly a day that goes by when I do not need the scissor or the knife.The quality is excellent and I expect to be carrying one forever!,5,Be lost without it,1393286400,"02 25, 2014",0.6114
37,A32B6A532454UD,B00004YVAJ,D. Taylor Tech Gadget User,"[1, 1]","This knife is something I've carried for many years. I alternate between the Wenger and Victorinox versions. The Wenger version has a better spring mechanism for the scissors and is slightly larger overall. I'll upload a picture of both alongside a larger knife so you can compare.This is a great knife; it's amazing how often I use it. I carry it so often that I've lost a few, occasionally due to airport security. This is about as small as could be useful, the Wenger is a little easier to use for my larger hands. I find the file and scissors the most useful. I usually keep the knife either on a keychain or attached to a small tag so it's easier to hold when in use.The knife is made of quality stainless and doesn't rust even though mine has been sent through the laundry many times. In fact it comes out rather clean after a wash in a pair of jeans ;-)4 stars for a very useful tool and part of daily life for many years, not 5 because the flimsy spring on the scissors can get bent and cause problems.",4,Smallest of the quality pocket knives,1332720000,"03 26, 2012",0.3801
38,A3UACABVOF2XF1,B00004YVAJ,ebuyer,"[0, 1]","This is a true Victorinox knife -- great quality, very handy, and I carry it almost every day as long as I've got pockets. The scissors are nice and sharp. Really I use everything on this little knife -- blade, file with scredriver-ish tip, tweezers, scissors, even the toothpick.",5,Love My Little Knife,1383868800,"11 8, 2013",0.402
