,reviewerID,asin,reviewerName,helpful,reviewText,overall,summary,unixReviewTime,reviewTime,Sentiment
39,AZ71F750K09FR,B00004YVAJ,eightGrand,"[0, 0]",This is a nice little pocket knife. I'd rather call it a key chain knife. Perfect size to use it as a key chain.I'm not sure about the quality. It looks like it is only good for very light jobs. But it will be there when I need it because it is with my keys.,4,Victorinox Swiss Army Classic Pocket Knife (Black),1354492800,"12 3, 2012",0.2981
40,AKCIFVS2AO1K2,B00004YVAJ,elchoya,"[0, 0]","a cute little pocket knife.had one before lost it didnt even get a chance to use it, in red color.so i got me another one in white this time,looks cool and cute put it on my keychain that i hook onto my chain on my wallet so i wont lose it .i hope i get a chance to use it this time .will come in handy when i need it.",5,cute,1375488000,"08 3, 2013",0.9249
41,A32MRMQO5KJ7A,B00004YVAJ,Engineer Engineer,"[0, 0]",The aluminum case is thinner than the plastic Classics. I prefer that. Its knurled surface makes it easy to hold. And it's classy.,5,Best Mini,1399593600,"05 9, 2014",0.2202
42,A1A9H230IUTY1F,B00004YVAJ,Eric in CT,"[0, 0]",Very small and light. Right at home on a key chain. The knife blade was very sharp when i received this. While it is not intended for heavy duty use (of course) it is great to have in your pocket.,4,Great for the key chain,1389484800,"01 12, 2014",0.1562
43,AD5D1X1VJTQ4Z,B00004YVAJ,e-shopper,"[0, 0]","I got one of this knife as free item from Swiss army gift pack. I gave it to my 10 years old daughter who is a town boy loves it. It's very easy for her to use and carry it with her. Most likely she use it for craft work. Then she wants her friends to have it, so I bought all different colors for other daughters as birthday gift, even very girlish girl (she got pink one) likes the knife too. It's a very cute and excellent tool.",5,Excellent,1388188800,"12 28, 2013",0.5727
44,AW20PVZIK60M1,B00004YVAJ,fiddlerboy,"[0, 0]",I love this little tool. Very useful and cool. Very high quality as is ALL of the Swiss Army products. Would highly recommend.,5,Great tiny tool,1369267200,"05 23, 2013",0.4383
45,A2Y29IRSI08F0I,B00004YVAJ,Frank,"[0, 0]",I wanted a small pocket knife and this is perfect. The quality is great and the tools are all useful... except the file.,5,Use Everyday,1354752000,"12 6, 2012",0.6812
46,AGLMUF5G8N1PM,B00004YVAJ,FrazierDave,"[0, 0]","now TSA approved, these are the best. I have a knife collection, and I carry a SOG Flashback, a Gerber Dime, and this knife daily. I rarely break out the SOG, the Dime only gets use due to its excellent package opener, but the Classic is in constant use. Mostly, I use the tweezers, toothpick, and screwdriver. I bought one for everyone I know!",5,Everyone needs one of these,1390348800,"01 22, 2014",0.2394
47,A36G9PDHFPWG5D,B00004YVAJ,G. ASH A-OK DIY,"[0, 0]","I've been carrying one of these for about 20 years now. I wonder how I ever got along without it before! I gave one to my father-in-law, and he just rolled his eyes a bit. Now, he doesn't go anywhere without it. Knife, scissors, screwdriver, tweezers....covers just about every pesky little need that comes up and no other tools are available.",5,A Must-have Tool!,1217376000,"07 30, 2008",-0.0953
48,A3NBRSA9SAXQI8,B00004YVAJ,Gibby,"[0, 0]",IBefore I lost my last one I have had several of these little Victorinox knives--I especially like the scisssors and the blade is really sharp and stays sharp. Wish there was some way to prevent losing them.,5,Cute and handy little Swiss knife,1364428800,"03 28, 2013",0.089
49,A3C1GOWBI1PCB6,B00004YVAJ,Greg,"[0, 0]",it is what it is. i knew what i ordered... no biggie... i have been using one for the last 20 years.,4,kind of cute,1329264000,"02 15, 2012",-0.148
50,A1PAAAQQ9UK33A,B00004YVAJ,Greg,"[0, 0]","It's a Swiss Army Classic. It's designed to hang on your keychain. You may read some reviews complaining the scissors or blade aren't very &#34;robust&#34; or it doesn't have this or that. If you want any of that they make SAKs for that. This is if you need a few basic functions on your key chain for cutting tags (knife), trimming loose threads (scissors), eliminating a stray hair (tweezers) or getting lunch out of your teeth (toothpick).Now that the rant on unrealistic expectations out of the way, I can get back to the product. Victorinox continues to do a nice job with the Classic. Quality is what I expect from an SAK, small and functional little knife. I carry it every day just like my Dad taught me.",5,It's a Swiss Army Classic,1363392000,"03 16, 2013",0.0026
51,A1SP6NKC0Y4JWS,B00004YVAJ,harlee mascarenas,"[0, 0]",we purchased this product for my son for his first knife to be used on his scouting campout. he loved it. he still carries it around in his pocket and he used it when he can. it's perfect and a must for everyday use.,5,great for a first knife,1375747200,"08 6, 2013",0.2928
52,ATS4VZ2LSZHYF,B00004YVAJ,harold segars,"[0, 0]","Very good edition to any keychain. I'm very rough on keys and this had held up very well, aside from a few surface dings and scratches it is good as new, no loss of functionality at all. It has a small knife, small emory board/file, scissors (very good function on these) tweezers and a toothpick. Very durable little keychain knife.",4,SAK Classic,1373155200,"07 7, 2013",0.4312
53,ACLHE92ZLG8U8,B00004YVAJ,Heidi,"[0, 0]","I love Victorinox army knives. I carry it on my keychain and it always comes in handy. It's small, but has everything I need in it.",5,Love it,1388361600,"12 30, 2013",0.2123
54,A2DV3OLKUN6MO1,B00004YVAJ,James Littlefield,"[0, 0]",i have used one of these for twenty years with no problem except i tried to cut some thick wire with the scissors and messed them up.. otherwise this is the best tool ever,5,nice,1372723200,"07 2, 2013",0.4512
55,A1VMCB9SBGZSL4,B00004YVAJ,Jason,"[0, 0]","I love these things. Perfect for a keychain. Has exactly the tools you need, and nothing more. Small as you can get to have the tools you need.Funny story, I always have one of these on my keychain and I forgot to take it off when I was getting on a plane. It was confiscated, so I used my phone on the way to the terminal to order a new one with Amazon Prime, and it was waiting at my doorstep when I got home. I heart capitalism.",5,I love these.,1346976000,"09 7, 2012",0.2311
56,A73G8SQOMPM0Y,B00004YVAJ,Jay Barker,"[0, 0]",Better than a pocket in a shirt.,5,The best,1404345600,"07 3, 2014",0.4404
57,A13MM7UES60AAU,B00004YVAJ,Jay Kenney James J Kenney,"[0, 0]","Irish/Celtic Swiss Army pocket knife. I carry it at all times. Never leave home without it. Always have a use for it, it so versatile.",5,Irish/Celtic,1392595200,"02 17, 2014",0.0095
58,AY4C4B0VOFHT,B00004YVAJ,Jeff Jeff,"[0, 0]",Great gift for 11 year old. The accessories are easy to open and close. Rounded edges won't wear holes in pockets. Good size for hands of an 11 year old. Would buy again.,4,Nice 1st pocket knife.,1392336000,"02 14, 2014",0.3343
59,A2I5LVVQ7WXEH6,B00004YVAJ,JEFF SMITH Jeff Smith,"[0, 0]","I have had one of these for 20 years, of course, not the same one as with all it's versatility and usefulness they get lost or broken (when not used properly). Great for gifts, too.",5,Victorinox Swiss Army Knife,1202428800,"02 8, 2008",0.0655
60,A3Q11JB1BTGPW1,B00004YVAJ,Jessica McCormick,"[0, 0]","FYI this is a &#34;mini&#34; knife set. I overlooked the sizing. It works really well though, and despite being small the knife is relatively sharp and sturdy. I really like the scissors too.",4,I'm not very good at reading sizes,1359417600,"01 29, 2013",0.2752
61,A14VMJEA22VY1A,B00004YVAJ,jimmyfergus,"[0, 0]","For a keyring I want as small as possible, and this has exactly the minimum set of features I need. Squeeze a bottle opener in there and it'd be even better (double up with the file?). Also, why not have a double-sided file?Still, this is a great little knife and much nicer IMO than the standard ones with the thick plastic handles.",5,Nice and slim in Silver Alox,1366761600,"04 24, 2013",0.4361
62,A1M8677US5W8KE,B00004YVAJ,JLee,"[0, 0]","practical, basic, good little thing to have on your key chain. Lots of flavors to choose from. Scissors, although small, work well. I have one on my keys and recently bought another to give as a gift item. It was well received. Excellent gift item.",5,"Practical, basic, good thing to have ...",1394150400,"03 7, 2014",0.3654
63,A1LJ1L00Z8DBF3,B00004YVAJ,JNH,"[0, 0]","I have bought these at Target, Walmart, Amazon, and probably other places - I've bought so many I can't remember. My last several have been from Amazon and have been very happy with the service.All I need is a little pen knife and I appreciate the size and the tools that are included. I sharpen the blade when it gets dull and eventually I replace the whole knife when I lose it (like happened the last time) or just starts looking too worn out from being in my pocket with my keys, etc.I expect that I'll keep buying them for the rest of my life.",5,Probably my 10th one,1383091200,"10 30, 2013",0.1217
64,A1ZPY91VE3IDN1,B00004YVAJ,JO,"[0, 0]","Each year, I give these little classic knives as gifts to an assortment of people. With the restrictions on knives on aircraft now, they are always appreciated. Since owning and using these on a daily basis for many years, I have yet to have one break or be problematic. I do oil the hinges every year or so at least, more when the knife is used often. It's the most basic knife without bells and whistles and I love it. They are offered in a wide variety of colors and patterns and usually can be found for $10 or less. The Victorinox Swiss Army Classic Pocket Knife is the best in it's class and at the low cost, it's not heartbreaking when one is lost. It's also nice to have a couple on hand in the gift box for the times when someone compliments mine -- I give it away and know that I have a replacement at home.",5,Classic for a reason,1228953600,"12 11, 2008",0.2632
65,AQTY9J6OD5Y1N,B00004YVAJ,John A. Fleming,"[0, 0]","I love these little seven function knives which are made in Switzerland. It fits easily in any pocket even attached to a keychain. The tools are: knife, nail file, screwdriver, scissors, tweezers, toothpick, and key ring. Although it's not big, I have found that it can be adapted to do many things. The knife you have &#34;with you&#34; is much better than the bigger one you left at home. The scissors and the knife blade are quite sharp and are made from good steel. A friend that I gave one to discovered a new use. If you pluck the tweezers like a tuning fork it makes a musical note. Great if you can sing. The white color is very nice looking.",5,Great Little Knife in a Non-traditional Color,1382659200,"10 25, 2013",0.389
66,AYB4ELCS5AM8P,B00004YVAJ,John B. Goode JBG,"[1, 1]","First of all, great price. This is the classic small Swiss Army knife, only 2 1/4 inches long, but comes with the most basic tools you need: a knife, scissors, file, tweezers and pick. The best thing about it is it's small and not bulky. You can keep it in your car or office for small emergencies. Both the knife and the scissors are sharp. This is a very well made knife, high quality everything, and a keeper.",5,Excellent!,1351641600,"10 31, 2012",0.2667
67,A2NIJAW9HVP7P7,B00004YVAJ,John Fairley,"[0, 0]",I love this tiny little SAK. It's manufactured with very good quality and is super handy to have on your keys.Not a single complaint!,5,Great Little Knife,1379289600,"09 16, 2013",0.6854
68,A2GUALW8JRM3Q6,B00004YVAJ,John,"[0, 0]","Great build quality, functions like a victor inbox should but with a beautiful royal blue color. I would not hesitate to replace it if I ever lost it.",5,Beautiful,1352160000,"11 6, 2012",0.3698
69,A2UEB48LAWFUCW,B00004YVAJ,Joseph jck09,"[0, 0]","As soon as I learned that TSA has announce plans to allow small knives starting April 25, I rushed to my computer and bought a new one.The knife is a great basic tool - small scissors, tweezers, a small knife, and a nail file/flat screwdriver. I wish that it had an LED light, and some mini pliers would be nice, but this is pretty good for a key ring.More detail on the TSA: according to what I've read, the TSA is planning to allow knives under 6 centimeters in length and 1.27 centimeters in width, starting April 25, 2013. I suppose plans could change, but from what I can tell, this should qualify.Update: After some more research, I probably prefer theVictorinox Midnite Manager, which adds a Philips screwdriver, a bottle opener, and a pen, but loses the tweezers and toothpick. This is still a great tool, though, and less pricey, so poke around and see what you like.",4,Hopefully TSA Legal,1362700800,"03 8, 2013",0.5135
70,A3USTSI5NZSXYJ,B00004YVAJ,Josh M.,"[0, 0]",I carry this around on my keychain and use it for daily activities when the need for a tool arrives. This knife is very handy.,4,Very useful,1392076800,"02 11, 2014",0.0
71,A21PVDXV0LQRJF,B00004YVAJ,Josip Juraj Strossmayer,"[0, 0]","To me, these knives are like socks in the dryer. Every so often I just lose one. But like socks, I use this knife daily. Not as a knife proper, but to pick on things, open this or that, fasten or tighten a screw. I finally learned not to use my teeth to rip on packages and find this knife in my pocket instead. The small jeans pocket. This should be a standard issue, everybody should have one and the TSA should lay off. Nobody is going to highjack a plane with this one.",5,The real daily carry,1355443200,"12 14, 2012",0.0386
72,A2TVK0MRET9GPS,B00004YVAJ,JPesky John,"[3, 4]","I have been carrying one of these as long as I can remember, at least 20 years. It is the most usefult single thing I have. My wife always raises an eyebrow when I say that. I call it my WMD (Weapon of Minimal Destruction).This is the Victorinox version. There is also a version made by Wenger. As I understand it, Victorinox and Wenger are at odds about who is the original swiss army knife. I don't care who is right about that, but I think the Victorinox version of the knife is nicer. It's a bit thinner, operates more smoothly, and is finished a little nicer.",5,WMD,1184112000,"07 11, 2007",0.1088
73,A1EH2S92FHWZRP,B00004YVAJ,Just a guy,"[1, 1]","I have owned many different Swiss Army and leatherman knives. In the end, the only things you really end up using are the scissors and the blade. This has both of them - although they are quite small. This is not one of the full size knives. This is more of a keychain knife. Although you will need to be careful not to take this to the airport. I keep one of these in my desk drawer at work and another near the front door (for use opening packages.)",5,Great knife - useful for so many common tasks,1274054400,"05 17, 2010",0.0219
74,A3M55R486M5RUF,B00004YVAJ,Kevin Johnson Kevin on-the-go,"[0, 0]","I've owned several of these knives some I've lost, and some I have given away to friends. I am one of those guys that is never without a knife. I can't always carry a full size pocket knife as a nurse, so when I'm at work this is my blade of choice. It is a simple but functional item. I have used every feature on the knife and they all work like champs! Even when I do carry a full size pocket knife, I still keep this one in my pocket. Bigger blades can be nice but often they are overkill for the average task. It is small, light, non-bulky, non-threatening, and super functional. I don't know any person that wouldn't benefit from this classic little pocket knife. ALWAYS the perfect gift. If you want thinner, go for the alloy one without the toothpick/tweezers.",5,Simple and functional.,1319673600,"10 27, 2011",0.1994
75,A4XJHYZCKFZD9,B00004YVAJ,K. H.,"[1, 1]","I put this on my keychain and use it a lot more than I thought I would. The little knife and scissors are great. The tweezers are handy too. Read the description, this is a small knife, but because of that I can keep it with me and actually use it. I think it was a good purchase.",5,great keychain tool,1225411200,"10 31, 2008",0.2131
76,ARSSOKY64C7QE,B00004YVAJ,KRANZO KRANZO,"[0, 0]",just like the title says. this is an authentic victorinox product and it's a classic. star of david just makes it personal.,5,a classic,1339459200,"06 12, 2012",0.1204
77,A23FM0S3J3JYAL,B00004YVAJ,KRISTOFFER FEATHERINGHAM,"[1, 1]","And I already lost it before I could give it away for Xmas. Nonetheless, I took it out and played with it a little and it's a perfect little knife for a key chain.",5,It's tiny...,1388102400,"12 27, 2013",0.2044
78,AP85QMV9WIZ73,B00004YVAJ,K. S. Mathoda,"[0, 0]",Keeps on ticking. Had my wife's knife confiscated by the TSA recently. This is a replacement. I am sure it will continue to provide great service until lost or confiscated by the TSA again!,5,Old faithful,1396137600,"03 30, 2014",0.1647
79,A1OLKVJAEE2ESO,B00004YVAJ,kylemag,"[3, 3]","This little knife and pocket tool certainly eternalizes its name, classic. It is what every young kid strived for when then were young and for good reason, it is useful, compact and lightweight, and affordable. This triple threat makes the Victorinox Classic a truly useful blade.The blade itself came to me legitamately SHAVING sharp. It will pass the paper cut test with flying colors and will hold an edge for a fairly decent amount of time. I have had mine for a number of months and it still continues to shave. However, keep in mind, my use has been limited and only for small tasks. After all, this knife is TINY. That being said, we must choose realistic jobs for this knife, such as opening mail and small boxes, opening packaging, and cutting that stray strand of string hanging off your t-shirt. The 420 stainless steel blade still will dull, but its easy enough to sharpen with a wetstone or ceramic rod.Next, we need to look at an excellent nail file and screwdriver combination. The file itself works well, not being too gritty as to hurt your finger and not being too soft as to not serve a purpose. It finds that happy medium of comfort and effectivness. The screwdriver tip proves most handy. I actually used this screwdriver on a Phillips that fell out of the inside trim of my truck. Its a '95 F150, so its old and the entire side panel on the door fell off. I located the screw on the ground and inserted it back into the hole and screwed it back in with ease. I would not recomend really putting too much strain on a job like this, but it will offer a temporary solution to an unexpected issue. This tool leaves you prepared!The scissors are also a handy item included with this knife. They are extremely sharp and will precisely chew through paper and other managable materials. Once again, this is small tool that can do SMALL, everyday jobs. Do not try to cut through a chained link fence with this thing. Choose your battles wisely.Like most Victorinox Swiss Amry Knives, this tool includes the reliable and famous tweezers and toothpick. The tweezers are of high quality but do not have precision accuracy as seen with other more expensive pairs of tweezes. But with practice, you'll be able to master the art of splinter removal. The toothpick is essential for those nights out at the restaurant after a nice steak consummution, leaving stringing remains in your bicuspids. This thing will dig 'em out no problem.Overall, this Classic is excellent for a keychain edc knife. Sure, the handles will get beat up and scratched but it only gives the knife more character. Over the past few months I have felt reliant on this handy micro tool and do not plan on removing it from my EDC (everyday carry). The tools are of the reknowned Victorinox quality and will withstand the test of time. I am sure ANYONE would find some sort of use for this tiny, but powerful knife from an excellent company.",5,Victorinox Pocket Power,1305590400,"05 17, 2011",0.15
80,A1O6K9LIC865GR,B00004YVAJ,Landon Cross,"[0, 0]",I love this mini swiss army. I carry it everyday and I use it almost everyday. It is super small and skinny so you don't even notice it in your pocket. I have actually dropped one out of my pocket and lost it before so that can be an issue for others. But I think everybody should carry one of these on them at all times. Highly recommend!,5,A must EDC!,1398988800,"05 2, 2014",0.232
81,A1CCKKNSH3QR08,B00004YVAJ,LanthanumK,"[0, 0]","I purchased three of these, one for my keychain and two for gifts. They took quite some time to come but arrived in near perfect condition. The only defect was that one of them had a deformed but still usable key ring. This is easily replaced. The blades are extremely sharp and smooth. I use mine almost every day and have been completely satisfied with the purchase.",5,"Good quality, great gift item",1357776000,"01 10, 2013",0.2267
