,reviewerID,asin,reviewerName,helpful,reviewText,overall,summary,unixReviewTime,reviewTime,Sentiment
99,A1X4JO8EJ1U5BR,B00000DMB3,Mike London MAC,"[1, 2]","Back in the late 1990s I wrote two articles for a now defunct game website about Ocarina of Time. One is a review of the title, and the other is the how in many ways Ocarina of Time feels like a remake of the eternal SNES classic (and my personal favorite Zelda game), THE LEGEND OF ZELDA: A LINK TO THE PAST. Rather than leave them unposted, I issued them on Amazon back in 2007, one article on the Collector's Edition (Zelda 64 a Remake? and and one on the Regular edition (an actual review of the game). When the 3DS version came out, I wrote a review of that and included both articles on the review as well for bonus content. Originally this review only featured one of the two articles - I am now putting both articles up.Mike London, 9-9-2012-----------------------------------------------------------------------------------This commentary on Ocarina of Time was written as a gaming article for a retro-gaming site back in May of 1999. I was going to post it on Amazon but for some reason never got around to it. Mike London, November 3, 2007Article 1: Does Zelda 64 really live up to all the hype?[Blurb: With all the hype, its hard to be objective about OoT. Is it the best game in the series, or does it have to settle for second (or, egad, third?) best? Is it like Star Wars Episode I, all special effects and no substance? Find out a few thoughts from a fellow gamer!]The Legend of Zelda: Ocarina of Time is easily one of the most hyped games of recent gaming history. In fact, I think I could safely say it IS the most hyped game yet. There is only one thing that can compare to it in terms of hype, and this product is in an entirely different industry. Star Wars: Episode I had the same amount of coverage. Being a big fan of both, of course I've beat the game and have seen the movie. And they have one thing in common. They're both eye candy. But how do they hold up to the rest of the series? In my opinion, The Empire Strikes Back is by far the best Star Wars movie. But what about OoT you ask? How can I defame such an instant classic?One reason mainly. In the original and in The Legend of Zelda: Link to the Past, (I can't speak for Zelda II because I haven't beat it yet) the ending was spectacular. Not the game ending, for The Legend of Zelda was produced in the Stone Age and there was much ending wise, but the last dungeon. Ah, the last dungeon. Only recently (like December 23, 1999) have I beat the first quest of The Legend of Zelda. That last dungeon on Death Mountain was a killer, a true challenge that you had to match your mettle with to get past it, save Princess Zelda and beat that nasty ol' Gannon. It was truly a great dungeon. Now skip on past those five years between the release of the original and the SNES version. What have we here? A dungeon comparable to that in the original Legend of Zelda! Everything is bigger and better in the SNES version, including the last dungeon. Whew, and I thought the original was harder, but no way!Then, in 1993, we see the release of the Game Boy version of Zelda. The Legend of Zelda: Link's Awakening was released to a very receptive crowd. But guess what! No end dungeon! In terms of dungeons, this is the smallest of the Zelda titles (again, not including Zelda II). You beat eight dungeons, and then you go and beat the Wind Fish. Personally, I'm half a dungeon away from completing this Zelda game (Dungeon Seven, which I completed half of, went and beat eight, and now I'm back on the last half of VII). That last dungeon was challenging, granted, but what about that classic end dungeon? No where to be found here. Granted, it's a Game Boy game, and it is huge for that consol. So that offence is not to serious. And we did get a new dungeon, though not the ending I was hoping for, with the Colour Dungeon on DX, which was the rerelease of the classic game for Game Boy Colour.After five long years, The Legend of Zelda: Orcarina of Time was released for the N64. So cool! Link in a 3D adventure. About time too. Mario, the cash cow counterpart to Link, got his 3D adventure way back in `96. Of course, I bought the game. And of course, I beat it. It is an excellent game. Truly it is one of the great classics. But one flaw keeps it from edging out The Legend of Zelda: Link to the Past. The end dungeon absolutely sucked. That is my only disappointment with that game. As I was nigh the close of the Shadow Temple, I was really looking forward to getting into Gannon's tower. I was expecting a great closer dungeon, just like in Link to the Past.[Spoiler: If you haven't beat the 64 version of Zelda, don't read this]What did we get? Instead of a great closer dungeon, we got a door way that was blocked by barriers. What did we have to do? Go thru six rooms and beat whatever was in them, then go and shoot the barrier corresponding with each temple to open the pathway. And what did I get? A great disappointment. Sure, this might have been a good way to end a novel or something, but to end a Zelda game like that was horrible. The Game Boy was forgivable and acceptable, but this ending to Zelda 64 was truly despicable. That has been my biggest disappointment with the Zelda series.[Spoiler Finished]Others say The Legend of Zelda: Ocarina of Time is the best Zelda game. I have to disagree. Don't get me wrong. It is easily one of my favorite games of the N64. It's a great game, very innovative (espically that nifty Z Targeting feature) and an epic in its own right. But for what the system is capable of, The Legend of Zelda: Link to the Past beats it out of the coveted title of Best Zelda Game. LTTP is huge. It fully utilized the SNES technology. It had a full twelve dungeons, two of which the sole purpose was to beat the bad guy, and not try to retrieve any medallions or crystals or pendents or pieces of triforce or what ever. That's one more than the original has. (LoZ has one closer dungeon for each quest.) After you beat the bad guy twice, you go and fight Ganon. There were plenty of side quests for an SNES Zelda also. Overall, for the system's capabilites, LTTP is my favorite.But what about The Legend of Zelda: OoT? My two chief complaints are these:1. Weak closer dungeon (as I spent a good time detailing up above).2. Not enough bad guys to kill in the Overworld.All other Zelda games, including the black sheep of the family (Zelda II), has plenty of bad guys to kill in the Overworld. But what have we in OoT? A few measly skeleton dudes at night, and some giant flying plants that you can hardly get too in Hyrule Field. Give me the old Zelda with bad guys streaming at you in every new screen. For all the time they put into it, you don't think it would be to hard to correct this problem.Then we come to another mistake Nintendo made in the N64 version of Zelda. Granted, LoZ had two main tracks, one being the Overworld theme and then the dungeon theme. They could have had more variety, but it was back in the Stone Age. That Overworld Theme became pretty much the theme of the entire series. And guess what they decided to omit music wise from OoT? The Overworld them from the original LoZ! I couldn't believe they did that! Hopefully we'll see it in Zelda Gaiden. Maybe the Triforce will show up in that game too. Just a thought.Now, after railing on OoT for a great majority of this article, you may think I hate the game. Quite the opposite, really. It's a great game, and worthy to be in the Zelda Series. (Gee, it sounds like I'm defending Zelda II, which I've already done in a separate article). But it has been the single most hyped up game in the history of Nintendo, and it is totally out of balance. Great 3D game, but would have been better had it corrected the problems I stated above. It's a fun game, and I had a great time beating it. It provides a lot of enjoyment. But, just like Star Wars: Episode I, it just can't live up to all that hype? I wonder if any game (or movie) could actually.[May 9, 1999. An article originally written for NintendoLand.com. I've written four released articles and one unreleased article (dealing with SMB 2). It will have to be edited. Also, perhaps incorporating part of the structural symmetry article.].....--------------------------------------------------------------------------Article 2:[Originally this was written for a retro-gaming site back in early January, 2000. It has never appeared on Amazon.]Zelda 64 a Remake?[Blurb: Zelda 64 and SNES Zelda has several similarities, almost to the point that the basic game design of Zelda 64 is a remake. Read here for more information on this intriguing phenomena! Just a few thoughts from a fellow gamer!]After playing the course of The Legend of Zelda: Ocarina of Time, I've noticed something very intriguing about it. It seems to be a rehash of what I feel is the best Zelda game: LoZ: Link to the Past. Why do I say this? I say this because there are several structural symmetries that lie between Zelda 64 and LTTP.Lets examine it. For one, there are three pendants you have to acquire in LTTP. This is after you go and rescue Zelda and leave her at the temple. Well, this time around, you don't rescue Zelda, but you do go and talk to her. After that, when you get the three pendants, you go and she is kidnaped. This is after you get the Master Sword in the Lost Woods. In Zelda 64, you go thru the first part of the quest, getting three spiritual stones. After you get those three spiritual stones (which I think the tower on LTTP is much better than that d----- Lord Jabu Jabu's belly. I hated that dungeon! =)), you go to the town. Guess what, as Link approaches, there it cuts to a cinema, and Zelda is kidnaped by Ganondorf. Hmm . . . haven't we seen this story before? It turns out that you have to get 5 of the Sage's medallions. Rauru conveniently gives you one, so we can cut the sixth one away. Only by getting the six sage medallions can you open the bridge to fight Ganondorf. How intriguing.In the superiour SNES Zelda counterpart, it is seven crystals, and you don't get one given to you. Link wakes no sages this time. Instead, the seven maidens of the wise men descent have been hidden in deep dank dungeons, and Link has to transverse thru 13 dungeons all together, 5 the first part, and eight the second part. They are challenging, fun, and intriguing. Granted, Zelda 64 has some great stuff. But it is not as consistent as LTTP. After you have gone thru the seven dungeons (two more than in Zelda 64), you now have all seven crystals. That's great! Now, go to Death Mountain, and by doing so you will open the way to Ganon's big bad temple.Okay, what do we have in Zelda 64? You go and get the five medallions, plus the one that Rauru gives you as Link. Guess what? Now you have to go to his tower, and open the rainbow bridge with the six medallions.* Hmm . . . isn't that what we did in SNES Zelda? Why, I do believe it is, Watson!Another issue yet addressed is the Light World/Dark World. Zelda 64 does the same thing, save this time it is time traveling (I'm not even going to go into the impossibilities of time travel on this . . . that's a whole separate article in itself). In SNES Zelda, you have a little mirror the old man gave you. There are eight transporters located thruout Hyrule, transporting back and forth. If you are in the Dark World, you can use the mirror to go into the Light World, making a temporary transporter. Well, in Zelda 64, there is no mirror or transporters (the closest to a mirror is the Lens of Truth, found nigh in the Shadow Temple). But if you go and put the sword back, then you go back to being young. That creates two versions of the same world to explore. That structural symmetry corresponds to LTTP. Not only that, but at the end if the first three stones, Link goes to the Temple of Time and gets the sword. This is after the three Spiritual Stones goes into place. Hmm . . . isn't that what happened in LTTP? After getting the three pendents, Link goes to the Lost Woods and retrieves the Master Sword. But he cannot do that until he has all three pendents. Well, that's the same in Zelda 64. He can't get the Ocarina of Time, now can he retrieve the sword, until he wins the corresponding three spiritual stones. I swear I've played this game before . . . . ; )The real question is why did Nintendo do this? Well, Miyamoto is a great gamming god, but as far as stories go, his team is not that good at having connecting story lines that make sense. Again, another article, another time. The structural symmetries lying between Zelda 64 and LTTP is quite frightening. Who knows why they chose to do that? Granted, the story line is different, but quite a few of the fundamentals behind both pieces are indeed the same. In review:A Listing of Structural Symmetries between SNES Zelda and Zelda 641. SNES: First Part, Link goes and retrieves three pendants after rescuing Zelda. This is to get the Master Sword. Upon doing so, and after giving the Pendants up to retrieve the Sword, Zelda is kidnaped.2. N64: Link, after receiving a mission from the Deku Tree, goes and wins the three Spiritual Stones. Upon doing so, he goes to Hyrule City, but not before learning Zelda is kidnaped. He places the three Spiritual Stones in their place, and the Door of Time is opened, and there the sword is. Retrieving the Sword, goes to the Temple of Sages, or whatever it is called. Is given first Sage Medallion.3. SNES: After winning the three pendents, Link must now go between two versions of the world (Light World/Dark World). Link must go back and forth between the two worlds to beat the game.4. N64: In this great stunning adventure, Link must go between two versions of his world. One is when he is young, the other when he is an adult. This is achieved by putting the sword back in its pedestal. Just like in SNES LTTP, Link have to go back and forth to finish the game.When he is an adult, things are noticeable more evil, for Ganon's power has grown.5. SNES: One version (Light World) is good because not corrupted by Ganon. Version II (Dark World), is an evil corrupted version of the Light World.6. N64: One version (Young Link's world) is not corrupted by Ganon's evil. Ganon has just recently showed up. Version II (Adult Link's world), is an evil corrupted version (albeit older) of Young Link's world. The only difference is in one its two different versions of the same thing, in Zelda 64 it's the time barrier. But for game play, they're the same.7. SNES: He, Link, must recover seven crystals hidden in seven dungeons (sounds logical). With the maidens' power, they will open to door to Ganon's castle.8. N64: Link has to recover five medallions to open Ganon's Tower.9. SNES: The (massive) closer dungeon is a tower.10. N64: The (weak) closer dungeon is a tower.11. SNES: After beating Ganon, you save Zelda, who had been kidnaped. Although one could argue you save her in Turtle Rock, she is still imprisoned in the Crystal with the other maidens, each in their respective Crystals.12. N64: Sticking to the standard Nintendo story, after recovering the medallions and beating Ganon, guess what, Link saves Zelda. There's a shocker.13. SNES: There are various mini-games, heart pieces, and extra things to do. This trend is continued in Link's Awakening also.14. Zelda 64: Stuck with the trend of mini-games, four heart pieces to make a heart, and extra things to do.15. SNES: In some of the houses, you can find a picture of Mario on the wall.16. N64: In Zelda 64, after meeting Zelda, look out the window, and you can find some pictures of Mario, Luigi, Bowser, and the Princess. Yoshi also comes up. Malon and Talon wear Bowser amulets also. Just goes to show, Nintendo likes cameos.As you can see for yourself, the various structural symmetries between Zelda 64 and SNES Zelda is quit a few. If Miyamoto wanted to do a remake of LTTP for N64 that's what he should have done, I suppose. This, as far as story goes, is pretty much an update with little changed. Its like they took the game's basic plot, changed the circumstances and added where appropriate, but allowing the basic structure to stand. And, although both are great games, sadly, SNES is better, consistently with each dungeon getting a little harder and more complex. But I love Ocarina of Time all the same. This just helps support my believe that Nintendo is first and foremost a gaming company, not a writing company.*In all previous Zelda games, the end dungeon was in the mountains. This is the first game in the series to break that trend. The first three (Zelda I, II, and LTTP) their dungeon was in Death Mountain. Link's Awakening, Link's only Game Boy adventure (currently) is in Tal Tal Mountains. At least we have something that broke one of the several trends running thru this classic series.",5,Does Zelda 64 really live up to all that hype?,1193961600,"11 2, 2007",0.0711
100,A1OZ5AQ5A0N9YO,B00000DMB3,missmegan301,"[0, 0]","This is one of the best games I have ever played. I love the gameplay. It was easy to control the character. I also enjoyed how it wasn't a very easy game. When a game is challenging, I play it more and more. In fact, I still play this game today. Very good game.",5,Great Game!,1060214400,"08 7, 2003",0.4723
101,A1RXIKG68FAQYO,B00000DMB3,Mr hip hop,"[0, 0]","This is the 2nd best Nintendo 64 game to date right behind Golden Eye 64. We all know that Golden Eye 64 is impossible to top, but this comes damn near close.Zelda Ocarina of Time is a classic. Five stars plus. Matter of fact this is the best Zelda release I have ever played. And I have played them all.The graphics really show what the Nintendo 64 is capable of putting out along with other classics like Mario 64 and Golden Eye. The graphics are amazing and are top notch.The storyline is even better. Most good RPGs have more than just one single character. This game however only has Link and still manages to become a classic like most of the other Zelda titles. No this game is no Final Fantasy IIV, but in a way this game is better. Maybe not as long, but the storyline is a little bit more creative and catchy.Ocarina of Time offers a little bit more &quot;extras&quot; than the previous Zelda titles have to offer. You can collect extra items along the way for personal score to see how good your discovering ability is, and not just finding pieces of hearts. There are so many secrets with this game.I would suggest you dont use the strategy guide until you have completed the game. If you do, then you are cheating yourself and making the game not even worth playing. Beat the game and then look at the guide to see what you have missed.Overall, I spent a lot of time on this game. I could have beaten it a lot faster, but that wouldnt be any fun, because the fun part is discovering the secrets within the game itself.Buy the game and see for yourself. This isnt exactly a hard challenge of a game, but it isnt exactly that simple either. Just right. Get it today!",5,The Second Best Game for the 64,1004486400,"10 31, 2001",0.2417
102,AXKDNVCNN50RZ,B00000DMB3,Musicman1967,"[1, 2]","(Note:This is the Gamecube Collectors Edition version)I remember ten years ago,seeing the commercial for this game.I always did wonder what it was like.After getting the collectors edition I immediately got started on it.The story focuses,as always,on Link.Link is a young boy living in the Kokiri Forest.One night he has a nightmare,and wakes to discover a fairy named Navi,who will help him through his journey.He is overjoyed but then discovers that the gaurdian of Kokiri Forest,the Great Deku Tree,is dying from a curse.The tree passes along a Spiritual Stone and recommends to see Princess Zelda.Link does so and Zelda tells him to get the other two spiritual stones so Link can get the Master Sword to stop Ganon,King of the Gerudos,from entering the Sacred Realm and stealing the Trifoce,a divine relic.Link achieves the other stones and the Ocarina of Time.Link draws the Sword and finds out he has been tricked by Ganon,who entered the Sacred Realm.Link awakens seven years later,and after discovering he is now an adult,meets Rauru the Sage of Light.According to Rauru,the only way to defeat Ganon is to awaken the Five Sages.That is where the true quest begins.Wow,what a story!Now,the graphics are not bad by today's standards.Neither are the dungeons.They are amazing.And also very complicated.(Please don't mention the Water Temple).Overall this game can be summed up by one word:Perfect.Buy the game,become the hero,and have the time of your life.",5,A Epic Masterpiece,1203120000,"02 16, 2008",0.6103
103,A37166GI3OOCZO,B00000DMB3,nafysmiley,"[4, 4]","Ocarina of Time is a massive, epic Action/Adventure game out for the N64. Many have been tempted to call it the best game ever (just read some other reviews) but I would step back from that. It is still one of my favorite games, despite the fact that I play mostly RPG's. By the way, Zelda is not an RPG, even though you do talk to people and have a sword.In Zelda you play as Link (Zelda is the princess, not the main character) as you go on a quest to save the world from the evil Ganondorf by freeing each of six spirits from their different temples. You change between times, where you are adult or child Link, and you have to switch often, and do different things in both, and each time has different weapons and items. The time-traveling aspect of the game is one of the coolest parts.The real-time combat is a lot of fun, and fairly well put together. It involves a 'Z-targeting' system in which you can select a monster and then keep it in the center of the screen and move around it. The fights against other monsters with swords and shields are great as a result. Z-targeting is not perfect, but it works well.The dungeons are all awesome, and very unique. Each dungeon is mostly based around one particular item or weapon, its own gimmick, but despite that they really don't seem forced, and stay fresh all the way through (although, the last couple dungeons aren't nearly as long as the others, almost like the designers started getting bored). For the most part the dungeons aren't too difficult if you know what to do, but it is very easy to get stuck if you don't, and the game often leaves you on your own to figure out what to do, especially on side quests, so having a good walkthrough nearby is helpful.The overall story isn't too great (for the most part, save the princess), but many of the individual events and side stories are neat. The characters and different races which populate the world are cool, especially the Gorons, which are one of the best races ever. The bosses of each dungeon are awesome, as well as being original, and can usually be beaten by hacking them up, or through the use of special tactics. It's always good to have a choice.Despite how good it is, Zelda isn't perfect. The graphics, for example, are nice, but they are old, and on the N64. The music is okay, but mostly just ambient, and the classic Zelda overworld theme is conspicuously missing. Having to constantly change which items you have equipped is also annoying, even if there isn't really a better system available. Some would say Zelda has an almost kiddy atmosphere and suffers from an occasional lack of seriousness (I would tend to disagree). And of course, the fairy is annoying, but no reason to like the game any less.All in all, Zelda is a great game, and a must buy for any N64 owner, as it is one of the best Action/Adventure games ever. If you are looking for an RPG, look elsewhere. This isn't one. And be prepared to get a little frustrated. Zelda is pretty long, especially if you do everything there is to do. Maybe 25-30 hours if you run straight through, but it could take many more depending on how much extra stuff you do, or how often you get stuck. Have fun.",5,Zelda is cool,1025740800,"07 4, 2002",0.2431
104,AU5S32OI6N04K,B00000DMB3,Nelson,"[0, 0]","I first started playing Ocarina of Time from a good friend of mine. The graphics are really cool and it shows realistic images of stories. I don't see why anybody would give this game only 1 star. I sure enjoyed the good pictures of this game. Next time I'm in a video game store. I am going to buy this game. First of all, the adventure begins when this little boy is at home sleeping. A fairy comes to him and wakes him up. Then you have to find this sword and find the Great Deku Tree. I never get tired of this game because you travel to different places accomplishing many tasks! There are many items you can use too!I think The Legend of Zelda: Ocarina of Time is even better than most playstation and playstation 2 games! It is just that good to me.If you ever see this game in a store, buy it. You will have a good time with this game!",5,This game is the best nintendo 64 game!,1019779200,"04 26, 2002",0.3692
105,A2QH5NMHW1KTJ1,B00000DMB3,newfound32,"[0, 1]","This is truely the best game for 64 becuase link is so cool. This is probabaly the best zelda game. Ganondorf is the man and you beat him in this game. If you havent played this game, i dont know but anyways in this one you could be big link and little link. Not like in majoros mask where you could only be little link. This game is way better than majoros mask. If you still have 64 (get a gamecube, so you can play windwaker)you need to get this great game.",5,THE BEST GAME FOR 64,1077494400,"02 23, 2004",0.3272
