,reviewerID,asin,reviewerName,helpful,reviewText,overall,summary,unixReviewTime,reviewTime,Sentiment
64,A37T0C2H6PB2K4,B00000DMB3,IMF Agent Sam Fisher IMF Agent Sam Fisher,"[0, 0]","The Legend of Zelda: Ocarina of Time is, simply put, the best adventure game I have ever played. I'm a newcomeer to the Zelda series, so I'm not too sure how Ocarina rates with the others, but I love it. For an Nintendo 64, the graphics are absolutely beautiful. The lighting rivals that of a Playstation 2 or Xbox or Game Cube. The sound is terrific. Each different sound effect was done in detail. The sword against stone and the sword against wood are not the same as in a lot of games and sound just like they should. The echos when you enter the room and the monsters roaring in the distance are incredibly realistic and Link's footsteps are done perfectly. The puzzles are challenging, but not so that you want to through the controller down in frustration but so that you won't put the controller down until you've figured them out. The minigames and the sidequests will keep you playing long past the time you've beaten the game itself because they are so plentiful. The controls take some getting used to but are perfect for the game's combat system. The targeting especially helps the later you get into the game. The music is captivating and is very well done. Overall, I think this is one of the best games ever, not just in adventure. It's definetly a game anybody with a Nintendo 64 should have.",5,The best adventure game I've ever played,1079913600,"03 22, 2004",0.314
65,A3NX4BDGUR8O3C,B00000DMB3,Jacob,"[0, 0]","WHat a game. I have played Zelda For Nes, Snes, and now the N64 A link to The past was a great game but this is the best Zelda game. The graphics are graet. Teh temples are huge. This is the best game for the N64. Majoras mask is great too but this one is better. Sp i reccomend this game to everyone. It truly is one of N64's best. Can't wait to see Zelda on Gamecube",5,Deserves 10 stars,1001635200,"09 28, 2001",0.3754
66,A1ZD3UNBZX8WG2,B00000DMB3,James Sutter,"[0, 0]","I love this game! You can't say that you are a Zelda fan, if you don't own this game. This game features an awesome storyline, unforgettable characters, and just keeps getting better. You could play this game forever, and not get tired of it! If you have a N64 system, you better own this game! Or if you have a Gamecube, you should have the Legend of Zelda Collectors Disk!",5,The best N64 game!,1115164800,"05 4, 2005",0.4826
67,A3OMBKL5EOHA36,B00000DMB3,Jami Blackann,"[7, 8]","Unless you've been living in a box your whole life, chances are you've heard about what an incredible game this is. Nay, I will go as far as to say perfect. Even if you haven't grown up with the Zelda series, you're still likely to find this game quite enjoyable. It's safe to say that this game was nothing short of revolutionary, and it continues to be one of my favorite video games of all time.The story begins as a young Link awakens in a small tree hut. Staying true to past games, you start off with no items or weapons. You soon learn that the Great Deku Tree wishes to see Link, and thus you set out to explore Kokiri Forest. Upon taking your first steps outside, you meet the elfish inhabitants of the forest. While you search the area for a sword, you have time to get accustomed to the controls and the environment. Once you have sufficiently explored the forest and gathered the required items, you head for the Great Deku Tree, accompanied by your faerie friend Navi. After completing this first dungeon, the Deku Tree explains the history of the Triforce and rewards Link with the Spiritual Stone of the Forest, thus setting the story in motion.The graphics of this game are fantastic for its time. You can now journey through a fully navigable 3D map. The details of the environment properly capture the mood of each setting, be it a forest village, a watery temple, a haunted underground maze, or the inside of a giant fish's belly. The map of Hyrule is pretty expansive and full of places and objects to explore. The cinematic sequences look great and tie the segments of the story together well.I absolutely love the controls in this game. Everything is pretty intuitive: the A Button is used to execute actions, the B Button swings your sword, and the C Buttons allow you to store up to three items to use during play. You're able to roll and jump, swim and climb, block attacks, stab, and build up power for swing attacks. But the greatest addition to the control features is the Z Targeting ability. This function allows you to lock on to people and enemies and focus a particular action on the targeted object. Moreover, this button will focus the camera directly behind Link, allowing you to have control over your point of view. To this day, I compare games' camera controls to Ocarina of Time, often wishing for that very desirable Z Targeting capability. A great addition to your supply of character controls.The story itself builds upon previous games in the series, for we interact with familiar characters like Zelda and Ganondorf in addition to many new individuals. As always, there are a whole variety of weapons and items to collect during your travels, some that are familiar and some that are new to this title. What makes this game even more engaging is the idea of traveling through time. You begin the story as a child, growing as a warrior and searching for the Spiritual Stones. When you travel into the future, the world has become darker and your missions more challenging. There is a constant interplay between the past and the present as you try to make your way through the dungeons and numerous side quests. The multitude of puzzles, games, and items to collect makes this story very immersive and entertaining. The endearing characters that you meet provide for a rich, enjoyable plot, furthering your adventure along with their dialogue and aid.And the game would not be complete without sound. Again, Ocarina of Time gains a perfect score here. The sounds that Link makes when he fights, moves, and interacts with others are both enjoyable and believable. The echoes that your character makes are varied depending on what type of environment he is in. Likewise, the soundtrack is just as appropriate. Each level has a different musical score, and each song blends in beautifully with the surroundings. Also, some of the songs are familiar tunes from the previous games, transformed just right for a sound that is nostalgic, yet new. The ocarina songs are appealing as well, adding another interesting component to the gameplay. Ocarina of Time really has a wonderful soundtrack, and even today I still enjoy listening to it.All in all, this game is truly a classic, and yet another impressive sequel in the Zelda series. From the sensible controls to the superb storyline to the awesome soundtrack, Ocarina of Time is a gem in the adventure game genre.",5,Extraordinary! A game that set the pace for many adventure games to follow.,1150675200,"06 19, 2006",0.339
68,A10XUQ4D8N0DOM,B00000DMB3,jbbj000,"[0, 0]","simply the best. great story, great graphics, great control, great replay value. it is true, n64 wasnt that great of a system, with pretty horrible games. i bought it back in 98 and up until i got my ps2 i only bought a few games for it, Zelda: ocarina, Zelda: Majora, Goldeneye, Perfect Dark, and DK64. There may be other good games but this game is by far the best, not just on n64 but possibly out of all video games ever. trust me people, if i say it is good, it is good. I dont give out good reviews very easily.",5,Only 5 star review i have given ever,999302400,"09 1, 2001",0.5312
69,A259W5KIP41XFL,B00000DMB3,Jennifer A. Everhart,"[0, 0]","The Legend of Zelda: Ocarina of Time is really awesome, but how awesome? Is it the best of the Legend of Zelda series so far? Oh, undeniably, but that is not the point. My point is that it was the best game for the Nintendo 64, with Super Mario 64 and its direct sequel, Majora's Mask in a second place draw. It shows how the franchise began. Link sets off on a journey to save Hyrule from the evil Ganondorf for the first time. He meets Princess Zelda on the way, and when she flees from Ganondorf, she leaves the Legendary Ocarina of Time in Link's possession. He uses it to travel through seven years with the help of the Master Sword. The graphics were neat for the time, the storyline was really exciting, and there is a lot of stuff to collect. The dungeons were challenging, and the boss fights are neat. If you are a fan of Nintendo, please pick this up. You will be glad you did.",5,The best N64/Legend of Zelda game of all time,1244678400,"06 11, 2009",0.3552
70,A3BC8YL69NOCUP,B00000DMB3,jmpg,"[0, 0]","With almost three years in the making, how did The Legend of Zelda: Ocarina of Time stand the test of time itself? As a prequel to the entire Legend of Zelda series, it has caught heavy anticipation. Ocarina is a prequel to the events before A Link to the Past. Link is a child, whose destiny is to save the land of Hyrule from Ganon (Gannondorf here) by traveling through time. You'll meet up with other characters in the adventure and interact will fellow Hylians, Kokiri, Zoras, and other civilations who aid you on your quest to save Hyrule. Ocarina of Time is one of those controversial games that the series has carried all along. In the end, the game is an Action/RPG, and should never be classified in the style of traditional, turn-based RPG's (like Final Fantasy).New additions to the series are automatic jumping and Z-targeting. The emphasis of the Zelda games has always been puzzle-solving and dungeon arrangement. You also build your attributes, receiving items including the Ocarina, learning songs whose purposes range from teleporting to opening doors to time traveling. Along with mini-games, hidden items and side quests equal, its a worthwhile experience. Graphics-wise, Hyrule never looked better and most effects in Ocarina of Time are outstanding. No need for sharp visuals and smooth framerates, but rather focus on detail and designer talent. The real-time cutscenes and the passing of day and night are impressive. The sound also holds its own on this cartridge format. The themes of Zora's Domain and Gerudo Valley are music to the ears. Zelda fans will remember tunes of Kakariko Village and Zelda's Lullaby. A big plus is that all the sound effects from previous Zelda games have made a comeback.In the end, The Legend of Zelda: Ocarina of Time makes the cut. Even though the gameplay consists mainly of dungeon-dwelling and puzzle-solving, the impressive graphics, quality sound and everything that's been obtained from previous Zelda titles will keep fans and non-fans alike entertained. It's fun.",5,Link grows up,1055980800,"06 19, 2003",0.2152
71,A8N0WM620H8RP,B00000DMB3,John Salerno,"[0, 1]","Ok, I figured I'd throw in my opinion as well. Mainly, this review is for people who have not played the game yet and are wondering if they should. Perhaps you aren't too into RPGs or whatever, so it is my job to convince you! First off, it's more of an RPG/adventure combination, since it doesn't use conventional RPG techniques like turns or experience. But that is a good thing, because the way the game is structured allows for near-total freedom as you play it. Yes, like some people have said, you must beat the dungeons in a certain order, but there are about a million other things you can do whenever you want, and that just expands the boundaries of this game even more. It is truly the greatest game I have ever played, that is no exaggeration. The graphics and the sound are wonderful, the puzzles are NOT as easy as some people are saying -- the Water Temple is maddening! -- and the character development and depth of play is unmatched.Majora's Mask is almost as good, but what makes Ocarina of Time better, in my opinion, is the fact that it is sort of the &quot;ultimate&quot; Zelda game, meaning it starts from the beginning and recreates the entire story of Link and Zelda and Ganon, and it is a completely stand-alone and definitive game. Majora's Mask, on the other hand, takes place right after the events of Ocarina of Time and has a very different structure. The three-day cycle you must live through makes for an extremely enjoyable game, but the only downside is you can't take your time and relish everything like you can in Ocarina of Time.Either way, though, Ocarina of Time is a beautiful game.",5,Truly the greatest game...,1007337600,"12 3, 2001",0.4418
72,A1J1B8IHW9W848,B00000DMB3,Jon Mcfly,"[0, 0]","The best game I ever play. In fact, I beat this game in a week. It's a good deal and is worth the money.(big time)",5,1# on my list,976492800,"12 11, 2000",0.3377
73,A2A8XM52IYN8EB,B00000DMB3,Josh Foot Phil,"[2, 3]","I have played many many many video games in my life, and this game is literally the best game that I have ever played in my life. It's nice and long (like all the other Zelda games) It has a perfect level of difficulty, there are so many different weapons in the game, there are so many memorable dungeons and fields in the game, well, I could go on forever. I wish I could give this game a higher score than the measly 5-star rating Amazon.com forces me to give but alas, i cannot. If you own a Nintendo 64, BUY THIS GAME RIGHT NOW! If you don't own an N64, you can still buy it for gamecube, it's the same exact game. I own it for both N64 and Gamecube. If you like this game, then buy the sequel too! It's called Majora's mask. I'm telling you, you will definetly not regret buying this game if you are a die-hard Zelda fan... Or even if you are not a die-hard Zelda fan. Although I don't know who would be reading a review of a game that was made in nineteen ninety-something, in 2007... IF YOU ARE READING THIS, BUY THIS GAME RIGHT NOW, AND IF YOU DON'T YOU ARE MISSING OUT!! Everything about this game is perfect!... That is all.",5,This is the best game that i have ever played...,1195603200,"11 21, 2007",0.2624
74,ACEGE5JHIT1GT,B00000DMB3,Joshua Carter,"[0, 0]","This is the 2nd best game I've ever played! Even if I like Excitebike 64 more, I can't wait until I can get this! I don't have it, but my brother and I got all the way to Forest Temple from the start in just 3 days. Then we had to return it. But It's my favorite Zelda game ever.",5,Best Zelda game I've ever played!,994723200,"07 10, 2001",0.3633
75,ACC56Z76677VR,B00000DMB3,Joshua T. James,"[2, 2]","Face the facts, all these young gamers in the world do not know what it is like to grow up with a legacy on your TV screen. I do. Upon first playing of the OOT I found it to be quite exhilirating and as game play continued, I was reminded of the greatness of those that came before it. Yes, the game was a little difficult, but if you whine about how you couldn't get past the first level, either gain some skills or do not enter the arena with true gamers. If you did not play the original Zelda you will not do well with this one. This is by far the greatest Zelda of the series and I can't wait to see what the future hods. True gamers, you know what I mean.",5,Face the facts....,968371200,"09 8, 2000",0.2955
76,AVE2J7PNE0L9C,B00000DMB3,J. Parmelee,"[2, 4]","Ocarina Of Time is definitely the best game on the Nintendo 64.Super Mario 64,Perfect Dark and F Zero X are awesome but Ocarina Of Time is the best out of any other game on the system.What else is there to say about a game that changed the way we look at Role Playing games forever?The graphics are awesome(some Game Cube games dont look this good) the music adds excitement and the challenges are excellent.Whereas the difficulty in Super Mario 64 stayed pretty much the same throughout the game Ocarina Of Time gets harder when you get to be a better player.Also you get an extra heart after beating bosses because youll need it.Its very challenging I still havent beaten it and am not sure if I ever will.Easy games can be a lot of fun but they just arent as substantial as a game like this.The challenge makes it fun as well as the graphics and controls. Its just a great game and is a must for any Zelda fan or just someone who loves challenging games.",5,The blast that was heard throughout the world in 1998.,1076544000,"02 12, 2004",0.9436
77,A1L0OE5XWUGKTJ,B00000DMB3,Katie-Bell,"[0, 1]","What isn't great about this game? I'm so glad that this game has so many reviews because it definitely deserves it. Ocarina of Time remains one of my favorite videogames of all time. Yes, the generation of gaming is getting wider and graphics are getting beautiful with each console but The Legend of Zelda: Ocarina of Time, on N64, doesn't add up to them. Well, at least to me it doesn't. I've seen a few 1 star reviews about people bashing the game only because it's no everquest or Halo. This game is so good that you don't compare its style or graphics with something in today's modern gaming. This is an old school game. You just don't compare old games to new ones. I believe there's a favorite for every generation. This one happened to fall into the N64 genre, when gaming was really starting to pick up. And honestly, you think over 700 5-star reviews were written all by children? We were children when we all played the game! And looking back as adults now we cherish it as a classic and one of the best in videogame history. Kids that didn't get to exprience the NES, SNES, and N64 missed out on a great gaming genre and though the generation of gaming today is awesome there's nothing on the classics.Ocarina of Time remains my favorite game of all time, even before some of my new favorites and there's nothing like turning on that N64 and playing over and over again. I never tire of this game. It is a true classic.",5,One Of Those Nostalgic Classics,1198540800,"12 25, 2007",0.3035
78,A2R4HK5ZJKL0UH,B00000DMB3,Katie Dark Musashi,"[5, 6]","GAME TYPE: Role PlayingSYSTEM: N64GRAPHICS: Awesome, especially for its timeDIFFICULTY: Moderate, it depends if you want all the items and secrets or not. Not hard just to beat however.AGE RECOMMENDATION: 12 and upCHARACTER QUALITY: Love themPLAYBACK VALUE: There is always something fun left to do!GOLD CARTRIDGE AVAILABILITY: I have one :P They don't make them anymore but you may be able to find one used.Link, the courageous hero of time, must save Hyrule and Princess Zelda from the powerful wizard Ganandorf. Along the way Link will meet many people who can help him on his quest, as well as provide items and host mini-games to make it more fun. Can Link defeat Ganondorf and save the Triforce? Buy this game and become part of the adventure! Travel through time to play both child and adult Link. Ocarina of Time never gets boring or tedious, and is neither too hard nor too easy for any level of gaming skill. If you missed it in 1998, it's time to get it and get in on the action! The sequel, Majora's Mask, is also cool.",5,My favorite game of all time!!!,1019865600,"04 27, 2002",0.3493
79,A255DD5NKP1210,B00000DMB3,Kehoe,"[33, 39]","Once again, Hyrule is being threatened by the forces of evil! As Link, the chosen hero you solve countless puzzels, and fight many, many, monsters!This game has about everything! Good graphics, great gameplay, and a wonderful story.Ganondorf, the evil in the game, needs to get the tree spiritual stones to open the Tempe of Time. He threatened the people who have them, but they didn't give him the stones. Link goes on quests to get the tree stones. Once he gets them and Zelda, the princess, gives him the Ocarina of Time, he opens the Temple of Time. But little does he know, Ganondorf followed him.Seven years later link wakes up and Ganondorf rules Hyrule. He spreaded five of the six medallions and had monsters gaurd them. You get the only medallion Ganondorf didn't have and go on a quest to find the others.This game is great and has a wonderful selection of weapons and other things. I highly recommend it and for anyone who has a Nintendo 64, get this game for your 64 collection isn't complete without it.",5,"If You Have a N64, Get This Game!",1018051200,"04 6, 2002",0.132
80,A2LA30ZI2W6329,B00000DMB3,Kenny Lopes,"[1, 1]",I remembered a time my older brother borrowed this game from a friend of his. I liked it so much but when it came to the time for my brother to give it back i was upset. But no worries I was 7 at the time when that happened now that I'm older i was able to buy my own copy.,5,Awesome game.,1397520000,"04 15, 2014",0.1971
81,A36QIF5IIJ5EJX,B00000DMB3,K_Renny,"[0, 0]","One of the best games of all time.You get the thrill of beating all the bosses, playing the ocarina, and riding Epona around Hyrule. Never going to regret getting this game. One of my favorites.",5,Classic,1372896000,"07 4, 2013",0.4724
82,A2WA8R7ZNUHZMA,B00000DMB3,Laura,"[0, 0]","The Legend of Zelda: Ocarina of Time may be difficult at times for some of the temples were designed to make you think but this game is the best game I have ever played in my entire life.I have been playing nintendo for years and I have played some of the older Zelda games before but I never owned any, as soon as I tried this game - I immediately loved it and I've played it millions and millions of times. I am so obsessed with it, I went out and pre-ordered the Wind Waker to get the Zelda bonus disc and renewed my subscription twice to Nintendo Power to get the Zelda Collector's Edition disc.There is no need for me to review this game - all I really need to say is buy it. You will not be disappointed (if you are a nintendo fan or have a brain). Definitely be sure to get the follow up Majora's Mask and the Wind Waker. A must play and Link is the best hero ever.",5,By far the best Zelda game ever,1089590400,"07 12, 2004",0.6146
83,ATEPGN4K0RRXD,B00000DMB3,Led Zeppelin dude,"[2, 6]","man, i remember getting this game when i was around 9 years old, and alll those hours i spent beating this game over and over again. I Gurantee I've beaten this game at least 100 times, Honestly! Though the N64 is outdated, from time to time I take it out of my closet and plug it in just to play this game. I hope the twilight princess will be just the same!",5,classic,1151366400,"06 27, 2006",0.125
84,A3JX74J0LE924A,B00000DMB3,Lisa Houghtaling,"[0, 0]","Go out and buy it and play it yourself and see what I mean ok. The level's are great and there is alot to do. The places that you go are in the mountain's lake's valley's and in cave's and a little ranch somewhere? Link lives in Kokiri Forest.In the game you have to get three stones somewhere. One in the Deku Tree and One in Goron City and One in the Zora's Domain. Some time in the game you will be older, by the time you look around the place will be dead.You as Link and you have to save the world form evil form the evil king name Ganondori and his evil plan's before it's too late. And save a beautiful princess name Zelda. And you get to meet other characters in the game too some are cool some are big and some are small.Buy the (The Legend of Zelda Ocarina of time Official Strategy Guide) it's a big help to me and you if you with it.Everything Revealed to YOU.PS. I know everything in the game do you. I PLAY IT AND I LOVE IT.",5,Zelda Ocarina of time. What a great game.,1027036800,"07 19, 2002",0.2239
85,A80VNYB1VXMDD,B00000DMB3,lothodies,"[0, 0]","If you have an N64 you absolutely should have this game. It's a remake of the classic Zelda game from the good old NES and SNES systems with some added twists, new terrain and interesting characters.If you have a GameCube I would recommend you pre-order The upcoming title &quot;The Wind Waker&quot; and if you do this right now Nintendo is offering a special deal where you can get a special release of &quot;Ocarina of Time&quot; for Game Cube. Not just the good old &quot;Ocarina of Time,&quot; made famous on N64, but also an enhanced version called &quot;Master Quest.&quot; Make sure to put both into your shopping cart and enter the correct code while checking out to capitalize on this great value.Happy Hunting.",5,What are you waiting for?,1043971200,"01 31, 2003",0.5956
86,A1XUKDQJYFFJZV,B00000DMB3,lucas,"[0, 3]","This game is fun, but it is very overrated. It has not aged very well, and the game feels sloppy, compared to how revolutionary it was when it came out.",3,Overrated,1389139200,"01 8, 2014",0.0137
87,AKQZHBHYI9V7E,B00000DMB3,Luciano,"[0, 0]","When I first got my Gamecube, this game was part of the Zelda collector's edition. I didn't know much about Zelda, and had only played very few games before, but was mesmerized by this game. The beginning of it is so magical and imaginative; it really draws you in to the story. I found myself playing through the beginning of it over and over again because I didn't have my memory card yet. This game takes place in a vivid fantasy world that is vibrant, ominous, beautiful, and haunting. I had never experienced anything like it. To this day I have never been so absorbed by another game.What's really impressive is that this whole game is very consistent. The music is also exceptional. The music is better than most movie soundtracks, in my opinion. All of it perfectly accompanies what is happening in the game. So much happens in this game; it has a lot of cinematic scenes too, which really develop the story, which is an excellent tale of good versus evil.Ocarina of Time stimulated my imagination at a young age more than just about anything I know of. There are a few films and books that would come close, but I can't think of anything that could quite surpass it. Ocarina of Time is an involving, authentic, scary, and epic adventure. Playing it for the first time makes for an unparalleled experience.",5,My Favorite Game,1372032000,"06 24, 2013",0.2227
