,reviewerID,asin,reviewerName,helpful,reviewText,overall,summary,unixReviewTime,reviewTime,Sentiment
0,A170X28DQS49RX,B00000DMB3,A. Bullen,"[2, 14]","DO not get me wrong. I am one of The BIGGEST Zelda fans in the world. and I bought this one as soon as it came out with the gold cartige and all.But this Just isn't a Zelda game....Its missing the Fancy tunes, the story just doesn't seem that addictive.WHen you first get the game its great and it looks to be one of the best games. but then after you beat it.... its kinda boring...Zelda games should never get boring! Zelda NES I STILL paly that damn game.' Link Not as good as the first but still I like playing it. Zelda A Link To the pass on SNES is the BEST Zelda game.I just cannot love this game.. it did horrorble for a Zelda game.",3,Sorry,965692800,"08 8, 2000",0.3041
1,A83X256970U69,B00000DMB3,A Customer,"[2, 9]","Ocarina of Time is the best video game of the last 100 years.If you have never played it, your missing out. Plus, you are a tool.",5,the greatest achievment of our time,1142553600,"03 17, 2006",0.1207
2,A2J9AN99ZE5SQ,B00000DMB3,Adam Robinson (a.k.a Adam Lee),"[0, 0]","The first Zelda game for the 64, The Legend of Zelda: Ocarina of time won game of the year for 1999. As Link, your quest to save the tri-force from the evil Ganondorf will take you all over Hyrule, not only in the present, but also the future with the help of the Ocarina of time. If you like the Zelda series, this game is definently for you (or even if you just like to save the world in your spare time:])",5,The Legend is passed to the 64!,988761600,"05 2, 2001",0.6079
3,A1DVGY92MKB9JD,B00000DMB3,A. Hitt Puck90a,"[2, 2]","I love this game. I love this game. I love this game. I just got Ocarina of Time and it's been a few years since it has come out - it still rocks even in comparison to what's out now. I've had a Playstation 2 for a couple of years and have had a good game here and there, but after playing Ocarina of Time, I realize that I had forgotten the beauty of Nintendo games. They just have a special feel to them (and they make me remember the years that I was a little tike playing old Nintendo games). I just beat the game about 5 minutes ago. I certainly won't spoil anything, but I will tell you that the ending is over 30 seconds long and is something worth playing through the game to see... A video game hasn't brought me this level of satisfaction in a while. Bravo Nintendo, bravo.",5,I love this game.,1093046400,"08 21, 2004",0.4492
4,AOXX0U2T2BGYM,B00000DMB3,A Human,"[0, 0]","I just bought this game a few weeks ago,and it's awesome. It just has that This is going to be an epic game from the get go. It has great graphics,even to this day.First of all,this is an Action Adventure,not a RPG/Role Playing Game.Next,I recommend buying the Strategy Guide. This game is what gamers call Nintendo Hard. It's a challenging game,with quite a number of puzzle parts.Anyway,buy it if you have a 64,or Virtual Console it if you have a Wii.",5,Wow..Just...Wow.,1248998400,"07 31, 2009",0.3252
5,A2ZP4PRR6VT6ZG,B00000DMB3,Amazon Customer dragon_flame,"[2, 2]","This game is blew me away! I didn't expect Ocarina to meet with my standards after playing the previous Zelda games. They usually go stale and predictable, but Ocarina didn't do that. It's a game for true fans of the adventure genre! The dungeons are long and perilous, there are numerous side-quests, a great cast of characters, and a large world to travel! If you have any doubts about this game, eliminate them. You won't be dissapointed!",5,A true classic!,1057795200,"07 10, 2003",0.1748
6,A3NLI44GQY8K48,B00000DMB3,Amazon Customer,"[0, 0]",This could be the best game of all time. What else needs to be said? If you haven't played this game before and still have a working N64 you need to pickup this game. If you haven't played the game you can also find it on the Wii Virtual Console and an upcoming remake for 3DS.,5,The Best Game of All Time?,1306022400,"05 22, 2011",0.03
7,A31RM5QU797HPJ,B00000DMB3,Amazon Customer,"[10, 15]","I'm what gamers call a Zelda Veteran , I've played almost ALL of the Zelda games and managed to beat only one: this one. I love the Zelda games because they are challenging, different and fun to play.In this one, Link lives in a forest with the forest folk. Link is soon inside the Deku Tree to defeat the evil monsters that moved into the tree. After a battle with the queen spider, the Deku Tree sadly dies and tells Link to find Zelda, the Princess of Hyrule.Hyrule is a kingdom that's always in trouble, and its up to Link to save the land from a terrible enemy. Link has the help of Navi, a fairy that gives you advice or tells you what you should do next.During his adventures, Link will learn spells, be swallowed by a huge fish, and saving the land from the evil Ganondorf. This game is a classic and worth the money.",5,A timeless classic!,1018396800,"04 10, 2002",-0.0068
8,A20WIVFZ3EIX0W,B00000DMB3,Amazon Customer Trig42,"[2, 2]","For all those of you that have followed the lineage of Zelda from its early days on the classic 8-bit system, and onward to its SNES days with &quot;A Link to the Past&quot; (great game), and loved every second of it, then you have to buy this game! For those of you that have never played any other Zelda game, what are you waiting for? Now is a great time to start.Ocarina of Time is amazing. All the elements of classic Zelda are there - dozens of powerful items and weapons, lots of secrets to find, at least 10 new 3D-rendered challenging dungeons, plenty of secrets and side-games, and something that all the other Zelda's never had: a truly great story!If you enjoyed &quot;A Link to the Past&quot; you will most certainly like this game as well. The story of Ocarina of Time involves going back and forth in time, between a happy peaceful Hyrule, and a dark evil one, much like ALTTP; but don't think this is a rip-off on its predecessor. The complex dungeons, challenging bosses, and deepening story lines will blow you away. The 3D element of the game also adds so much more that was never possible before. Even the music is catchy and well orchestrated. (I actually downloaded the mp3 soundtrack online!)The gameplay is a little tough to get used to - afterall, you've never played Zelda in 3D before - so you actually have to consider things sneaking up behind you, and flying overhead! But once you get used to the controls and learn to use the &quot;Z-Targeting&quot; feature (using the trigger button will solve just about any control problem you may encounter), the gameplay gets easier.The only thing that annoyed me was Navi, a little fairy that travels with Link throughout the game. She is always bugging you to give you painfully obvious information. I suppose she is a helpful guide for younger or more inexperienced players, but I found her annoying. But once you come to realize that Navi is an important aspect of the game's control, you will let it slide.I would recommend this game to anyone who owns an N64 console, and even more so if you enjoyed SNES's &quot;A Link to the Past.&quot; I can't wait to play the sequel when it comes out.",5,One of the few N64 games you must own!,972432000,"10 25, 2000",0.1419
9,A3TUTC8XWA7DVM,B00000DMB3,amisfitsfan,"[0, 0]","Really though, could an old, out dated game still be awesome 4 years later? The answer is yes, because this game is just too good. It gives you a complete story on Hyrule and the Triforce, not to mention the best video game music ever (especially the boss music). Being able to play as young link and adult link in two similar, yet in a way completely different worlds as one would find out sooner or later. The graphics are still, and when this was released, it was the best game graphicwise as well. The bosses are easy, yet in a way challenging, and the dungeons and temples are amazingly designed. However, there are two faults, one minor, one somewhat major.-Link is missing the strap on his frontside that holds his sword case thingy! Well, it just kinda looks odd.-The &quot;final boss&quot; is far too easy...but don't be too sure of that...",5,The greatest game EVER,1066262400,"10 16, 2003",0.369
10,A2N1C9JKI2C5XD,B00000DMB3,An amazon visitor,"[1, 3]","I'm not really a fan of N64. I've always been more of a Playstation one fanatic, but Zelda is undoubtedly the best game that I have ever played. If you think that Final Fantasy is good, then Zelda will make all of the installments in final fantasy look like junk. There's only a couple of games on the nintendo N64 console that of which I liked, and that was Gauntlet Legends, Super Mario, and Donkey Kong. But this game beats them all by a longshot.Then why did I give this game four stars instead of five? The reason is because of the...problems listed below.1. This game is HARD. I don't mean hard as in Challenging I'm talkin' about the whole you-possibly-will-never-ever-complete-the-game-without-a-strategy-guide hard. The type of frustration which can rack your nerves big time.2. There are a couple of glitches in the game. Example: I dare you to cut a sign with your sword. Then play Zeldas lullaby with your ocerina of time. The piece of sign which you had just sliced and diced will float. That's just one of the glitches.3. A little confusing, as far as the story goes. It's better to play the game twice and see if you still understand it.4. Replay value isn't very high. Once you complete it, that's it. It's so hard that I wouldn't ever want to go through the same frustration again, as to the fact that it was very difficult, even if you do know what you're doing.Okay, those were the bads. Here are the goods.1. The graphics are outstanding. Wow. The whole world of Termina reminds me of middle earth, only a lot less dark and ten times more exotic.2. Once you beat the game, you feel satisfied with yourself. Sure, this game is a little short, but it will still take you a long time to beat it, no matter how experienced you are with gaming.3. The plot is good and twists a lot. I know that I said it was kind of confusing, and it kind of is, but it's still fun and the things that of which I did understood surprised me a lot.It's sort of a mystery.4. Fluint and absolutely excellent cut and FMW sequences. It's true. Like I said above, the graphics are wonderful. And plus, exploring a small portion of Termina, which you do through out the game, is an experience that you don't wanna miss.5. The bad guys are challenging, but not so challenging that you'll be ripping your hair out. Once you beat them, you feel satisfied.6. Highly addictive gameplay and plus you won't stop until you beat the game.But there's one major, and I mean MAJOR problem with this game. This game is so addictiive that you might forget about everything else in life. Remember your family? You won't when you get this game, since you'l be wanting to play this game even more. A Anyways, get the game.",4,Greatest game on N64.,1025481600,"07 1, 2002",0.1344
11,ABSX5TGEGRH76,B00000DMB3,Andrew Radaar,"[10, 12]","Before I played this game, the only other Zelda game that I had ever played was Link to the Past, and I couldn't understand it that well. I decided to play this because of the hype. I was sure glad I did. This is one of the best games ever! It's full of adventure, it has a wonderful story, and it is challenging. It begins with Link, a 10-year-old Kokiri (child of the forest) who is chosen to save Hyrule, his home world. Along the way, you meet new friends, such as Princess Zelda, and grow into a 17-year-old adult to fight the evil Ganondorf! You have many different weapons, spells, and items at your disposal, including swords, bows, and a giant hammer. The fun never stops and the story never goes flat. If you want a grand adventure, buy this game. If you like this, play The Legend Of Zelda: Majora's Mask, but wait until you finish this game.",5,Legendary,1015718400,"03 10, 2002",0.3815
12,A1WBAPIEEV79JC,B00000DMB3,Andrew Strength and honor.,"[0, 0]","Very fun game to play, and has an excellent story line to play. Lots of different equipment to use, and the game isn't overly difficult to beat.",5,Fun Game!,1379721600,"09 21, 2013",0.5887
13,ADX5HZ4W4F4XI,B00000DMB3,Arnout Koeneman,"[2, 2]","I'll make it short...I hope.I'm not particular a fantasy lover, I never read Tolkien's Lord of the Ring, I hate the Lord of the ring-movies and was insulted by the numerous Oscars the film(s) received.I despise the Star Wars movies, especially The Return of the Jedi, which has that peculiar fantasy-feel in it.Blahdieblahblah.Now, with games it's a different story, I don't know why, but I'm much more forgiving and willing to accept a world where fairies, gnomes and other creatures excist.The Ocarina of time is one of few artistic highlights I encountered in my life...it's almost ridiculous when I think about what I've just wrote, what about literature, art and cinema?This game moved me so much...am I a geek?...there's so much depth in this piece of ...art.It isn't the story (alone), c'mon let's be honest, it's an average fantasy tale, if made into a movie I'd fall asleep after 10 minutes.I think it's all the pieces put together: a beautiful crafted world, the progress when playing - from a child into a young man -, the challenges you'll face and overcome, the music that playes a big role in the game, the use of time: day and night, future and past etc. etc.It grabs you and most important: it's interactive (duh) for it's a game, you're not watching a crap fantasy movie, but playing the hero all by yourself, when he looses, you loose etc.I played a lot of games in my life, including many new(er) titles as Halo, GTA, Metroid Prime etc etc and I didn't yet played a game that matched the sheer brilliance of The Legend of Zelda - The Ocarina Of Time.Best game ever (so far).",5,Another review,1106956800,"01 29, 2005",0.9358
14,A134F9G6MBP6MQ,B00000DMB3,Ashley,"[0, 0]",I was worried about getting this but I did anyways because I have been after it for a long time. I was worried because it was Used-Acceptable but it has played great so far (though I haven't gotten very far yet) So so far I am so glad I went ahead and ordered it.,5,I was worried because it was Used-Acceptable but it has played great so far (though I haven't gotten very far yet) ...,1405036800,"07 11, 2014",0.3923
15,A38MZX4OMBBXIC,B00000DMB3,atlantis_az,"[2, 2]","I have played all the other Zelda Series Games and this is the best. I first heard of this game when I borrowed it from a friend. I played it nonstop, until I beat the game. The only hard part about it is the dreaded Water Temple. It is the only actual hard one, but don't get me wrong the rest of the dungeons are equally difficult. Even the first level is as difficult because you have only your sword, shield and wits. But as you progress you gain pieces of hearts, weapons, swords, shields, and other tools. The graphics are really cool, the sound could be just a tad better, and the fun is the best. The only bad part is you can't unfreeze Zora's Domain and get the Triforce, or Miyamoto says. Well if you liked the other Zelda games, this is a must have. If you never have played a Zelda game get a life!",5,Surpasses Them All!,974505600,"11 18, 2000",0.1726
16,A1R602SXNGOMJ4,B00000DMB3,A. Vegan,"[0, 1]",I was always a fan of Zelda when it first came out for the original Nintendo. This is a fairly challenging game and I got bored with it quickly. There isn't a lot of violence in this game but I think it's too advanced for kids to play.,4,Pretty Challenging,1038441600,"11 28, 2002",0.2991
17,A3TIT9O3DUVZEB,B00000DMB3,Baer Bradford Smile the Future Is Now,"[0, 0]","Quite possibly, if you don't know why then you haven't played many videogames ;-)",5,Best videogame ever?,999820800,"09 7, 2001",-0.0093
