,reviewerID,asin,reviewerName,helpful,reviewText,overall,summary,unixReviewTime,reviewTime,Sentiment
31,A2OUKHGJ85XN4U,B00000DMB3,Charles H.,"[2, 2]","What can be said about Ocarina of Time? I still remember that commercial from the late 90s. It told us that a dark time is approaching. My interest was piqued. Then I realized it was a Zelda game. As a huge fan of A Link to the Past, I thought ZOMG that looks awesome! I need to get this more than I've ever needed to get anything! I remember reading about it in GamePro and obviously being interested, but that commercial sealed the deal. I knew I had to have Ocarina of Time, and that Christmas, my mom got it for me. Cheers!A lot has been said about OoT over the years. It has been referred to as the Best Game of All Time by some, and the Most Overrated Game of All Time by others. I'm not really in either camp, but I lean closer to the former group, I suppose. If you haven't played it yet, you should. It's out on a variety of platforms and there's even remake of it with better graphics, but I would still recommend the N64 version if you want the same experience people had back in the 90s when OoT was THE GAME you needed to play.Story:You are Link. The Great Deku Tree, guardian of the forest in which you live, has summoned you. It's revealed that you must visit a far off castle and meet a Princess of Destiny, and doing so brings you square into a struggle for the fate of Hyrule -- nay, the world -- itself.Gameplay:To complete your quest and save Hyrule, you must boldly enter into many dungeons which are filled with fierce skeletal warriors, human-sized spiders, horrible ghosts, and... immobile venus fly traps! Completing a dungeon gives you an item for the main quest, and completing all of the dungeons will allow you to face the final boss. There's much more to it that, but I'm trying not to spoil storyline specifics for those who haven't played it.Hyrule is a vast world. One of your in-game guides tells you that You can go wherever you want. That's true, to a point. There's a lot of exploration in Ocarina of Time. The game is always trying to point you toward a certain place, but whether or not you go there is often up to you. In an interactive world such as Hyrule, you can do many things. Why go see what's on Death Mountain when you could pour water into all of the soil patches in Hyrule? Or why go play the Shadow Temple -- which does not have any attractive Gerudo women -- when you could go to the Spirit Temple, which does? The exploration is one of OoT's best features, and it's probably better than any Zelda which came after it.Controls:They work well enough. You don't have the full on camera control that some of the later Zelda games give you, but personally, I never found it all that essential to the process.Ocarina of Time introduced a Z-targeting system for aiming at enemies and talking to non-playable characters. What you do is get near an enemy/NPC, press or hold Z, and then press a button to talk to them/attack them. The system pretty intuitive and well made, so much so that its successors have yet to really improve upon it.Music:*90s gripe* Where is the classic Zelda overworld theme? Oh, we can hear it for like five seconds in the Hyrule Field theme? ARE YOU SERIOUS? But seriously, the music is pretty good. The Hyrule Field theme which I just mentioned is a good theme. The music does a good job of fitting the areas which you visit, for the most part.Some later Zelda games use too much ambient music in the dungeons. OoT is guilty of this too, but only to a small degree. Apart from the Water Temple's melody, there's nothing that makes me want to relax and do some meditation or whatever while hearing it. :POh, and I'm sad to report that the OoT Commercial Music is not in this game... :(Replay Value:It's pretty massive. You can do some Temples in different orders than you did your first time through, or you can use different items to progress through the Temples. I summed it up in a sentence, but there's hundreds of hours of replay potential there in just finding all of OoT's possible variations.Like in the original Legend of Zelda, you can do the Three Heart Challenge, which means you can complete the game without any of the health upgrades from beating a dungeon. Essentially, that's playing Hard Mode (although it isn't really that hard).But if the Three Heart Challenge wasn't enough, OoT lets you tack on additional stipulations to make replaying it even harder! There are technically unnecessary items which let you breathe underwater and resist intense heat. Not getting them limits the amount of time you can spend in relevant areas. On top of all that, you could even as far to skip the health upgrades which halve your damage.______If you call yourself a gamer and have not played Ocarina of Time, what are you? Some undercover non-gamer sent in to infiltrate us!? Go play it now!",5,A dark time is approaching...,1383696000,"11 6, 2013",0.172
32,A3S34VW0BBC9L6,B00000DMB3,CharlieGone CharlieG,"[0, 2]","There isn't much you can say that is bad with this game. For it's time it had excellent graphics, excellent game play and sound. This game is truly one in a million that I am sure any person can enjoy, BUT, if your a Zelda fan (and have played all if not most games from the beginning) you'll notice some of the things in OOT are recycled. For example, the Kakariko town music is completely recycled from Zelda: A Link to the Past. In fact this game borrows a lot from Zelda: A Link to the Past, though they do manage to change some things in OOT here and there. Still for what it's worth Zelda: OOT is still a pretty darn good game, though I think the story should have been more original.",4,"Great game, probably one of the best",1200873600,"01 21, 2008",0.3427
33,A1ILCU1SHJG9NA,B00000DMB3,Chase Hunt,"[0, 0]",this is a game that is perfect it is so fun to play at times when the sun gos down u can do a lot of stuff in this game its very cool its got 20 hole hours of this game there are good ponits in this game very nice game GREAT MUSIC better then zelda 2 for the n64 this game has much more to have even if u think u have gotton all moneys and more u have much more for this game it is a must have n64 game lovers u will want this MASTER GAME for your system.,5,zelda 64,993772800,"06 29, 2001",0.9847
34,A3QCYCGJ3QYYSM,B00000DMB3,chase vinson,"[0, 0]",was a good purchase dont get me wrong. but i had a minor problem with it saving. at first it wouldnt save for the first 3 or 4 times. but eventually it did. other than that it worked great. awesome condition. came as described.,4,ok.,1378512000,"09 7, 2013",0.1397
35,A2P5U7BDKKT7FW,B00000DMB3,Christian,"[0, 0]",One of the best video games ever.Redefined everything after it.My copy came in very good condition without scratches or writing,5,This game is a legend.,1398556800,"04 27, 2014",0.8122
36,A1ZHPFTRR8LZ3Y,B00000DMB3,Chump18,"[0, 0]","The Legend of Zelda: Ocarina of time is the best zelda game there is! You go from being a kid, to being an adult! Link must beat five temples as an adult, the forest temple, the fire temple, the water temple, the shadow temple, and the spirit temple. The bosses are awsome, and all the characters are cool!",5,Ocarina of Time,989193600,"05 7, 2001",0.218
37,A1AISPOIIHTHXX,B00000DMB3,Cloud ...,"[2, 2]","Reading magazines from 1996-1998 one thing you couldn't escape was a some kind of mention of Legend of Zelda: Ocarina of Time. It was all over the place. Popping this in my N64 when I took it home I spent literally 2 hours just exploring Kokiri Village just cause it was so fun. But then I realized &quot;oh yeah there's more to this, isn't there?&quot; And that's when the fun started.Graphics: Although you can probably debate this, this has one of the best graphics you'll find on the system. Lot of areas just drop that &quot;wow factor&quot;, like when you first enter Zora's Domain or the game's many cutscenes.Sound: Although there's no voice, except for Navi's annoying &quot;Hey!&quot; and an occasional &quot;Hello&quot; from her or Link's grunts, it's got some awesome music. One thing I love is the short ocarina songs you play, such as Song of Storms, Zelda's Lullaby and Song of Time, plus general area music. Although the overworld music isn't like what it was on Link to the Past, it's still great.Story: The story starts off with Link having a bad dream about a mysterious man and woman. Then Link is summoned to the Great Deku Tree where he fills Link in on his quest and it goes from there. Even though it can be a quite simple story, it's just a huge epic story that kept me interested.Gameplay: The infamous Z-Targeting system that's spawned several developers to use it in their own games. The recent Star Fox Adventures uses this. Your C-Buttons are for your weapons. B is your sword and A is your action button(Talk, Jump, Climb,etc.). You'll know this system by heart cause Navi tells you how many times about it within the first hour. Camera is excellent and the Z targeting helps.Even though you might be able to find this, I suggest you pick it up. Dust off your N64 and dive into what is one of the 90's most critically acclaimed and commercial masterpieces ever.",5,One of the most critically acclaimed games ever,1034208000,"10 10, 2002",0.2553
38,A49OPO1VH5U5E,B00000DMB3,courtland,"[0, 0]","This is by far the best Zelda installment yet. Much more fun than Majora's Mask, mainly because you can freely explore the world of Hyrule. (see review of Majora's Mask)This game can be fun for anyone.",5,ocarina of time,1007856000,"12 9, 2001",0.635
39,A29Z0OKLTIZ7MN,B00000DMB3,crude101,"[0, 0]","I confess- i've never played a single Zelda game before this- cause i wasn't into RPG games, but i'm so glad i never gave this a miss. One day, i just felt like playing this game and i bought it and it's terrific, no maybe better than terrific, it's too good to be true.I spent 4 good months playing this game and i finally beat it recently but that hasn't stopped me from planning round 2 and buying the brady guidebook to find all the secrets.This game is also filled with charatcer interaction and drama. I think you can read Amazon's review for the storyline and i'll just encourage you to buy this game if you haven't.It's a player's choice game and coming from Nintendo- i am not surprised it's this good. I'm gonna get Majora's mask when it comes out this winter and i hope to see this game on the Dolphin.If you are hooked and want to relive the magic- go get an old NES or SNES from your cousins or someone and buy the previous Zelda games and you'll see why Zelda's a classic.Like Mario, Zelda has a huge following and blah blah...i don't need to elaborate on the game's success anymore.As far as fun/gameplay/story/graphics/sound/replay is concerned, it's a safe bet to say that i will give every category at least 9.5 out of 10.I'll only give it a 10 when they put in FMV and put to rest once and for all, that Zelda is the definitive standard-RPG and action-RPG and not Final Fantasy. Sorry guys, i had to say it- it's true.Now if only Majora's Mask would arrive sooner...oh i can't wait!",5,The Biggest Hit Of Nintendo's Career,966297600,"08 15, 2000",0.5635
40,A22TL53EPV6LII,B00000DMB3,Daniel V.,"[3, 5]","The Legend of Zelda Ocarina of Time is a definite Classic. I've owned this game for a good 6 years and it's just extraordinary and fun, but at the same time educational. In this game you must do alot of thinking and find out where the secrets are. So in other words, it's a magical adventure game.The graphics are actually good (for it's time) and the gameplay is easy to get used to. The controls are also simple and the whole storyline is just well thought out and I can definitely tell that they put alot of time into this game. In my opinion it's the best Zelda game so far.Now I will tell you the beginning of the Story so you can even feel more excited about getting this game.As a young baby boy, your mother was killed by an evil person. Now you have no home and have to move to a place called the Kokiri Forest. This is a place where people never grow up and aren't allowed to leave the forest. They're called the Kokiri. But you're different. You really don't belong in this forest, instead you belong out in a world called Hyrule. You're a Hylian (normal people who actually grow up). You're out there to defeat Ganondorf. Ganondorf, most likely the person who killed your mother, is a strong and evil person who wants to take over Hyrule and become the King. The only person that can stop him is you (Link). Now the question is, will you be able to defeat the mean and evil Ganondorf and save the world of Hyrule?If you think (or know) you can take that responsibility, then I suggest that you buy this game along with the N64 (if you don't have one) and experience something very special. Like I said, it's a definite Classic and will keep you entertained for hours on end! You won't regret it!Thank you for reading and I hope I was helpful enough.",5,A N64 Classic!,1141948800,"03 10, 2006",0.065
41,A35GI3QWTMA72L,B00000DMB3,darklord,"[0, 1]","the game was awesome. Zelda has always been an addicting, mindblowing, and fun game. Many people like it. The game features a great 3d world in which there is night and day. the game also has many different enemies and dungeons and the famous ocarina where you can play different tunes that you have learned. A really good game if you like action and adventure. The frustrating thing are the puzzles. they may take some time to solve. This is not why i gave the game 4 stars. I believe 5 stars means the game is perfect. and this game is not perfect.",4,one of best n64 games,1072828800,"12 31, 2003",0.235
42,A2DX5Z1OZKUB8P,B00000DMB3,dark twain dude,"[0, 0]",I've beaten the game 20 times and I'm still not bored of playing it. If you haven't played this game then PLAY IT!!!!!!! you wont be sorry you did. This is much better than all the other FINAL FANTASY and rpg crap out there.,5,The greatest video game of all times.,1101081600,"11 22, 2004",0.0655
43,A2NH6XSE79X3VY,B00000DMB3,Dave,"[1, 3]","This is one of the best games I have ever played. Even shooting the arrows is fun, you can actually use your shield to block getting hit. Just incredible. The only bad thing I can possibly say is you almost have to buy the strategy guide or else you will likely get stuck on some levels. There are a few dungeons that I could not find my way out of without buying the guide. But overall great game!!",5,Solid game,1168560000,"01 12, 2007",0.1406
44,A1QXN22NDLTQTS,B00000DMB3,David,"[3, 3]","Zelda: OOT is centered around a massive, circular field called Hyrule. Around this field are pathways which lead off to various different locations such as dungeons, castles, villages, volcanoes, etc... Each path will lead to usually one destination like a castle, and once explored, you travel back across Hyrule field and visist another pathway which leads to a different location. This makes areas more accessible, and it makes backtracking as less tedius as possible, due to the fact that you're not endessly travelling through pre-explored ares. Backtracking is an important feature of OOT, due to the fact that when you progress through the game you aquire objects which give you the ability to explore areas more thoroughly ... bombs for instance blow up walls that hide secret paths. Hockshots give you the ability to ascend to higher ledges. The Ocarina of Time opens secret doors. Thus, pre explored areas which you thought were unimportant can in fact conceal the most important instruments and dungeons in the game. This is compounded, when at one point in the game you aquire the Master Sword. This is a special sword which, upon claiming, makes you and the world age by seven years, and by doing the reverse, putting the sword back in it's mold, makes you and the world 7 years younger. The good thing about this is that the past and future are profoundly different. The future is controlled by evil, whereas the past is controled by good. Needless to say, your mission in the game is to liberate peice by peice the future world from the evil Ganondolf. However, in order to do so you must travel back and forth in time creating situations which will have an impact on the future world.A main part of this game is the ocarina of time. Depending on what tune you play, the ocarina will turn night in to day, make it rain, open secret doors, or make blocks disappear, amoung other things. This adds an important layer to the game, for you have to use your brain in order to work out which song is necessary to progress. For instance, after spending hours wondering what to do, the idea could suddenly hit you, Should I play Zelda's Lullaby in front of the waterfall? If successful, the waterfall will stop and a passageway will display itself, thus giving you a tremendous satisfied feeling. The actual songs you learn in the game are some of the best songs in computer game history. In fact, only Computer World by Kraftswerk can compare to the greatness of the music in OOT.By the time Zelda: OOT was released the difficulty in games was just perfect. Your heart was racing when you met a worthy adversary, you were fustrated when you died, you were delighted when you succeeded. Fustration and anger are both necessary in games because it's those feelings which make you truly delighted when you succeed... Unfortunetly, since OOT, games have become so easy that a huge part of the joy in completeting them isn't there anymore.",5,Fly Free Bird,1094342400,"09 5, 2004",0.26
45,A1MRYO142HZV3P,B00000DMB3,David T,"[0, 1]","I have to say this is the absolute best Legend of Zelda so far... But there is one thing I have to clarify THIS IS NOT THE FIRST LEGEND OF ZELDA!!! The first came out on the NES and is Great to play.... This one has good control, fun plot, and will get you so wrapped up in it, you'll come screaming back for more.",5,The best TLOZ game ever made...,1015459200,"03 7, 2002",0.488
46,A5L44X2QBOU44,B00000DMB3,Debbie Michaels,"[0, 1]","I got this on the GameCube Collector's edition and really, it's confusing how they DIDN'T make this the best game of 2000, 2001, 2002 and 2003. They DID make it the best game of 1998 and 1999 but anyways, there's a master quest version out there for GameCube. The sites are beautiful. And when u get inside the Deku Tree, let the action/fantasy begin!",4,Enchanting!,1074988800,"01 25, 2004",0.361
47,AD7IBJCYSJ9EE,B00000DMB3,Destitute,"[5, 5]","Whoever hates this game should be shot! This is one of the greatest games ever! It's the best of Link! GameSpot gave it a 10! Anyway, enough prasing it. On to my review...Graphics: 10/10: Looks really good for the time. Big, vast valleys, long mountains, clear water, beautiful guts of Jabu-Jabu...Sound: 10/10: Clash! AHHH! HAHA! HIYA! Beautiful Ocarina sounds! BOOMM!Music 11/10: Beautiful music. Ocarina songs are deep and moving. Composed beautifully.Gameplay: Infinity/10 Awesome! Go through many dungeons filled with tough enimies and hard puzzles! Talk to people in town! Play many, minigames! Stealth! This is extremely fun and addictive! Hidden items. You can also find 99 Gold Skullutas! Play an Ocarina! Controls are flawless!One of the greatest games of all time. Don't play it-live it!PS. Why has Amazon combined OOT and MM into one? It's confusing, and it's depleting the rating! Also, Gerry Atrick, the reviewer above me, was that troll review even nesscery? You said to contact you if anybody knew how to get out of the Deku Tree. Well, 1: Look on a gaming site and 2: How can anybody contact you if they don't know your address. And NO, there isn't a cheat to make Link naked. It's E-rated! Ah well, whaddya expect from a guy from Ireland...",5,A masterpiece!,1097107200,"10 7, 2004",0.2076
48,A1PNZV9C1YZVCP,B00000DMB3,D. Hunter,"[2, 5]","Zelda &quot;occarina of time&quot; is much like the rest of the Zelda series... it doesn't disappoint! With really cool items to collect and using your songs/spells to warp around, the entire game offers whole new dimensions.Things such as a horse you can call and run about the world, play carnival-like games to win power-ups, collect hard-to-find items such as the two-handed sword (which is better than the master sword, but you can't use a shield), magically powered arrows, and more!This game is fairly easy to beat, but finding everything will take you much longer!",4,Interesting graphics and cool items,970704000,"10 5, 2000",0.7508
49,AS09CJ2GLNXNV,B00000DMB3,D.N.,"[2, 2]","You must own this if you like games. It's spectacular in every way, perfect. It creates a breathing world you care about and love, while having this awesome, deep story and Adventure.",5,"Great, Classic Game",1032220800,"09 17, 2002",0.6274
50,A9L4AQU51UF2D,B00000DMB3,Dolphin,"[0, 0]","This game has crossed the I Like You line. It's just like the old one from NES, although, I know about the dungeons and the weapons because I have the old one. So, it's fun to play for a while until you get to the Water Temple, it gets confusing there. So, use the Player's Guide to cheat, so that you won't get stuck. I played a long time ever since it came out. It was the game that caught my eye and though I had to have the game. I am a Zelda fan and I hope that you have fun playing it as well. I just like to see Link grow up.",5,"Love Zelda, Zelda Fan!",1133827200,"12 6, 2005",0.2653
51,AQI3I9OLDNMQP,B00000DMB3,Dontay Minter THTB,"[2, 2]","The most recent LoZ games, in my opinion, have all been fairly average. Wind Waker was the latest actually good LoZ game. But of all the LoZ games, OoT is just plain incredible.In this game, you play as Link as he grows from a child into a young man while on his quest to defeat Ganon and save the world from ultimate, evil rule. Along the way, you meet many friends and face amazing boss battles.The graphics (at the time) were just incredible. It really made me enjoy looking at and playing the game. Nintendo really did a great job in this department.The gameplay is like no other. One of the few incredible games to utilize the C Buttons for vital controls, this game felt really comfortable to play, and there's tons to do in the game besides just beating it. Also, throughout the game, you are forced to travel back and forth through time and play as Young or Adult Link to complete the game, which is awe-inspiring in my opinion. Sadly, after doing little everything, there's no addictive mini-games to really play and not much else to do, but go through the game again and again.The sound is incredible, and the music has never been better. I found myself turning the volume on the TV all the way up while playing this game, because the sound was that good!If you're an avid gamer, yet you've never played this game, then something's really wrong with you. Pick this game up and play it 'till your fingers fall off (which I guarantee you'll do). This game is worth buying and owning for as long as you even are alive.",5,What a revolutionary LoZ game,1115164800,"05 4, 2005",0.2165
52,A1V6BQLWVOVHR0,B00000DMB3,Drew,"[0, 0]","The best game for the N64. if you are to have 5 games for the system it needs to be Mario 64, Mario Kart, Smash Bros, Banjo Kazooie, and Zelda",5,N64 owners bust buy,1390176000,"01 20, 2014",0.3185
53,A1JLX0VQSN84BT,B00000DMB3,Ds Lite Miser Deoxys+Darkrai,"[1, 2]","this game is a real gem , treasure it and treat it well it is worth any price",5,excellent,1178323200,"05 5, 2007",0.7845
54,A3DUWEE33KMBZT,B00000DMB3,Dupo Tuxemo,"[0, 0]","Wow... What can I say. As I'm writing this review, the popular consoles right now are ps2, gamecube, and xbox. I have all of those. Yet no game on any of those systems are better than this. This is probably the best zelda ever(I have yet to buy the one for gamecube). Deciding between this and Majora's mask is a tough call, but I think this one gives a little more gametime.How should I begin to describe this game? It's deep, engrossing, and the graphics are spetacular for a N64. Yes the newer games right now definitely have better graphics than this, but this game beats all of them in terms of gameplay, music, and theme. The story is old, but hey, it's a classic formula. Why change it? What would Zelda be without dungeons? This is one of the few 3rd person games I've played with great controls. The z-targeting system can change a traveling mode Link instantly to a combat alert, and maneuverable Link. The music fits the moods perfectly, from the dark shadow temple to the light and cheery music of the lost woods, it's great. Buy it, it's worth your money, and it's probably the best game ever for N64.",5,I LOVE THIS GAME!!!,1049414400,"04 4, 2003",0.3098
