,reviewerID,asin,reviewerName,helpful,reviewText,overall,summary,unixReviewTime,reviewTime,Sentiment
52,A3VQSFORKH8B7O,767023765,Steven Hancock,"[8, 8]","&quot;The Crossing&quot; is one of the finest TV movies ever made. The movie is superbly cast, and led by Jeff Daniels, who surprised me with his outstanding portrayal of George Washington. Why he wasn't asked to reprise the role in &quot;Benedict Arnold,&quot; I'll never know! The crossing of the Delaware River and the Battle of Trenton are created with accuracy and excitement. This is a must-own movie for anyone who enjoys serious films! Grade: A+",5,A SUPERB TELEVISION EPIC!,1074988800,"01 25, 2004",0.2668
53,ADE9OU2OLWS3N,767023765,Stone Cold Nuts,"[3, 4]","Good films on the Revolution are hard to find. This one was packed with action and the drama of Washington's last roll of the dice when the odds were so severly stacked against him. The film is truly worthwhile, if only to further instill some patriotism in your kids and remind yourself what our ancestors went through to gain our independence. And Washington would be a hard character to play: unless your Jeff Daniels. He nails it and truly captured the heroic aspects of that great man.",4,Patriotic Revival,1172448000,"02 26, 2007",0.4659
54,A2DO7HZPV0RGB8,767023765,Suzanne Metaxas Beads and Baubles NY,"[0, 0]",Will not will any awards but if you like American history you will find it entertaining. A different look at history.,5,Enjoyable,1376092800,"08 10, 2013",0.3738
55,A191YVF0UZ4GNW,767023765,The Rocketeer,"[1, 1]","I thoroughly enjoyed watching this movie version of the historic event it recreates. I never had a great appreciation for this event, and it's significance in U.S. history, until seeing this movie. Sure, you should always verify the facts, since movies often take liberties with the facts, but this one was pretty close. Also enjoyed the moments of humor, like Glover's slight on General Knox. You can't help but smile. :)",5,"Great movie, great history",1294617600,"01 10, 2011",0.3935
56,A1GZKHEQWTS4Z5,767023765,Thomas Moody,"[12, 12]","As with all movies based on historical fact, the yardstick for this movie should be the accuracy presented regarding the battle of Trenton. Based on my somewhat limited reading (Richard Kethchum's &quot;The Winter Soldiers&quot;), this movie delivers reasonably well. More so, the most truly important aspect of history movies, in my opinion, is the context and how well this given period is presented...in essence, how deeply does the viewer feel involved? This is the issue that makes this movie stand out. Watching this, I felt all the emotions that Washington appeared to go through (desperation, frustration, exhileration upon smashing the Hessians at Trenton...) and just marveled at the &quot;period&quot; depiction. I really felt that this was what it was like in 1776 Pennsylvania and New Jersey (volunteers with no uniforms or warm clothes...some even without shoes in the dead of winter...). Washington's character was well played by Jeff Daniels as he portrayed the important leadership qualities that made him a legend and founding father. Daniels &quot;playing&quot; Washington also managed to come across as somewhat flawed (i.e. &quot;human&quot;...) while giving a semblance of Washington's major desperation. On the negative side, I'm not so sure that Colonel Glover's role was historically accurate, although it was also well acted. In summary, an excellent movie and one that should be viewed by anyone interested in the Revolution. Highest recommendation.",5,Brilliant depiction of the Revolution's turning point...,1009497600,"12 28, 2001",-0.0659
57,A4KDWVIN2L4E0,767023765,ThorBjorn Norseman,"[3, 3]","December 1776: The Revolution thus far, was a disaster.For twelve months the first American patriots had endured very little success against the British, being out-classed and routed from the battlefield in almost every engagement. Desertion was rampant. Arms, ammunition, and rations were scarce. Only a small number of the Revolutionaries had any military experience.Even worse, as was usual in warfare until the 20th century, epidemic diseases were the major cause of casualties, with so many men living together in the open under unsanitary conditions. As if this wasn't bad enough, it was winter, and most of Washington's demoralized troops had only days left to their enlistment contracts.With the Revolution on the verge of collapse, General Washington needed a victory, ...immediately.At this point in American History, ...America, OUR nation, was dangerously close to never HAVING a history. This was, quite possibly, the most critical moment in the story of America. The man who signifigantly changed our national destiny at this moment in time, was George Washington.So how did General Washington save the Revolution from collapse? The story is portrayed most excellently in this movie!General Washington received intelligence that a regiment of German Hessian mercenaries had made winter-quarters in Trenton, New Jersey. The troops from Hess were considered amongst the very best of professional soldiers in Europe. They had already inflicted severe defeats upon the Revolutionaries earlier that year. It was a long shot, with what limited resources he had under his command, ...but Washington realized that he just might have a chance at a much-needed victory, ...if all went as planned. Surely he did not expect his operation to result in one of the most one-sided victories in military history!Washington made his proposal to his subordinates. Most of them were vehemently opposed to the operation, given all the factors involved. The weather was abyssmal, intense cold and freezing rain. To get to Trenton, they had to cross the Delaware River, which was already full of large chunks of ice, and a limited quantity of boats.Despite the various obstacles, they adapted, improvised, and overcame.They moved their ragged, starving, inexperienced army across the water, marching all night, cold and drenched to the bone! Many of these fellows didn't have shoes. It rained most of the way. The gun-powder was too wet to fire their rifles and muskets. Only the artillery had dry powder, ...which they used to great effect.This factor makes the nature of this victory at Trenton even more amazing:The Revolutionary army fixed bayonets, and rushed the town, KILLING the much more proficient enemy at CLOSE-QUARTERS! The completely surprised Hessian troops had just spent the previous night drunkenly carousing and feasting on Christmas Eve. Not one of them expected to be impaled by bayonets in the morning! Not one Revolutionary soldier was killed or injured in the attack on Trenton! Needless to say, ...this victory had the desired result on American morale.The man who delivered this Christmas Present to America was OUR Founding Father, ...George Washington!He succeeded because he was assisted by REAL MEN who were determined to accomplish this mission.The real signifigance of this movie:There have been several moments in the history of America, at home and abroad, where the nation faced seemingly overwhelming enemies, and abyssmally dire circumstances. This film portrays one of the first of such incidents. REAL AMERICANS take action. They lock and load, fix bayonets, ...and by the grace of God force a glorious victory from what was presumed to be an inevitable defeat. Be thankful that we had a REAL AMERICAN in command on Christmas Day of 1776!",5,The right man at the critical moment.,1380326400,"09 28, 2013",-0.0041
58,A2YJ575JRDKXH2,767023765,Vera-Beth,"[1, 1]","WE REALLY LIKED IT. I WISH IT HAD BEEN LONGER. THE ACTORS WERE GREAT! PEOPLE DON'T REALIZE THAT AMERICAN COLONISTS WERE HAVING CHRISTMAS DINNER WHILE THEIR ARMY WAS COLD, HUNGRY, ETC.",5,EXCELLENT MOVIE,1368662400,"05 16, 2013",0.384
