,reviewerID,asin,reviewerName,helpful,reviewText,overall,summary,unixReviewTime,reviewTime,Sentiment
0,A2MO0NUJ76FPG0,767023765,A. H. Lynde ahlynde,"[7, 7]","I often show The Crossing to my political science classes and invariably they are enthralled. It is an intriguing, almost shocking film. The most striking surprise is that Jeff Daniels pulls off a portrayal of the great Washington with humanism, determinism, unparalleled leadership, mixed with a little testiness and bawdiness - in sum, a man with flaws who took his life and his mission seriously, while winning the loyalty of his rag tag troops.Washington was somewhat wooden, which Daniels again plays well, because he took every aspect of his life with dead seriousness and a clear vision of the nation he almost single-handedly created. Present at the creation of the new nation, commander in chief, he rallied his men at the battle of Trenton in December 1776, the subject of this film, avenging his early loss of New York City.The inaccuracies in the film are of little consequence since its essence is Washington. His audacious crossing of the treacherous Delaware on Christmas eve in the depth of night, completely surprising battle-hardened, but hung-over Hessians, helped turned the tide of the war at a time when America's victory teetered on disaster. Daniels creates a man, not a myth, giving him just the right amount of stiffness and caring for his men, and a determination that would win the very long war.James Kidnie as the Hessian Colonel Rall is the perfect foil to Washington. As the attack rages, he meticulously dresses himself and then panics at the American onslaught, hardly believing his eyes. Director Harmon's pacing is plodding at times, but the crossing itself is full of suspense, the battle scenes more than passably exciting. The cinematography and supporting cast are adequate. But the star of this film is Daniels. In sum, a fine A&amp;E production well worth seeing.",4,Hats Off to Jeff Daniels,1001462400,"09 26, 2001",0.0772
1,A3CSRP3P4U9HI,767023765,Alan R. Holyoak,"[5, 6]","A&E; does a masterful job of putting together a top-notch cast with an event of great importance to the future of the foundling United States of America.The acting, portrayal of conditions and general lack of support and material for prosecuting a war against Great Britain was well done. The moral of the Continental Army under Washington was at an all-time low prior to the crossing. Indeed they had known little but defeat until that time. Washington even had his doubts about whether some of his chief commanders would even follow orders.The story of the crossing, the hanging in the balance of the war with Great Britain, and the attack on Trenton are all masterfully done. Kudoes to A&E.; May they continue to produce more historically based efforts of this quality in the future.5 stars...don't miss it.",5,The crux move of the War for Independence,1037232000,"11 14, 2002",-0.0728
2,A1ECB0HP9W99K6,767023765,Alice in wonderland,"[7, 14]","This movie was well made, but had too much swearing in it. I understand that they were soldiers, but George Washington was a Christian and would not have spoken with so many profane words. We were only interested in the historical content of the film, but would only watch it once.",3,crossed over the line,1216944000,"07 25, 2008",-0.0079
3,A37PPLULHT6CFQ,767023765,Amazon Customer,"[0, 0]",No close captions! No subtilies! pissing me off still.. end up gave that dvd to my mom. I love this movie.. I remember when I saw it on television once... man! freaking pissing me off when found out has no captions!,5,I love the movie but!!!!!! NO CLOSE CAPTIONS!!!!!! PISSED ME OFF,1377043200,"08 21, 2013",-0.2124
4,A39DVY6IX4LVBD,767023765,Carol abts,"[1, 2]",Excellent movie!Acting was very good.I loved getting to know the historical characters .Movie was well done. One I can watch over and over again,5,Washington and Company,1352419200,"11 9, 2012",0.4413
5,A27T7FAONDX6VI,767023765,Chris Chris906,"[2, 4]","Jeff Daniels had brought to life previously a great figure in American history by his masterful job as Joshua Chamberlain in 'Gettysburg'. In 'The Crossing' he takes on a even larger icon from the American past and pretty much knocks it out of the park. George Washington has always been one of my favorite historical characters, I think pretty highly of him. I think that he and his men were the glue that held the American Revolution together. Washington could have been a dictator but wasn't. His character and devotion to country are the stuff legends are made of.'The Crossing' finds Washington at a critical time when he is at low ebb after the humbling defeats around New York. The war effort is portrayed in a very unromantic life. This was a war that America lost more battles than it won. But Washington at Christmas 1776 had a ace up his sleeve and the rest as they say is history. Daniels dazzles as Washington and portrays him as a very human character and shows his great temper that Washington usually kept under wraps. His dry humor is also a nice touch. I also like the bringing to life of the nearly forgotten John Glover ,by Sebastian Roch&eacute;, and the true bravery of his men and what they sacrificed for the cause without their efforts little would have been possible. Roger Rees also does a nice job as Washington's friend Hugh Mercer. Mercer was one of the ancestors of George S. Patton of World War II fame, for a little trivia.The film captures the cold of winter well and is a DVD to watch in December-January when the leaves have fallen off the trees and you have a warm crackling fire inside. This film captures that tough winter well and the spirit of the men who remained and the great leader who led them in one great roll of the dice. I wish more films were made about our Revolution.The DVD has good picture and sound plus an interesting little 'making of' the film as an extra.Highly recommended!",5,Very Good Film on Washington and critical time in the American Revolution,1249776000,"08 9, 2009",0.2393
6,A2XM719J28KV2,767023765,Cole,"[5, 7]","The music made this terriffic film perfect- it was just excellent. The dvd also contains a behind the scenes special feature -which was good but not great. Jeff Daniels is great as George Washington, and has an excellent supporting cast. I thought the acting and emotion were terrific in portraying what Washington went through.. his army was being crushed and they needed to cross the Delaware and regroup to save the revolution. Good filming- an excellent production.. This is one of my favorite films.",5,Outstanding film,1099094400,"10 30, 2004",0.5137
7,A2F2HASXLTX9ER,767023765,C. white EM64,"[2, 3]","SO many people have done great reviews. My heart goes out to the soilders who were freezing, had no food or shoes. If one stops and thinks about the sacrificesof 1700's americans, it makes you appreciate more than ever all your blessings.I admire the revolutionary generation (more than anyother generation)for their bravery and laying ground for americans 200yrs later.",5,THERE WOULD BE NO AMERICA IF ITH HAD NOT BEEN FOR WASHINGTON,1315958400,"09 14, 2011",0.3519
8,A173UMTWFAN2DV,767023765,Dave Dave,"[0, 1]","Jeff Daniels does a lot of movies, spanning a lot of types of roles. But believe me... it's hard to believe that this is the same guy who played in Dumber & Dumber. THIS is a man playing GEORGE WASHINGTON... and while I'm in no way a history buff, I LOVE his portrayal of General Washington, and the whole story of the Deleware crossing, and how that one tiny thread of incredibly fated success turned the whole tide of the Revolutionary War. Awesome movie... awesome acting... and not typical for the types of movies he plays.The on-line purchase experience was excellent. :-)",5,Love this movie; great on-line purchase experience,1359590400,"01 31, 2013",0.2609
9,APZ9MBMUKD2W,767023765,D. D Lawson,"[4, 5]","GW is a very hard man for Americans to warm up to the. The Man is like another Virginian that comes to mind, Robert E. Lee. Both seem to be Marble Men (Not of real flesh & blood). All I can say is Thank God we have men like them when we needed them.Mr Daniels does his best to create the persona of out Founding Father and I feel that he comes pretty close to the mark.This films captures what I feel is the key moment of Washington's life as a General. In a bold and courageous move he won a good solid victory that helped keep the cause alive. No one else could of done it. I also feel that it showed accurately for a movie at least what ot must of been like to have been there.The uniforms seemed correct as was the weopons and tactics.All around a good addition to ones collection.",4,A good solid effort,1120953600,"07 10, 2005",0.3798
10,A38DSYHNBYZNUG,767023765,Dirk J. Willard Dirk Willard,"[2, 3]",I'd seen this movie on A&E; many years ago and wanted it in my collection. Despite a low budget it is an excellent historical piece. The movie brings history to life. We need more movies like this so that children will appreciate the sacrifice that has been made for us.You'll want this movie in your collection. Please add your vote.,5,"Well-made, well-acted",1334966400,"04 21, 2012",0.3377
11,AOHYZBTBQ5PN4,767023765,Dr. Glenn W. Briggs MusicDr,"[1, 1]","Truly excellent films on the Revolutionary War are rare indeed, and this is absolutely one of the very best. While it is a serious, well-filmed story on General Washington's most challenging times during the war, with plenty of drama built into it, it is very much a factual masterpiece, more than adequately supported at the conclusion by a summary of the lives of the individuals who were most prominently featured in the story. The film carefully built up enduring the dire situation at Valley Forge into culminating with Washington's famed &#34;Crossing of the Delaware,&#34; no mean logistics feat at the time, and the surprise taking of the British forces at TrentonPerhaps the most powerful aspect of the film is Jeff Daniels' portrayal of George Washington, during which he once again showed his versatile thespian abilities. I cannot think of another contemporary actor who could have played the part more believably. Be assured, the casting organization that selected the rest of the actors did a wonderful job. While some of these are not prominent actors, their selections to those parts, and their deliveries of same were superior.",5,One of the best Revolutionary War films of all time!,1385856000,"12 1, 2013",0.5209
12,A1DFVBED2NTPYB,767023765,Elaine Childers,"[0, 0]",Very prompt! Got it just before I needed it. I teach American History in Junior High and the action was great to hold their attention while they learned history!,5,Very Prompt,1392422400,"02 15, 2014",0.2196
13,A1O9GIBB9P2ZZX,767023765,Eugene L. Stickley Gene Stickley,"[8, 10]","Every American should see this film. They should see, in the dramatic way that a video makes possible , the sacrifices that these earlier people made to give us a free country.I have often marvelled at the patience and tenacity of Washington through those 7 long years of war. This film emphasizes his tenacity and just plain &quot;toughness.&quot; It also gives us a picture of those few common soldiers who stayed with him through bitter defeat and privation while the majority deserted or otherwise disappeared. These few made the great difference. And among these few were fewer still the fishermen from Marblehead who saved the Army in New York making possible the escape march to Valley Forge. This same close-knit group of men made the difference again at The Crossing. They knew how to handle boats actually making the crossing possible.As you watch the film listen especially carefully to the conversations between General Washington (Jeff Daniels) and Col. John Glover (Sebastian Roche). Col. Glover is the feisty, outspoken officer who often disagrees but who knows how to take orders. He commanded the Marblehead fishermen without whom Valley Forge and the Crossing would never have taken place.If you are interested get Howard Fast's &quot;The Unvanguished.&quot; This book tells the story of the Marblehead fisherman in New York in detail. Fast wrote The Crossing including this film script. With Fast's earlier New York battle background you will understand how the Army got into such a desperate situation and Washington's relationship and conversations with Glover in this movie will make all the more sense. .The acting is good to very good. The script is very good. The story moves along well. The settings are realistic and well done. This is no sacrifice. It is real entertainment. But it could inspire you to a little sacrifice for your country should the need arises.",5,America's history of tenacity and unselfishness,1080345600,"03 27, 2004",0.1497
14,AA9BZ5Q8O22RL,767023765,Faith Page Silent Witness,"[0, 0]",I saw this on TV and decided to get it to show the family every Thanksgiving. It has great acting and it is very realistic in it's approach to the journey to America. I will show it at school as well.,5,Great educational and entertaining movie.,1389571200,"01 13, 2014",0.2994
15,A2XQBDXZH0O03J,767023765,gary haines,"[0, 0]",Jeff daniels did a superb job as he always does. I'm intrigued by what our forefathers fought through for us to gain the freedoms we now own.,5,Was great,1390867200,"01 28, 2014",0.5677
16,A192UPT6KST3E2,767023765,Gary W. Phelps,"[1, 1]","This is an incredible and accurate portrayal of Washington's Crossing the Delaware, and his remarkable defeatof one of the World's best armies - the Mercenary Hessians - in the 18th Century - from which the Britishnever recovered, and made the first reversal which resulted in victory! Most important, how General Washingtonliterally got off of his high horse, dared to sit as an equal in a row boat with some of his most common soldiers,and led them to victory! America needs more &#34;boots-on-the-ground&#34; leadership like this today!",5,The Crossing,1369094400,"05 21, 2013",0.5498
17,A11ZW62AAM10NU,767023765,Guitar Fan,"[5, 6]","Overall, I was very impressed with this production focusing on a single and important event in a long, hard war.In this movie, none of Washington's men were lost. In Washington the Warrior, 6 of his men were lost. Which is correct? I think the latter. Despite the creative licence taken by the producers and writers, there is still much about this that is factual and the performances were impressive. I bought this as part of the History Channel Founding of America box set and I'm still working my way through the DVDs.This and Washington the Warrior were very well done, but do not waste your time on the founding fathers and founding brothers History Channel DVDs. I don't think the Karl Marx fan club could have made a worse presentation of Thomas Jefferson and James Madison. It was a ridiculous assault disguised in the form of a historical production. Seriously biased against small government Jefferson and Madison and drooooling over big government, American Monarchy advocating Hamilton. Garbage.",3,Impressive and entertaining with some creative license,1307059200,"06 3, 2011",-0.0599
18,A3ML2HRDE3PY5I,767023765,Hikari,"[9, 18]","I recently saw the HBO miniseries John Adams and was compelled to watch this movie for a different perspective on a portion of the same period. Like most American schoolchildren, my familiarity with the crossing of the Delaware at Trenton was limited to the famous painting of that event which shows General Washington perched imperiously in the prow of a boat while being rowed through icy waters in the dead of night. The reality was decidedly less cinematic; unfortunately, so is this made-for-television treatment. Admittedly, I was spoiled by the superior production values of John Adams beside which this production pales. In its favor, it does present a grittier version of life in the Continental Army than we are accustomed to seeing and does much to humanize the deified personage of its Supreme Commander. But the production was hobbled by obvious budget constraints and prosaic camera work that make it look very like the TV project it was. This decisive battle that turned the Revolution in the colonialists' favor is portrayed as little more than a skirmish between Washington's ragtag band of volunteers and a bunch of unsuspecting drunks. Maybe in truth that's all it was, but the amateur look of this production does nothing to elevate the action into something a little more noble. It appears that the fate of the Revolution hinged on little more than a brawl. But it was a brawl the fledging nation desperately needed to win, and Washington is revealed as a crafty stratetician who was willing to risk all on a breathtaking gamble all others dimissed as insane. The isolation of Washington's command is portrayed with numerous references to the utter lack of support for Washington from the very body that had authorized him to carry out this war. Citizens of the Republic in the present day may take comfort (or not) in the knowledge that from its very earliest incarnation, the Congress honed its reputation as a bunch of blow-hard self-promoters who existed to endlessly debate but not to act. Also shown is the in-fighting among Washington's generals, some of whom resented his authority and in some cases, plotted actively to undermine it. As Washington, Jeff Daniels successfully gives the 'statue' flesh and bone. He has a wonderful physicality for the role and looks every part the vigorous and devotion-inspiring leader in his prime. More problematic is his delivery, which sounds too much of the contemporary Midwest (Daniels is a Michigan native) and not much at all like the 'gentleman from Virginia.' In general, I am not in favor of American actors larding up their dialogue with distracting accents, but though Daniels looks great, he does not sound convincing as a Tidewater aristocrat. In contrast to the mostly British supporting cast with their more elegant diction, Daniels is rough-hewn and out of his element. He also delivers his lines very s-l-o-w-ly; one hardly thinks Washington, in the heat of battle for his life and the Republic would have been so laconic. The teleplay by Howard Fast (based on his novel of the same name) displays a tin ear for authentically colonial-sounding dialogue, with many 20th century anarchronisms creeping in, and it presents the greatest obstacle for the actors. Some worthwhile moments of content, but stylistically this could have done better by its subject.",2,An Epic Battle Not So Epic,1216252800,"07 17, 2008",0.2045
19,A39QEKNEFSJ34Q,767023765,hrladyship,"[6, 6]","This movie, telling the story of Washington's crossing the Delaware in December 1776, is based on the book by Howard Fast. It gives a vivid picture of the trials of the early period of the Revolutionary War endured by Washington and the men who followed him. Jeff Daniels' portrayal of Washington is gripping. Sebastian Roche as Col. Glover is wonderful. The rest of the cast were well chosen.One of the most charming scenes is between two of the common soldiers trying to stay warm and dry in a small tent. They discuss the merits of smoking corn silk vs. cow dung in their clay pipes. They are very young and very humanAnyone interested in the history of the Revolutionary War will find that this movie brings the struggle alive, depicting the officers and soldiers as men. The Hessians may be depicted as too mean, but the conversation between their commander, who expresses concern for the treatment of his men, and Washington is touching. This movie ranks with Gettysburg in its depiction of war in an earlier era.",5,Great history,969062400,"09 16, 2000",0.0458
20,A26OLSBTEN0JJW,767023765,Jack D JD,"[0, 0]",Jeff Daniels was a good choice to play George Washington in this historical drama recording Washington's famous crossing of the Delaware River and the raid on the Hession barracks at Trenton that ended in a rout victory for the Colonists. Well done.,5,Washington's crossing of the Delaware,1403308800,"06 21, 2014",0.4609
21,ATN0Y8XVU7CVF,767023765,James LaMar,"[0, 0]","This film is fantastic! Jeff Daniels is the best George Washington I have ever seen! The conversations convey the type of speech used in that colonial period, yet are understandable today. The research that went into the costumes and props is phenomenal and makes the film look very authentic.The cast is wonderful, and this film is inspirational!For those who love this movie and would like to read more, I would recommend Thomas Fleming's exceptional book Washington's Secret War. Having seen this movie, you will feel like you know this George Washington personally, as you turn the pages.",5,one of the best historical films I've ever seen!,1364774400,"04 1, 2013",0.498
22,A34Z7W0O9EV9GD,767023765,Janeal Shaffer,"[2, 3]","The history protrade was amazing, but the actor playing Washington did not fit my view of him. At first it was frustrating to watch him until I started focusing on the history that was being shown and then it was unbeliveable what they went through to accomplish what they did. Also, my understanding of Washington was that he was a very God fearing man and would retreat into the woods or pirvate places to ask for guidance from God. None of this was protrade. With out divine intervention the victory would never have happened.",3,The Crossing,1377907200,"08 31, 2013",0.1695
23,ASKECFIDZOQJ7,767023765,Jeff Cross His Illustriousness,"[1, 1]","While everyone's heard of Washington crossing the Delaware from history class, very little attention is paid to the man who actually made it happen: Colonel John Glover. Being from Marblehead, it's rather difficult to escape him and his legacy--I briefly attended Glover School, had a dinner at the General Glover House restauraunt in neighboring Swampscott, and once toured the old destroyer USS Glover--and was surprised to learn just how practical and sensible he was in relation to the more well-known Hamilton and Knox: he deliberately remained a colonel while the rest of Washington's command staff were generals, partially due to being abrasive (&quot;What this army needs is more private soldiers, not more generals!&quot; he declares when Washington remarks on this), wore his own clothes instead of a uniform, and wouldn't stand for any sort of foolishness when it came to his first specialty of seamanship.",5,Great validation of a lesser-known patriot,982454400,"02 18, 2001",-0.371
24,A2BSZPRBKYAB2K,767023765,Joe Owen Joe,"[50, 53]","In the last 10 years or so, Hollywood and cable TV has finally started to get it right when they make movies (Widescreen or TV) about historical events, and The Crossing is no exception.This is a well acted account of one of the major events of the War of Independence. Jeff Daniels portrays a superb George Washington, who was at times very impatient and hot tempered. History seems to gloss over the imperfections and vulnerabilities of our nations beloved figures, however this movie shows Washington to be flawed and tired at times like the rest of his army was.The uniforms,locations, and camp life were accurate as well as the filth and harsh existence the Continental Army had to go through. The movie did an excellent job of trying to film the famous battle, which definitely caught the Hessians by suprise.Overall, a well acted, accurately portrayed Revolutionary War movie.",5,A well acted and accurate accounting of the historical event,954288000,"03 29, 2000",-0.0902
25,A3F5TDY7UWLN5A,767023765,John W. Helderman Pathfinder,"[1, 3]","I enjoyed this movie and show it to my American History classes. The kids liked it. It is very historically correct. I have to admit that I kept thinking about Jeff Daniel's Dumb and Dumber character when I saw him as George Washington, I dont think the students noticed. Other than that distraction.. I would recommend it.",4,Good historical movie...a little slow in parts.,1162684800,"11 5, 2006",0.0499
26,AC06F0LPHI1TW,767023765,K Scheffler,"[1, 33]","The Crossing is really just not a good movie, but I still find it interesting because some of the movie was filmed quite close to where I live; the opening scene when Washington's bedraggled army is marching through a wooded area, and the camp scenes near the beginning of the movie.To say that the acting in this movie was good would be a slight over-statement, and the dialogue is not what one would call stellar. I would not be so certain about the accuracy of the movie either--few movies are. The general course of events may be faithfully adhered to, but no movie based on a historical event that I can think of has not taken liberty with the truth for one reason or another.",2,Not a good movie,1076889600,"02 16, 2004",0.2656
27,A14FK46E8WIXD1,767023765,lana smith,"[1, 1]",I love this movie. great acting and very well done. I would definitely replace this movie if it becomes damaged,5,a great movie,1370390400,"06 5, 2013",0.4476
28,A1V05KUGZKS6MO,767023765,Laurence J. Rusiecki,"[0, 0]",Anyone with even a remote interest in the American Revolution with enjoy this DVD. Few Americans realize how close this nation came to losing its bid for independence from Great Britain. It was Washington's bold raid on Trenton that resurrected the American cause. Never before or since has our country been so close to utter defeat and needed a military victory more. This film offers a detailed and entertaining glimpse at this incredible feat of arms. Jeff Daniels is excellent in the role as our first Commander-in-Chief. The production values are good as well. It's almost like looking back over 200 years at an event as it was happening. This docudrama is well worth the modest price that Amazon charges!,5,Opinion on The Crossing,1374537600,"07 23, 2013",0.3877
