,reviewerID,asin,reviewerName,helpful,reviewText,overall,summary,unixReviewTime,reviewTime,Sentiment
29,A3DWO5RJDA430F,767023765,L. Da Vinci Renaissance Man,"[0, 0]","I purchased this DVD after seeing it on TV. It goes into detail on the true crossing of the Delaware by Washington and his troops during the crucial battle of Trenton, a turning point in the revolutionary war. There is a lot of bloodshed shown -just as it was in real life-.This DVD may be more instructive than any history book, to a young person wishing to learn more about the revolutionary war.",5,The true Washington crossing the Delaware,1162425600,"11 2, 2006",-0.3436
30,A3KB1H0S7T6JX1,767023765,L Gontzes,"[2, 3]","Unlike The Patriot which was purely made for propaganda purposes, The Crossing, follows a much more pragmatic, realistic, and in effect a more truthful account of events during the American War of Independence (1775-1783). The film brings to the screen George Washington's first victory during the American Revolution: The Battle of Trenton.It is December 1776 and the Continentals have yet to score a victory against the British. Chased by government forces, the rebels find themselves exhausted on the banks of the Delaware river with General George Washington remaining Commander-in-Chief, but of the now remnants of what used to be the Continental Army (once numbering 20,000, now at 2,000 and dwindling). Subsequently, Washington is faced with yet another difficult choice: does he camp for the winter and hope that he will still have his rank and an army spring come, or does he surprise-attack the city of Trenton, which is in the hands of 1200 crack German troops from Hessen?The Crossing provides valuable insight into a very important period of American (and British) History. Specifically:We get a taste (though a very light one) of the different attitudes and mentality of English North American colonists during the war e.g. when the foundry's owner refused to let the Continentals use his boats (before they were in turn confiscated).Moreover, we get to see or hear about, the double-crossing generals such as General Lee that allowed himself to be caught... and yet not so much about the merchants, farmers, and politicians that supported whichever side the wind happened to be blowing in, always in search of profit and personal gain, which another film, Benedict Arnold: A Question of Honor, portrays so well.The clash between the Loyalist American English and the Continental American English is not really shown, just the one between the Continentals and the British along with their Hessen allies/mercenaries, which is nonetheless fascinating and very well presented throughout the film; but then so is the clash within the Continental side (the undermining, the personality clashes-Washington vs Gates and Lee etc, favoritism-the contingency plan in having Sullivan arrest Lee), as well as the problems between Congress and the Army (there are the subtlest of hints for the latter/Ral's sword sent to Congress).There is also the brave admission (by G. Washington) that the Continentals lack public support (enlistment being at a minimum, while trying to keep their minutemen from deserting), and the important role that Washington played throughout the Revolution in keeping the Continentals alive, long enough for the French (1778), Spaniards (1779), and Dutch (1780) to enter the war against Great Britain, and win the war.Therefore, the movie successfully sheds light on aspects of American History that some would rather keep hidden under the carpet.As a result, The Crossing, is a daring movie, which shatters more than a few misconceptions, deliberate and not, surrounding attitudes towards the War of Independence, and provides for historical truths, which had been suppressed for long years in the name of patriotism.The only major setback is in relation to Jeff Daniels who is not that great in his role; Kelsey Grammer was a much better Washington in Benedict Arnold: A Question of Honor.As for the end where it states that: The records show that a total of 16,992 Hessians were brought to America to fight the colonists. That should be ...to fight the rebel colonists, not forgetting the Loyalists and the Neutrals made up approximately 1/3 each, of the total colonist populace.In short, The Crossing is a movie definitely worth watching, and one to seriously consider adding to your movie collection.Strongly recommended, especially for History buffs, along with Revolution starring Al Pacino, and Benedict Arnold: A Question of Honor, starring Aidan Quinn and Kelsey Grammer. 4.5 Stars",5,"In the end, sir, we all kill for profit",1153353600,"07 20, 2006",0.0482
31,A17FLA8HQOFVIG,767023765,Linda Linguvic,"[20, 26]","This is a made-for-TV movie produced by the A&amp;E television network in 2001. It was adapted from a novel by Howard Fast and I assume it is historically accurate. It's about a defining moment in American history - that of George Washington crossing the Delaware River and attacking the well-trained German soldiers hired by the British, at Trenton, New Jersey.I recently visited a friend who lives in that area and walked across the bridge where George Washington made this historic crossing. Of course there was no bridge back in 1776 on that cold December day -- just the dark and the cold and an ice-filled river. The Continentals, which was what the Americans were called then, were losing the war. They had not won a battle since they declared independence six months before on July 4. The troops were weary and starving. It looked like the American Revolution was lost.But Washington took a huge risk, and in his own quiet and determined way, made a decision that changed the course of history. The scenes of the actual crossing were done in fog and shadow, as the boats moved towards the opposite shore. But there were no scenes that looked like the famous painting with Washington standing in the front of the boat. In this film, Washington was sitting throughout. Naturally, this made me re-think my own historical perceptions.Jeff Daniels is cast as Washington, and I found myself very critical of his performance. He seemed aloof and wooden and, even though there was constant danger, he never lost his cool, calm leadership abilities. I understand, though, that this is exactly the kind of person that George Washington was. If this is true, then he did portray him well.Basically, though, even though there was some conflict between the various generals as well as a bit of bawdy language and some violent scenes of swordplay, the film never rose above that of a history lesson, one shown in classrooms or while visiting museums. I tend to like my drama more complex though, and for that reason this film, while well done, has to be viewed for what it is. I therefore give it a modest recommendation. It's certainly worthwhile seeing.",4,Well-done history lesson,1032566400,"09 21, 2002",-0.0183
32,A3IQA3VVDHGAK1,767023765,Lisa Lisa,"[4, 5]","This movie was well done on every level. Good script, believable acting, excellent editing, great direction. I really liked the way Jeff Daniels portrayed Washington -- strong, understated and always believable. This movie works on every level and absolutely makes you feel like you're there. When a historical drama is able to make you feel transported back through time, it has succeeded.",5,Beautifully done in all respects,1214870400,"07 1, 2008",0.5399
33,A3KG05WRY0GBTV,767023765,Mary A. Enriquez Royal Expert,"[0, 0]","My husband had seen this on TV and really liked it so I got it for him as a Birthday suprise. He was thrilled Thank You,",5,A VERY GOOD HISTORICAL FILM,1363046400,"03 12, 2013",0.5675
34,A30WFYKC1210LA,767023765,Mary A. Sprinkles Myrtle,"[0, 0]",A really great movie that keeps you riveted. Does a great job at depicting just how ragged and ill Washington's troops were by this point in the war. When you see just how close the entire endeavor was to defeat it makes you astounded that we sit here now 50 states strong. With this one offensive Washington truly snatched victory out of the mouth of defeat.,5,Wonderful,1378425600,"09 6, 2013",0.0693
35,A3PR4ZSBDUL4EG,767023765,Matthew S. Schweitzer zohoe,"[108, 111]","This is a wonderfully done made-for-cable movie about George Washington and his famous victory at the Battle of Trenton in the winter of 1776. Starring Jeff Daniels as General Washington, this film brings an important episode in American history vividly to life. We see the broken remnants of the Continental army as it races to avoid capture following their defeats in New York. The British, close on the heels of the retreating rebels, have written the Americans off as being on the verge of total surrender. Washington, tired and beaten, realizes that he must make one last attempt to achieve victory or all hope for the revolution will be lost. Against the judgement of his officers, Washington prepares to launch a desperate offensive against a large force of Hessian troops occupying the town of Trenton, just across the Delaware River in New Jersey. The future of the new United States hangs in the balance as the rag-tag army bets all or nothing on this dangerous gamble. Well written and with money well-spent, The Crossing is a dramatic telling of this important moment in American history, and one that I would recommend to teachers, students, and history enthusiasts alike.",5,Washington and the Battle of Trenton,1015718400,"03 10, 2002",-0.1422
36,A1S1MNKAU5FXWK,767023765,MCB mb1620,"[0, 2]","Excellent, excellent movie! I have watched it over and over and enjoy it just as much each time. A&E movies are always well done and this is no exception! The DVD version, as usual, gives you more for your money with background, actor interviews, etc.",5,Brilliant!,1044230400,"02 3, 2003",0.305
37,A3DPLF1J3ILMTO,767023765,Mochyn,"[15, 27]","I agree the the reviewer's comments that Daniels is miscast as Washington. No one would take him for a Virginian; rather like the old Disney production of the Swamp Fox played by a young Lesley Nielson with a New York accent. Also Welsh actor Roger Rees with an English accent plays the Scottish general Hugh Mercer who had to flee Scotland for supporting Prince Charlie.One of the worst and unexcused errors is when Washington asks after the battle: how many killed? None (correct). How many wounded? none. Incorrect. There were four wounded one of whom, the most seriously wounded was a young lieutenant in the 3rd Virginia named James Monroe. Fifth president of the United States. Worth mentioning I would think.",1,Poorly researched; poorly cast,1284336000,"09 13, 2010",0.0297
38,A3EBJDZ5N1UEI5,767023765,Patricia,"[8, 10]","In all honesty, I expected this to be a so-so movie, however it turned out to be well done and very enjoyable. Jeff Daniels gives a wonderful performance as Washington and lifts the movie above the usual mediocrity of most made-for-TV-movies. All too often, actors are cast to play historic characters they just do not fit. In this case, not only does Daniels bear a passable resemblance to Washington, but he conveys the concern, insecurity, impatience, and determination the general admitted to feeling in his letters and correspondence.I enjoy reading about history, particularly the colonial/Revolutionary War period, and am generally wary of historical movies due to their tendency to fudge on facts. While I do not claim to be a historian, I found The Crossing to be pretty accurate. I do wish they had brought in more soldiers since the battle scene appeared somewhat skimpy in that regard.The sets and costumes fit comfortably with the time setting, as does the language and mannerisms. The picture is clear and clean, not distorted by fading colors or other problems. While it was made for TV, I did not find the breaks to be annoyingly obvious as with some. The DVD includes extras, including an interesting account of the movie being made, as well as interviews. One part shows how stunt men made the battle scenes appear real- something younger viewers might enjoy.There is neither objectionable language in the movie, nor any sexual themes. The battle is not particularly bloody or violent, but would probably be PG if rated. It would make a nice addition to a homeschool history curriculum as well as the family video library. I will certainly be watching this movie again.",4,Surprisingly well done,1209168000,"04 26, 2008",0.256
39,A2EWN4ANV3CPG6,767023765,Paul Sayles,"[4, 4]","The Crossing is about a small action that became a pivotal point in the American Revolution, the American assault on German mercinary troops in Trenton, NJ. What struck me was not the audacity of Washington attacking in the dead of winter, but the cooperation of his subordinates that was need to even make this action remotely possible. This is an ensemble performance that centers around Washington but shows the synergistec effect that was needed to make the attack work.Jeff Daniels is excellent as Washington pulling his dispirited troops together for a decisive action. Washington was taking a great risk, maybe the biggest of his career; by making a winter attack. Armies of this time, rarely, if ever, fought in the winter and Washington was going against convention by doing so. He was also conducting an amphibious operation which is one of the hardest operations to perform in warfare. Here the cooperation of others was critical. If the men under Colonel John Glover were unable/unwilling to give their all, Washington might just as well have stayed in camp. No boats, no action fairly well sums it up. Washington's troops could have muddled through and affected a crossing, but the element of surprise, I am sure would have been lost and no surprise meant a harder and more doubtful battle. Glover is the true unsung hero of the battle and it is good to see him recognized as such.This film abounds in small points. The depiction of the Pennsylvania German troops in Washington's command is well done. The state of mind of Washington's troops, ofter overlooked, is shown in great detail. The use of period sites also was a big plus in the making of this film.In all, I found this one of the best films about Washington's attack on Trenton and one that gives a new impression of the compexity in executing this battle. This film should be in the library of every person with an interst in early America.",5,Washington at his best - his back to the river!,993600000,"06 27, 2001",0.0142
40,A2K53OYO4JJO28,767023765,Pete N. Austira,"[1, 1]","Every has visons of Christmas morning - waking up, opening presents, But in 1776 Washington and te Continental Army crossed a nearly frozen Delaware River. This is that story. But this story goes into some personality traits and some of his men. Highly recommended at a time when it has become chick to belittle our foundng father.",5,A New Look at Christmas,1382832000,"10 27, 2013",-0.051
41,A2K7ETEIA4AB5R,767023765,PTR papapossum,"[6, 11]","There are some historical inaccurracies in this film, to be sure. The Wikipedia entry for the movie has most of them. And like most movies dealing with any war, there are not enough men on the screen to portray the actual number of soldiers involved. Washington had more than 2000 troops when he went into Trenton, up against about the same number of Hessians. Of course, without computer-generated graphics, there's no way a made-for-television movie can portray that.I have to question the casting of Jeff Daniels as Washington. I know Washington was a flesh and blood person, but somehow Daniels (or perhaps the script he had to work with) does not communicate the gravitas that must have personified Washington. This was a man chosen practically unanimously by the Continental Congress to lead the army. Daniels does not come across as that sort of person.Although it is known that Washington had a temper, especially in extremis, most of the time Daniels' Washington comes across as merely petulant or even bitchy.The dialogue between most of the characters seemed at times to be pretty anachronistic. American screenwriters should take a lesson from their British counterparts (Andrew Davies, for example) on how to write 18th Century dialogue that sounds authentic but not stilted or phoney.Finally, THIS MOVIE IS NOT FOR CHILDREN. We watched it with our 7 and 9 year olds because they're studying the Revolution in school. We were dismayed by the bad language, sexual references and the over-the-top bloodletting. Why did the director think it a good idea to show closeups of bayoneting and swords going all the way through people? Showing it is one thing -- but closeups? C'mon! At least the DVD should have indicated what's in store so parents could be informed.",4,E for effort - BUT NOT FOR KIDS,1171411200,"02 14, 2007",-0.0254
42,A34Y7CPYT0QXTY,767023765,R. A. Martinek Triarius,"[7, 8]","There is an old debate as to which is truer: history or poetry.The accuracy is surprising, considering that it was adapted from a novel written by an author who generally knows better than to let history get in the way of a good story. In this case, the bending of the facts, mostly in characterization of some of Washington's generals, was relatively restrained, and supplied conflict that was real, if not always attributed to the correct historical person. Thus, the literary license does not get much in the way of history. Many of the small details are correct to an exceptional degree. All the characters, whether historically accurate or not, are well portrayed as people of the time. There is enormous subtlety here.This is a magnificent expression of the American situation at the time and place.Which is truer, history or poetry?The correct answer is: Yes.This film is both. Don't miss it.",5,History or Poetry?,1146096000,"04 27, 2006",0.1763
43,A2TY359PR45ATP,767023765,"R. Edward Merrell, Jr. emerrell2","[1, 1]","I've read several histories of Washington and/or the Revolution, including &#34;Washington's Crossing&#34; by David Hackett Fischer - a very good book and surprisingly easy to read - and &#34;1776&#34; by David McCullough, which covers the Battle of Trenton in detail. This film - despite some revisionism - is an excellent portrayal of the crossing and the Battle of Trenton. Jeff Daniels does a surprisingly good job of characterizing Washington's demeanor, patriotism and dedication to the &#34;Glorious Cause&#34;, as most revolutionists of the time called our American Revolution. After all Daniels is not new to portraying historical military figures, having portrayed Joshua Chamberlain in &#34;Gettysburg&#34; and &#34;Gods and Generals&#34;. In fact the acting by the entire cast is uniformly good throughout. Despite his dedication and patriotism, Washington had surprisingly little military experience before taking command and had to learn as the revolution evolved. Trenton was his first real battlefield success. Washington came very close to losing his army; and we came very close to losing the Revolution in 1776. It was mostly due to Washington's determination and daring that we were able to continue fighting instead of going down to an inglorious defeat. This movie does a good job of telling that story...it is an excellent film and an excellent history lesson. I think General Washington would have smiled and nodded in agreement after watching this.",5,Good History Lesson!!,1378944000,"09 12, 2013",0.3166
44,ARYWKFOWV7BFD,767023765,Richard O. Williams III,"[0, 0]","I love programs of this type. I thought it was quite enjoyable, despite the feeling that it could have been given a more in depth treatment. The Crossing by Howard Fast, upon which the program claims to be based was more of a rousing tale. To be fair, I generally am always a bit dissapointed when I view a movie based upon a book after having read the book, I generally prefer to find books listed as the source for a show I enjoyed, which always provides for me an enriching experience.",5,Washington Crosses Again!,1358553600,"01 19, 2013",0.4359
45,A2XRMQA6PJ5ZJ8,767023765,Roger J. Buffington,"[2, 2]","As our schools manage to do a poorer and poorer job of educating our youth about America, movies like this one can help teach our kids about American history. George Washington was one of the giants of history, and this film is a dramatization of one of his many great achievements -- the Battle of Trenton. Leading a small, discouraged, and cold and hungry American militia Army, Washington took on the finest soldiers in the world and won a great victory. Had he not done so, the American revolutionary cause might well have failed. History correctly records that it was George Washington whose inspired leadership won the Battle of Trenton.Jeff Daniels does splendidly as George Washington, and the supporting caste is also quite good. The film moves at a brisk pace, never drags, and engages the viewer's interest at all times. Highly recommended.",5,Very well done -- splendid historical drama,1239321600,"04 10, 2009",0.3663
46,A2BIAR1V0PWO27,767023765,Roger Kennedy International Military Music S...,"[8, 10]","I give this film five stars despite some of its historical innaccuracies because it is so well produced. Compare this movie to say something like Mel Gibson's PATRIOT and you have the difference between quality and trash! The movie conveys the feeling and desperation of Washy's army on its last legs before striking back at Trenton. Jeff Daniels does a spirted but probably false impression of Washy. In reality the man was much more stiff and proper than is shown here. Washy would never use such language in front of the common soldiers! He rarely lost his temper as well, otherwise the famous tongue lashing of Charles Lee at Monmouth two years later would never have created such a sensation as it did. Daniels makes Washy much more likeable to the modern audience, but is an flawed portrayal.The production value of this film is first-rate. Obviously period re-enactors were used and their dedication to the hobby shows in the correct formations, drills, etc. The brief skirmish at the beginning with the British probably did not happen so close to the Delaware like that. Also, the uniforms for the British appear off somehow. They look like an earlier period, not the 1770s. Still, it works. The Hessians are well portrayed, although it would have provided variety if some Musketeer's with their tri-corn hats were shown. Not all of Rall's men were Grenadiers and Fusiliers!American losses were actually 2 dead from the march, and 4 wounded from the fight, including Hamilton and Monroe, the latter a future US President! I don't know why the movie did not convey this. The effects of Knox's artillery seems also much exaggerated. Solid shot and cannister was used, not explosive shells as shown here. Most films on this period fail to show artillery accurately in that regard. Still, the acting and mood of the film are right on the mark which makes it easily the best Rev War production out there. Too bad it did not go further to show Washy's next great triumph at Princeton where a small British detachment gave him a much harder run for his money. Still, what we have here is a nice concise work that comes close to converying the actual history of the event. This is more than most Hollywood productions do these days. Let's hope future movie producers draw upon this movie for inspiration rather than the PATRIOT and others like it.",5,One of the Best Rev War Pics Out There!,1163635200,"11 16, 2006",0.1349
47,AHPZM2KVOXRXS,767023765,Russell,"[0, 0]",This movie is one of the best on General Washington and the crossing of the Potomac!! A must for the history lover!,5,A great movie!,1402358400,"06 10, 2014",0.6613
48,A1I8JOACTULM0W,767023765,Shannon Holt dyscombobulated,"[5, 7]","My girlfriend and I enjoyed this film and felt as though we'd really seen George Washington. The film begins in 1776 and ends with the conclusion of the surprise attack on Trenton. This is one chapter of history we feel intimately acquainted with now. Although it doesn't seem to have enjoyed a great budget and although it has just a hint of an educational taste to it, the Crossing seems far more historically relevant than films like Patriot or Pacino's Revolution. Daniels displays incredible posture especially while riding a horse and as a passenger in a boat through all hours of the night and thus quietly impresses upon us the dignity of America's first and fearless leader.",4,Beautiful portrayal of Washington,1019088000,"04 18, 2002",0.3919
49,A3FZ0GBOWIAJQL,767023765,SkyTop,"[3, 10]",The first ten to fifteen minutes of this movie had so much cursing in it our Family could not finish it. This movie IS A VERY POOR PORTRAYAL of George Washington's character! It makes him out to be a fool instead of the person he himself was. We shredded it so no one else would be subject to its filth and lies.,1,WHAT A SHAME!!! What a waste of time!,1378166400,"09 3, 2013",-0.4648
50,A2IX2ZWCEHTN54,767023765,Stacy N. Hawks historian09,"[1, 8]","I liked the story line, the actors but could have done without some of the cursing.",3,Crossing,1266105600,"02 14, 2010",0.2263
51,A5MRLHMBMWV77,767023765,Stephen Fowler,"[0, 0]","The only thing keeping me from giving this movie a 5 star rating is that the production was obviously on a limited budget. But true stories are the best stories, and the story of how dangerously close this nation came to losing the War for Independence is one that bears repeating. Our victory against the British was surely the result of Divine Intervention. There is a lot of great acting in this movie.",4,Jeff Daniels rocks,1389830400,"01 16, 2014",0.2521
