,reviewerID,asin,reviewerName,helpful,reviewText,overall,summary,unixReviewTime,reviewTime,Sentiment
37,AHSBR2WTM4P1G,B00000DM9W,Nematoda,"[5, 6]","Update: I've had the unit now for about two years. It still works fine, although the material covering the on/off button has worn completely off. Actually, it started wearing off after less than a year. In light of the fact that this is designed to be a shower radio, this is really an inexcusable flaw: after all, you cannot use the radio in the shower if water will seep into the innards of radio. Fortunately, I never used the radio in the shower itself. But, still, I'd have to take at least one star, even two stars off, for this defect (which I know other reviewers have commented on as well).The radio was a little smaller than I expected, but that's good. It takes up very little room on my bathroom counter and is quite unobtrusive. The reception is generally very good, although I tend to listen to only one station (89.3 KPCC). Still, I had trouble getting good reception with my last radio (an Aiwa), so the Sony is a big improvement. Occassionally, I still get a little static (depending on where I am standing in relation to the radio), but overall I would give it a score of 4.5/5.0 in terms of reception (I still occassionally get some static). I also tested all of the TV stations, and the Sony had no problem tuning them all in. No static to speak of, although the volume was low. I would definitely recommend this radio.The sound quality is quite good for a radio as small as this. I have to crank it fairly high to hear when I'm taking a shower (even though it's waterproof, I don't put in the shower with me). However, there's not distortion at high volume.I cannot say anything about the battery life yet, but overall I'm very satisfied with the radio.",4,Nice radio,1155081600,"08 9, 2006",0.1455
38,A10N9KVV3DIUWD,B00000DM9W,P. Radcliffe,"[3, 3]","Edit: Well it has been over 7 years since I purchased and reviewed this shower radio and it finally bit the dust. Radio still works (though lately I need to move it around a bit for best reception)and the clock is still really hard to see. It is the volume button that is kaput. I can only get very loud and painfully loud. Husband tried to fix it but couldn't do it. Seven years is pretty good, I guess. I don't see anything better on Amazon, at least for this price, so I will probably purchase another of the same. Something I did not mention in my original review: the batteries seem to last forever. Same number of stars for the same reasons.Original Review: This shower radio is attractive, compact and has great sound and station range. It is a 5 for the radio and a 1 for the clock. Unfortunately, the clock is very small and hard to read. I purchased it to place on a small bathroom chest close to the sink, but could not read the digital clock from there. If the radio is placed too high or too low, the small clock numbers are partially shadowed by the clock frame. There is no back light which adds to the difficulty. I had to place it on the sink vanity right next to where I stand and I still have to bend down slightly to check the time. If having great sound in a shower radio is really what matters to you, this Sony is for you. If you really need a clock in the bathroom, this is not the one for you.",3,Excellent Radio - Poor Clock,1162598400,"11 4, 2006",0.0626
39,A12Q2PV6TZ6XX9,B00000DM9W,Robert Gottlieb SoftwareGuy,"[0, 0]",This radio is nice with digital display and nice membrain push buttons. the battery capacity is good.. lasts a long time.. the thing that is disapointing is that you can not recieve any weather stations even though other radios in the area do!! also the am reception is no better than the 20 year old radio I replaced..,4,Sony Shower Radio,1184371200,"07 14, 2007",0.2932
40,AD4XKDR0MD7JO,B00000DM9W,Ron from Michigan,"[0, 0]","The radio seems good at first but they don't hold up to long-term use in the shower. I've had two of these which have died after several months of use, and am trying a different brand instead.",2,Radio Doesn't Hold Up To Long Term Use,1314316800,"08 26, 2011",-0.1596
41,A1DLFC5GG1RQFL,B00000DM9W,R. R. W. Radioman,"[0, 0]","I selected this radio for myself several years ago and I have found that all claims for it are true. It has excellent reception, clear sound, and the batteries last forever.I don't use mine in the shower itself, but sitting on the cabinet. Volume is very good.My recent purchase was a gift; there was no other shower radio that seemed to work as well. They were cheaper, but if they don't work, what have you gained?",5,excellent shower radio,1199750400,"01 8, 2008",0.4638
42,A21UD8A89984GP,B00000DM9W,R. Solomon,"[1, 1]","Sony does it again. They have put together a great radio for the bathroom. It is easy to set up the time, presets, etc. The sound and reception are great. The controls are on top and protected. The display could be brighter and I wish it had a way to hang it on the wall when not in use (it comes with a cord for hanging in the shower), but it is compact and does not take up too much space on the counter and it looks nice. I haven't actually put it in the shower since I can hear it just fine from the counter.",4,Sony Shower Radio,1181779200,"06 14, 2007",0.4588
43,A30VJALZMOTNW3,B00000DM9W,Serge,"[0, 0]","If your looking for a radio for your shower, then look no further. This gets great reception and the timer to shutoff feature is very handy.",5,Great Reception,1210204800,"05 8, 2008",0.1645
44,ALIMSOTBD6WMK,B00000DM9W,S. Iverson,"[0, 0]","This product gets used 20-40 minutes per day on average. I also use it around the house as a portable radio so it gets 1-3 hrs of use maybe once every other week. They say the battery life is 80 hrs, but that must be if you use it 80 straight hours. We received the radio in early March, put in 3 batteries, and they are still going strong (it is now December). Amazing. Sometimes I am shocked when I find a consumer electronic product that works well, works simply, and works reliably. This is one of those products.",5,exceptional,1187136000,"08 15, 2007",0.1963
45,ASHJAZC9OA9NS,B00000DM9W,Stephen,"[2, 2]",Reception is outstanding. Easy to set up stations. Timed on/off is automatic. Easy to read display. Great sound for a mono speaker. Battery life is amazing. Worth the price. I would happily repeat the purchase if I manage to wreck this radio.Update: The TV function of this radio is not functional with the digital TV change over.,5,Great Radio,1181952000,"06 16, 2007",0.3885
46,A2P45JTLZQ5C8V,B00000DM9W,T. Harrell,"[3, 3]","Very easy to use basic functions. Good tone, sufficient volume. Don't know what I would change, if I could. Well done.",5,Excellent design and quality construction,1138665600,"01 31, 2006",0.3016
47,AAK7M9P1GEYWV,B00000DM9W,The Professor,"[1, 1]","Worked well, but after about one year it died. I'm guessing water got into it. My daughter used it in her shower, and I'm thinking she allowed it to be directly exposed to the shower.",2,Died - probably from water,1211068800,"05 18, 2008",-0.2438
48,A36CCV2B7XQGJK,B00000DM9W,Todd K. Whitehurst Todd Whitehurst,"[2, 2]","I was given this shower radio 13 years ago as a gift. I have listened to NPR in the shower almost every day since then, and it has lasted and performed well. Finally the plastic cover over some of the buttons on top started to crack and break off, so I just bought a new one. It lasts many months (6 months?) on 3 'C' batteries. The reception is pretty good. I was hoping that Sony would have made it a bit more modern in appearance, but it looks decent enough for a shower radio. I like the countdown timer, as I can turn it on for 30 minutes when I take a shower, and by the time I am done dressing it shuts off automatically. Thus, I don't have to get back in the shower (wet floor) to turn it off.",5,First one lasted 13 years; just bought another one,1156550400,"08 26, 2006",0.2478
49,A1CSKKTDNT13BD,B00000DM9W,Vincent Sajkowski,"[1, 1]","I have to say, this radio works flawless in my shower. I've had it for a little over 3 months and I listen to it daily for about 15 minutes at a time and I still have yet to change the batteries on it (2 AA I believe). Prior to this shower radio I had a Brookstone am/fm shower radio which took 4 C batteries and I would have to change them about once a month. I get great reception of my FM stations and I even get some TV audio through it, to listen to the Football games. It's very small and sits nicely on my pedastel and comes with a suction cup antenna. All in all, I strongly recommend this shower radio over any other on the market. No problems, no complaints....",5,Great Little Radio,1163894400,"11 19, 2006",0.3991
50,A13JZ1WIEZMJXX,B00000DM9W,Will Irace,"[2, 2]","We've had ours for a year, use it daily (in the shower and all over the house), and it still looks and works like new. We may have replaced the batteries once. Maybe not, I can't remember.Keep in mind that it's not designed or sold as a hi-fi radio. It's not stereo, and the speaker is not large enough to provide a wide frequency response. But for its size and shape, it's as loud and clear as it can possibly be.You will never find a better radio for use in the shower: the reception is outstanding. The speaker is clear and loud enough to hear in the shower. The case is attractive and tough. The controls are easy to operate, even with wet hands. How often do you buy a product that's reasonably affordable and absolutely flawless?Update 11/7/08: My wife still won't just leave this radio in the shower, to my occasional chagrin. She carries it around the house to listen to NPR while she works on stuff and I can never find it when I want it. Today she dropped it on our hardwood floor. The battery door popped off, and and the batteries spilled out. She put them back in and NPR was again heard from the radio. Why haven't you bought one of these yet?Update 8/31/2010: Still going strong. This radio is no longer available, but theICFS79Wseems to be an able replacement. What a workhorse this radio has been!",5,The 160 previous 5 star reviews were right,1196726400,"12 4, 2007",0.149
