,reviewerID,asin,reviewerName,helpful,reviewText,overall,summary,unixReviewTime,reviewTime,Sentiment
0,A20AOQWXYDFAU7,B00000DM9W,Alec Mclure,"[0, 0]","[Update 8/19/08: it's over a year since I wrote the original review - radio looks almost new, cleans easily, works great, and still doesn't require frequent battery changes - still love it!]10. You've lost faith that there is such a thing as a good shower radio9. It would be much easier to get psyched for work if you could listen to some good rock while gettin' clean8. It would be much easier to get psyched for work if you could listen to some good NPR Morning Edition while getting clean7. It would be much easier to get psyched for work if you could listen to some the morning TV news while gettin' clean6. All of the above also applies to shaving or putting on makeup5. Tend to dawdle? It has a timer. Get out the door before the rest of the nuts get on the road4. It doesn't mind getting wet along with you3. Batteries have lasted me a month so far. Though I don't care. The sound is so good for a shower radio I'd happily replace them weekly2. Oh, the weather channel - very nice, although a bit repetitiveAnd the top reason you should buy this radio is:1. Ahhh, nine are enough. Just buy the thing.",5,Top 10 reasons You Should Buy This Radio,1174521600,"03 22, 2007",0.2469
1,A1Z64RLLQYQ959,B00000DM9W,Amazon Customer,"[0, 0]","I have used this radio for over a year, almost every morning for 30 minutes, and I have only replaced the batteries once. Great sound, easy to use. It is a Sony, what else do I say?",5,Great little radio,1190678400,"09 25, 2007",0.2635
2,A1PHNXJQYNX7BH,B00000DM9W,Amazon Customer,"[0, 0]","Surprisingly long battery life. After doing the research, this Sony was the one to buy, and it didn't disappoint.",5,Meets all expectations,1217462400,"07 31, 2008",0.3024
3,ARWRBORADGA3G,B00000DM9W,Amazon Customer,"[4, 4]",,5,Ryan's little quick review of the Sony ICF-S79V.,1198886400,"12 29, 2007",0.3024
4,A1T1YSCDW0PD25,B00000DM9W,A. Wiersch,"[2, 2]",I've had this radio for months now and really like it. I like the digital tuning and timer function. The battery life is great. I am thinking of buying another one.,5,Great shower radio,1123113600,"08 4, 2005",0.3516
5,AOVMTR7PA8XB9,B00000DM9W,Bearwife,"[0, 0]","I owned a Sharper Image shower radio (the kind with suction cups that sticks to the shower wall) for years until it died on me, and thought the poor sound quality is the price you pay for a waterproof radio. I'm so sorry I didn't buy the Sony sooner! The sound quality is tremendous. It isn't waterproof but I keep it on a shelf in the shower and it withstands regular spraying with water with no problem. I love the big preset selection (including local TV channels), the easy to use buttons and the timer that turns it off on its own. Great machine.",5,Best shower radio ever,1154217600,"07 30, 2006",0.1774
6,AKI2Y9IT0EMRR,B00000DM9W,Beau-Tech Beau-Tech,"[1, 1]","I agree that this is the best shower radio. I have been through (3) other radios, all bad. This unit is true 100% digitial, great reception, good sound quality, and easy to use.",5,A great shower radio,1164153600,"11 22, 2006",0.381
7,A2A039TZMZHH9Y,B00000DM9W,Bill Lewey blewey,"[0, 0]","it's one of the better shower radios for sure, but it still sounds like a shower radio.",4,not too bad,1266105600,"02 14, 2010",0.705
8,A2Y23OZSZPO2D1,B00000DM9W,Brian M. Mccue,"[0, 0]","PROS: Good audio, easy to program, good features.CONS:However, the FCC will require broadcasters to switch to a digital format in February 2009. At that time, the radio WILL NO LONGERr receive televison broadcast audio. Therefore, a good percentage of the radio's value is gone!Nationwide, the FCC has reserved 10 weather channel frequencies available. Usually all 10 can't be received. This radio only has 5 channels for weather. In my case, none of those 5 channels contains any weather signals.",3,"Very Good Audio, But....",1213920000,"06 20, 2008",0.1767
9,A1J07V3G9MK6KM,B00000DM9W,Christopher E. Horn,"[0, 0]","Got this for my girlfriend and she loves it. She's had it for a little over a year now, and it is working great. I recommend this product to anyone looking for a good quality shower radio. She keeps it outside the shower to help keep any water from ruining it.",5,Works great,1242086400,"05 12, 2009",0.5086
10,A2C4N3KROL6WA2,B00000DM9W,CoquiLostInNY,"[2, 2]","I recently purchased my second Sony ICF-S79V to replace the first one I purchased almost seven years ago! That's right... my first Sony ICF-S79V lasted almost seven years which is why I had no problem replacing it with the same model. The reason why I had to replace the radio is because the plastic lining that covers the buttons on the top of the radio started to crack and water was entering into the radio causing it to not work from time to time. The second reason is because after seven years it started to get discolored due to the humid / wet conditons. I would totally recommend this product because it looks great, last a long time, gets great reception, a huge amount of digital presets and much more!",5,Excellent Shower Radio,1195603200,"11 21, 2007",0.2877
11,A3JVD6IJPRCXT1,B00000DM9W,David Eizinger being,"[47, 47]","I looked at several brands of AM FM TV Weather radios for use during severe weather when power might be out. I was searching for specific features:1. Battery power (for power outages)2. TV band (tornado tracking is sophisticated enough to get down to street-level tracking on TV. NWS hasn't caught up yet)3. Decent sound qualityThis radio met all my needs with the added bonus of being water-resistant. (I must admit I am baffled by the term as EVERYTHING is water-resistant to one degree or another.)Reception is good in all areas of my home (including those areas where we cower when tornados are lurking). The radio includes a wire antenna for FM reception which stows in the battery compartment.Sony recommends leaving the three &quot;C&quot; cells in the radio and changing them every year. This maintains the time and radio presets.Pros: Good reception, solid design, handy controls, good sound.Cons: Bigger than some.To avoid finding the radio with dead batteries (or worse, corrosion in the battery compartment), I set reminders in my Palm to change various batteries annually.",4,I like this radio,1055721600,"06 16, 2003",0.0993
12,AC63G8TNC9UMO,B00000DM9W,E. Aagaard,"[2, 2]","I've bought Sony shower radios for 20 years - this is the third (and by far the best) model, and I've had at least one of all three models. The digital tuning is essential - you never have to worry about finding or keeping your station. I love the presets, and listening to 60 Minutes and similar TV shows is great. The solid base means it's less likely to fall over, or off of things. The radio is pretty tough - I've dropped it and had nothing happen, but once the AM antenna broke and that was that for talk radio. And the batteries really do seem to last forever! On the one I have now (five years old), the plastic waterproof top is cracking, and the FM antenna caught on something and pulled loose. So, I'm buying another. Don't EVER stop making this radio, Sony!",5,The BEST in an evolutionary series,1141862400,"03 9, 2006",0.1906
13,A334X69Y2AJHJ6,B00000DM9W,E. Barnes Never enough tools,"[6, 6]","I've had this radio for over 3 years now and the only problem is with the FM tuner (it died in less than one year). It still works with AM, weather, and TV. Since I use it for primarily AM, it's not a big deal. Speaking of AM, this has absolutely the best AM reception of any radio I've had.One last comment: the batteries last quite a while. I use it at least 20 - 30 mintues a day and have only replaced the batteries once in three years.If you're looking for a shower radio, this is it!",5,Great for the bathroom,1065657600,"10 9, 2003",-0.015
14,APNI0D19W2VQR,B00000DM9W,Ed Strickler Habitsofmine,"[0, 0]","No need in me going thru all of the features... you can see them in the product description.A few things that are important though before you purchase a radio for your bathroom.1. Make sure it has a digital tuner. You want to know you are on the right station and you don't want it to drift.2. Get one that has a large battery capacity.3. Ensure it has a power-off timer. You don't want to have to remember to shut it off when you leave the room.As far as reception - mine picks up great! (even without the antenna extension)This unit has all of these features, plus many more. I think you will be very pleased if you purchase this unit - I know I am!!",5,Great radio for the bathroom!,1198800000,"12 28, 2007",0.1962
15,A25SDTIJI2EFPG,B00000DM9W,Enigma,"[0, 0]","I have had this shower radio for several months. I purchased a similar model for my parents several years ago. I liked is so much, that I finally decided to purchase one for myself. Not only can this shower radio withstand exposure to water, but the quality of the sound and reception is excellent for its size. It is very intuitive to use.",5,"Basic, but does the job.",1201219200,"01 25, 2008",0.2288
16,A2183499CPCTIA,B00000DM9W,Ginger O.,"[3, 3]","I'm on my second one - had my first one for a year before my sister swiped it and took it back to Alabama with her. I guess she must have liked it a lot too. After about a week without it I had to buy another. I do not use it in the shower but I do keep it in the bathroom on top of the toilet tank. Wow is it great. One push on top and the radio is on. You don't even need to have your glasses on because the button is big. Push another button and you set a timer for it to go off after 15 or 30 minutes so you don't have to remember to go back in and turn it off. I'm listening to the morning news while I brush my teeth and dry my hair and put makeup on, and I can put it on a classical music station for a soak in the tub after work. It's not too big, the controls are simple and intuitive, and it looks nice. The battery lasted in the first one for the whole year before my sister took it - it's probably still running at her house on the same battery. I looked at a lot of radios before I found this one - I wanted waterproof, not too big, no cord - there just isn't anything close. Highly recommended if you'd like a radio in the bathroom.",5,can't live without it,1111708800,"03 25, 2005",0.2275
17,A3TGD1UTG4V072,B00000DM9W,Greg greg19444,"[0, 0]",Picked this one up based on the reviews of this site. Absolutely worth it. Great sound and ease of use.,5,Well worth it,1086652800,"06 8, 2004",0.3531
18,A2T001N0QCRMZ1,B00000DM9W,Gustavo Machado,"[0, 0]","I've always listened to news radio in the mornings and I like to take long showers. This is absolutely the way to go if you want to listen to radio in the shower. I've had it for over 2 years now and it has been through just 5 batteries. It comes with a bundled antennae which you can stick to the shower's wall and reception is amazing. Buttons are easy to operate and it can even tune into local TV stations so you get the audio. Sometimes I do have to crank up the volume to hear over the shower noise, but I never go more than half way up. This shower radio is excellent, get it now.",5,A must if you like news radio in the morning,1284336000,"09 13, 2010",0.2909
19,ABVYGB2TKBO8F,B00000DM9W,J. Donaldson Cal-diver,"[0, 0]","I purchased this radio from Amazon in May of 2003. It's now January 2005 and the radio is still on the first set of batteries. I use it at least a 1/2 hour a day and on weekends as much as 3-4 hours per day. Fantastic. It shows no sign of wear even though it has spent hundreds of hours in the shower, and has even been in light rain beside our spa.It gets great reception (no TV signals in our town), is easy to use, and sounds great.I highly recommend this radio.UPDATE Oct 28, 2010After 7 1/2 years of daily use my Sony shower radio finally quit. As many others have reported the plastic on the top cracked, water got into the Off button area and the radio would no longer work. However I just ordered another one.This radio has some very good qualities.Pros:1) Clear and loud sound2) Battery life is so long it is ridiculous. I don't think I used more than three sets of batteries in 7 years, and I use the radio every day.3) Good reception.4) Ease of use. I really appreciate an AM/FM radio with station presets.5) It is waterproof enough that I take it in the shower every day. I don't leave it there though because I use it on the bathroom counter while I shave too. Perhaps mine lasted longer than many others because it isn't in the damp shower area 24/7.6) I like the top buttons. They are easy to hit with one hand. If the buttons were on the side or front it might require two hands. My radio is never mounted high so I don't have the issue others complain about where they can't see the buttons. Even if I did have it high it is easy to feel where the buttons are as they all have a raised bump.Cons:1) $49 is a very high price to pay for an AM/FM radio.2) It does seem Sony could do some research and improve the plastic top so it would last longer.I was pleased to see this radio is still available for sale. I looked at a few others but nothing matched, in my opinion, this one.",5,Great radio - fills the promise,1105315200,"01 10, 2005",0.3051
20,A1GIMMNRJM94RX,B00000DM9W,Jeff,"[8, 8]","The Sony ICF-S79V is a another good example of the old phrase you get what you pay for. At $50 I was hesitant to purchase this radio but I'm delighted I did, it is worth every cent.1. Battery life is simply amazing, I listen to it for a minimum of 1-2 hours each and every day and I'm still on the first set of batteries after 5 months, I've even accidentally left it on for the entire day several times. Wow!2. Excellent reception for all bands; Am, Fm, Tv, and Weather.3. Simple, convenient buttons and operation. The o4. Peace of mind with water resistance, I've not placed it in the shower but do have it in the bathroom which often gets quite steamy.5. Excellent sound for the type of radio it is, clear and loud.6. Small footprint takes up little space.7. Like the wire antenna, didn't think I would at first. It is better than a hard antenna sticking up waiting to be bumped and/or broken.8. Timer and auto-off timer are quite nice also, even though I sometimes forget to use the auto-off timer.9. Digital tuning and display makes it simple to find the station you are looking for.10. The fit and finish is outstanding, the radio looks and feels very well constructed.Overall a worthy purchase.",5,Outstanding Radio!,1151884800,"07 3, 2006",0.3319
21,A2SKUS5ULRZ8ZA,B00000DM9W,joan_smiths,"[0, 0]",This is a nice little radio. It has good sound quality & it's easy to tune and to set up the clock and the station presets. The timer function is useful since it does run on batteries. My only issue is that I wish an AC adapter was included so that I didn't always have to run it on batteries.,5,"Good sound, easy to use",1202947200,"02 14, 2008",0.491
22,A2WBT0TCU7YHW8,B00000DM9W,Joel D. Rogers Marine Top,"[1, 1]","By far the best waterproof multi-band radio on the market. I am purchasing my second radio only because after nearly several years of abuse from twin teenagers, it finally is starting to wear out. I will not be without one in my bathroom.",5,Best on the market,1174089600,"03 17, 2007",0.0
23,AQPIILREUKLZM,B00000DM9W,John G. Pendleton Juan de Calavera,"[0, 0]","This is a classic little gizmo. We've used one since the late '90s and, even though the OFF button has long since worn through, it still works like a charm.I've purchased others as gifts for bewildered friends and once they've spent a little time with it they love it.Target and other stores have stopped selling them as off-the-shelf retail, but I hope SONY continues to make this little C-battery shower radio and doesn't screw it up with any improvements.",5,Best. Shower Radio. Ever.,1168819200,"01 15, 2007",0.4454
24,A257GFB4MEE56X,B00000DM9W,JRP,"[1, 1]","I have had one of these for about ten years and love it. It lives in my shower. The plastic on top has cracked over the years but it works fine. i use it to listen to the local tv station news in the morning. i just bought two more for my kids.***** Note- Since TV has gone digital, I can no longer catch the TV station in the morning.",5,No Longer Catches TV due to going digital.,1194912000,"11 13, 2007",0.1204
25,A2EPAYUAQ8P78W,B00000DM9W,Justin,"[2, 2]","This radio has been good - I have owned several Sony shower-type radios, and this unit's quality is among the best. Very good sound, built very solidly, controls are easy to use and understand. My only wish is that they had better mounting options - I have it hanging from a shower mirror now, there has got to be a better way to mount a radio, with a holster-type bracket or something...",4,"Very good sound, needs better shower mounting options...",1138579200,"01 30, 2006",0.7801
26,A1N3IS6ZQE7Y8L,B00000DM9W,J. Wood,"[0, 0]","Great reception, easy to use and good sound for a one speaker radio.",5,It is worth the extra money,1163030400,"11 9, 2006",0.872
27,A1EA08F54PPH4O,B00000DM9W,Kevin44,"[1, 1]",I have tried several waterproof radios and these Sony's are the only ones that work well. If the volume went a little louder I would have given it 5 stars.,4,Best Shower Radio,1167782400,"01 3, 2007",0.1366
28,A1WFDJHDWDVGW8,B00000DM9W,K. Gaither,"[0, 0]",The sound quality is pretty good and the radio reception is very good. Previous shower radios we had were far worse in both areas. I especially like the programable buttons since we each like different stations. Even though the screen fogs the LCD is still readbale. The only reason I gave it 4 stars is because I think the price is a bit high for a shower radio.,4,Sound quality is pretty good and radio reception is very good,1167955200,"01 5, 2007",0.2045
29,A2T8BSIIGDZYJS,B00000DM9W,ksrp,"[1, 1]","A wonderful product. Well-built. Very clear reception. Easy set-up. The flat, broad bottom is a great feature as it prevents tipping it over when it is placed on a surface such as a sink.Be aware that the TV channel reception feature will cease in 2009 when all transmission goes digital. Until then, enjoy it!",5,Great!,1197331200,"12 11, 2007",0.442
30,A11ED8O95W2103,B00000DM9W,lighten_up_already2 lighten_up_already2,"[0, 0]","Now I don't have to miss ten or fifteen minutes of my favorite morning talk shows while I get ready for work. I've got this little jewel sitting on the toilet tank where it can project sound into the entire bathroom!I love having the waterproof controls on the top and the station presets. This radio also has very good reception, bringing in one of the weaker stations I like loud and clear.My one complaint is that it has two very little rubber pads on the bottom. That means the designers thought of slide resistance (like when the radio sits on something made of porcelan) but they didn't do enough to prevent it. This radio needs big high-traction rubber pads on the bottom, and then it would be perfect.",5,Talk radio addicts delight!,1167696000,"01 2, 2007",0.4961
31,A1JFXOFDRZ9CFQ,B00000DM9W,Marge Teilhaber marge201,"[0, 0]","When home, I have the radio on a lot of the day, mainly talk radio. I bought 2 of this radio in August 2000 (yes, three zeros) and they bit the dust in late 2007. I got about 7 years of EXCELLENT performance from these radios. I have 2 because one sits on bathroom sink and goes back & forth from bedroom to bathroom while getting dressed. The other goes between kitchen and office constantly. There's 5 presets for AM. I wish there were more. There's 10 presets for FM. One used to be for Howard until he left (a huge Howard fan here who has not gone Sirius) and now I basically only use one for WCBS-FM (when they got smart and realized, in the immortal words of NY Daily News, that they didn't know jack), and the others go unused. The TV channel part of this radio, I never use and couldn't comment.The radio is excellent. The controls are responsive, the battery life is very decent, and most importantly, the reception is excellent.The reason my radios now need to be replaced (I just ordered one from Amazon and will try the Sangean for the second) is that the top of the radio is covered in plastic. After 7 years of pressing the on/off button I'm sure thousands of times, the plastic over the on/off button ate through. The on/off button needs that plastic over it to work!! The damn thing won't turn on/off now!! I tried turning the volume down to zero to turn it off but the batteries do wear out and it's annoying.So I figure that 7 years of constant usage is pretty good and I am not complaining and have even come back for more!In spite of the 7-year life, I still give this radio the highest rating. Fair is fair, right? Can't complain about 7 years of perfect performance, can we? I say no.",5,A FABULOUS RADIO,1202947200,"02 14, 2008",0.2985
32,ACB499ZP5KZPZ,B00000DM9W,Margie S.,"[0, 0]","This is without a double the 'best' shower radio I have ever owned. The reception is crisp and clear and I love the pre-programmable stations. It is also a very attractive radio and so when not in the shower with me, it looks nice sitting on my bathroom counter. It's very user friendly; no complicated directions. Perfect for us 50+ technically challenged. I would definitely recommend this product to everyone.",5,Great Shower Radio,1226707200,"11 15, 2008",0.589
33,A3JUAIWL571I2R,B00000DM9W,Matt H,"[0, 0]","The only reason this doesn't get a 5 is because it isn't very loud. I honestly didn't expect it to be, especially with a single speaker.Everything else works as advertised. I can get TV/AM/FM/Weather stations well. The old Curtis shower radio I had was very spotty. Digital tuning is awesome. The old one was analog and a real pain to lock on to stations that had a great signal. The presets work wonderfully, and the timer feature was an added bonus.Only time will tell if it lasts though. The Curtis died after a year and a half. If the Sony lasts that long I will be more than happy.",4,Great Shower Radio,1176595200,"04 15, 2007",0.2456
34,A2XAHEQG61OQN1,B00000DM9W,Michael Everett,"[0, 0]","Notice this unit was introduced two and a half years ago and still going strong which indicates to me people really like it and it holds up well. I've had mine about six months. It's got everything a radio should have and nothing it doesn't need, except maybe the digital clock. The knob on the right top is volume. The rest of the controls are push buttons on the top that include five presets for each of three bands. The buttons are under a protective rubber cover so no need to worry about humidity or splashes. It has an 18 antenna with a little suction cup at the end so you can hook it on a mirror. And it has a loop of twine on the back for carrying it around or for hanging it on a coat hook or something similar.I find its clunkiness sort of endearing. The sound quality is all you could ask for, and the reception is excellent. So for what it is, it's probably as good as it gets.",5,Endearingly clunky,1204502400,"03 3, 2008",0.1521
35,A2S081Y72FI34Z,B00000DM9W,Mike,"[0, 0]","I purchased this for my dad who uses it in a basement sauna. The radio sounds nice and is easy to use, but does need to be positioned a bit for good reception. He is very happy with the radio.",4,Nice Radio.,1200528000,"01 17, 2008",0.4611
36,A3NCIN6TNL0MGA,B00000DM9W,M. JEFFREY MCMAHON herculodge,"[4, 4]","After researching shower radios and looking at ones that cost almost twice as much, I decided on the Sony ICF-S79V and I am impressed with the following points:1. Great fit and finish.2. Not too big. Seems smaller out of the box than photos on Internet suggest. This is good for cluttered showers.3. Easy-to-use controls for clock, tuning and presets. I didn't even need to consult the manual.4. Excellent sensitivity for AM (internal ferrite antenna) and FM (a pull-out wire from the battery compartment).5. Full sound to overcome shower noise.6. Sony's decision to require 3 C batteries insures long-lasting life between battery changes.So far I have not found any weaknesses with the radio. Sony has found a niche in their shower radio. I give it the fullest recommendation, especially for the 45-dollar price (and free shipping no less) I found on Amazon.",5,Great Fit and Finish for Shower,1166918400,"12 24, 2006",0.2459
