,reviewerID,asin,reviewerName,helpful,reviewText,overall,summary,unixReviewTime,reviewTime,Sentiment
31,A1G9FX1KV45N41,5119367,Gary Selikow,"[1, 1]","This is a brilliant epic movie, a tour de force, the best Biblical movie I have seen with the exception ofOne Night with the KingStarring Paul Mercurio in the title role, he gives an intelligent and passionate performance of a man who was prepared to die, to keep to the word of his G-D.Ben Kingsley is his usual magnificent self in his role of Potiphar which he plays with panache. Warren Clark played a sterling role as Potiphar's thuggish overseer Domo Ednan, later to be Joseph's aid de camp. A deliciously evil Potiphar's Wife is captured in brilliant detail by Lesley Ann Warren and the actors playing the ten brothers also acquit themselves well staying true to the form of Israelite tribesmanThe movie begins with the purchase of Joseph by Potiphar, and his rise from that of a lowly slave to Potiphar's major domo where he captures the attention of Potiphar's evil wife, when he resists her attention and she accuses him of assaulting her, Potiphar soon knows he is innocent, and he embarks on the telling of his story of his boyhood, including the narrative of the rape of his half-sister Dinah (played with shyness and prettiness by Mexican actress Paloma Baeza), and the destruction of the Canaanite town of Schechem in revenge by her brothers Simeon (Vincenzo Nicoli) and Levi (Colin Bruce) Then we move to the central story whose tale baring and father's favour lead to his brother's brutal attack of him, where he is thrown into a pit and sold to Ishmaelite traders.His rise in prison, his interpretation of the dreams of Pharaoh (Stefano Dionisi) at the same time as we are taken back to Canaan and see the story of Tamar( a pert and beautiful Kelly Miller ) and Judah (Michael Attwell). The final sequence where Joseph's brothers go down to Egypt until the moving scene where he reveals himself to his brothers is the finest.The sex scenes are tasteful and not at all gratuitous in any way , and yes this is an adult movie, but they simply cover what is told in the Bible without going further and it is extremely narrow minded to find them offensive",5,Tour de force,1347148800,"09 9, 2012",-0.0327
32,A37Y6AZJ56WBXS,5119367,GC Book Reviewer,"[5, 5]","Great great great! As with many of the other titles in the Bible Collection, I've watched this film several times and the emotions I am left with after watching it never diminish. Another production that remains true to the historic account, this movie was casted brilliantly and told superbly. Before I ever read the story of Joseph in the Old Testament, I had watched this film. This movie did an excellent job of re-telling the story. Highly recommended.",5,Joseph,1134259200,"12 11, 2005",0.4248
33,A2ELQPRYSVKBO7,5119367,Grant N. Townsend,"[2, 2]",I used this movie in my prison ministry bible study. It was very well done and followed the bible very closely. Joseph as revealed in the book of Genesis of the scripture is a type of Jesus and the movie brought this out which shows an obvious insight and knowledge do God's word. I would highly recommend this DVD for all family viewing.,5,Great movie,1360022400,"02 5, 2013",0.062
34,AVPUI22ZXBA1X,5119367,Harry L.J. Boyd,"[1, 1]",this movie brought tears of jOY AND HAPPINESS to my eyes I can watch this movie over and over awesome movies,5,awesome movie,1381017600,"10 6, 2013",0.9068
35,A319APCDCJWAP6,5119367,;),"[1, 1]",Great movie. Excellent acting and definitely not boring. Thank God like most Bible based movies these days this movie is exceeding with talent,5,Great story!,1376265600,"08 12, 2013",0.7572
36,A1KBQ7MG9AG58C,5119367,Herugrim,"[3, 5]","Joseph is the ideal role model for EVERY Christian/Jew. He is an example of what we should strive for. Waiting for a spouse to have sex. Sticking to your God no matter the outcome. This movie reflects all of that perfectly. The actors did a great job. When I first saw this years ago I was blown away by the quality!! That was back in the VHS days...cant wait to see it on DVD. So I cant speak for the transfer quality yet, sorry.",5,What Christians are suppose to be,1113350400,"04 13, 2005",0.2186
37,A34R41Y4XWH6ET,5119367,H F Chamberlin,"[1, 1]","I cannot help but notice that ALL of those who serve God have to suffer for him. Though the churches today teach you don't have to suffer, the Bible says different. I wish I were as strong as Joseph. He sure isn't a &#34;why me&#34; type.",5,This is a great film,1392595200,"02 17, 2014",0.2229
38,A3TNMQGHICGJ78,5119367,james a salter,"[0, 0]",joseph is one of my favorite movies. I can watch it over and over andnot get tired of watching it.,5,great movie,1373500800,"07 11, 2013",0.0092
39,A1I8PLHXCCP1AG,5119367,Jeanette Barrowman Penny,"[0, 0]",This is a fantastic movie or the retelling of the Story of Joseph. The scenery in the movie is fantastic too. The actors are great in each of their roles. I'm glad I ordered this movie. Saw it many years ago.,5,Joseph,1366675200,"04 23, 2013",0.4397
40,A3EAI032S3EBBK,5119367,Jerry Parks USAToday All-American Teacher; N...,"[176, 178]","This account of the Joseph story is as good as it gets! I teach ancient history and civilizations, and have an earned doctorate in theology. I say this only to lend perspective to this review.This film is Biblically accurate, well-acted, and the producer and director are to be praised for the sound Biblical reasearch!Although some of the sexually explicit (though historically accurate) scenes should be screened from the very young, this film is an ideal platform from which teens can search out characteristics of moral uprightness in a character of whom the Bible has not one negative thing to say!Kingsley (as he did in 'Moses') steals the show, and Mercurio does an admirable job as Joseph. Only Leslie Ann Warren (Potipher's wife) seems to strain as an actor, nevertheless, her performance detracts little from the drama. Especially capable are the actors portraying Joseph's wicked brothers, with Vincenzo Nicoli sterling is his performance as the wicked Simeon.Having watched the film dozens of times with adults--as well as with my middle-schoolers in the classroom, I can say that the greatest of Bible stories is captured in all its power, pathos, and glory. Although creating a few anachronistic vignettes (such as Joseph's 'foreshadowing' Christ's &quot;My God, my God...&quot; speech from the Egyptian prison), the film also captures all of the great ironies of the Joseph story.When Mercurio tenderly reveals himself as the second most powerful man in the ancient world--to the brothers who hated him as a youth, the words 'I am Joseph' will not fail to bring even the most calloused heart to tears.As my students synthesized the thirty or so characteristics of moral goodness extant in Joseph into an essay, one asked why no such heroes existed today. The question revealed both the effectiveness of this presentation, and the dearth of role models in our society.'Joseph' is both gripping in narration, and brilliant its direction. It is faithful to Scripture and well-acted. It is THE finest of the TNT productions to date, of which only one ('Jacob') was a failure.Everyone will appreciate this wonderful story of forgiveness, but those those who are looking for the 'hidden things of Christ' cannot miss the poignant messianic threads which are so skillfully woven through the life of Joseph. HIGHLY RECOMMENDED!",5,&quot;The Joseph story as it was meant to be told!&quot;,974937600,"11 23, 2000",0.3964
41,A2PBVEWGWZNMIL,5119367,Jessica Strong,"[2, 2]",This film is one of the better films made about stories of the Bible. Very little poetic license was taken with it - they stuck to the scripture very closely and Sir Ben Kingsley is brilliant at Potipher.,5,Beautifully done!,1401753600,"06 3, 2014",0.4309
42,A388I3YOZ2ZPKR,5119367,Jim F Fitzgarrald Fitz,"[1, 1]",This is an incredible telling of the story of Joseph and the roller coaster ride on which he rode. One of many Biblical Old Testament stories made by Turner Films and this is of very high quality. Not the wooden-like acting which is not uncommon in Biblical story telling in some past films. This is first-class and definitely worth 5 stars.,5,"Joseph, the Dreamer",1266624000,"02 20, 2010",0.1394
43,A385J7MEM932DL,5119367,Jim,"[0, 0]",This one was really interesting! Loved it completely. Acting was exceptional. It flowed so well. I liked the temple of it. Everything fell into place. No fillers to eat up time. This Movie is a Winner!,5,Bible Story,1397520000,"04 15, 2014",0.2834
44,A1BQ0HTG3C53IH,5119367,J. Mol,"[0, 1]",A nice alternative to the classic. Can be used to get the point across but it is different that the Bible in some points,4,A new view,1404691200,"07 7, 2014",0.2107
45,AQBRMBQ99ESI7,5119367,John A Lee III jal3,"[1, 1]","This is another excellent addition to TNT's Bible collection. It tells the story of Joseph, the son who rose from a slave to the Viceroy of Egypt.Joseph is the favored son of his father, a fact which causes no small amount of jealousy from his other brothers. It eventually causes so much resentment that they sell him as a slave to a passing caravan and tell his father that he was killed. In slavery, he is taken to Egypt. His intelligence and honest are both a curse to him and a blessing. Through God's favor, and Joseph's steadfastness, he rises to a position of immense power. When his brothers come to him, seeking help, they do not recognize him and the stage is set for either reconciliation or terrible retribution.The story is well done and is in keeping with the scriptures. At first, it can be a bit confusing because it relies on flashbacks that are not always immediately apparent but this is soon gotten over. The result is a good story done well.",5,"Confusing at First, But Worth It",1176249600,"04 11, 2007",0.0746
46,A2C67F0TPHMI7D,5119367,John D. White camsterdad,"[1, 1]",This is an excellent movie which I have used in Sunday School. The youth were able to envision the Bible's narrative in Genesis much more clearly because of the fine acting and appreciative telling of the Joseph story.,5,Joseph,1386806400,"12 12, 2013",0.6921
47,A1W98Q4MZK80VA,5119367,Joseph P. Tevington,"[0, 1]","Though it's been a while, I recall this as being a rather excellent film. Peter Chattaway tells us that disparate elements are woven into Joseph's story without sacrificing the film's dramatic unity; the result is unexpectedly coherent, even poignant....[It]is about as rich a three-hour epic as one could want from television: complex, challenging and convincing, it has enough emotional power to draw you into its world and enough realism to make you want to stay there (Review: The Bible Collection, Patheos(dot)com, 1996)",4,Joseph,1387065600,"12 15, 2013",0.708
48,A14L0BNLVH6PIC,5119367,Juanell Lyons,"[1, 2]","This is my favorite movie of all times. It is so realistic that I cry every time I watch. The characters are extremely good in their acting, and I especially enjoyed the Joseph character, Paul Mercurio. I would definatly recommend this movie!!",5,Joseph VHS,1362096000,"03 1, 2013",0.2359
49,A2726ZHKMUE6K1,5119367,Kathryn Diamond,"[1, 1]","I absolutely love learning the Bible and what God has done, is doing and will do in my life. Movies like this one help me understand the different books of the Bible and when I read each book in the Old Testament or the New Testament and see the movies that pertain to those books, I have a clearer understanding of what I am reading. I am very careful to buy the movies that give the true meaning of what the Bible says and not some superficial storyline that goes is not accurate with the Bible. This movie is great and a must have if you enjoy biblical movies, true to the Bible.",5,Joseph,1395014400,"03 17, 2014",0.7126
50,A18YB1FYPWXEHQ,5119367,Kimberly A. King,"[0, 0]","This movie is extremely well made. It is so touching when Joseph's brothers throw him into a pit. His crying and pleading with them to be merciful is so moving as is the part when Joseph finally meets his brothers again and tells them who he really is.Exceptionally well made, I recommend this movie as high as possible. A true hero in a world of doubt and sorrows it helps to know that human issues of understanding, forgiveness and love are always with us and always have been.",5,Outstanding In Every Way,1304380800,"05 3, 2011",0.354
51,AO0W4S3SNAU0J,5119367,LaurieG,"[1, 1]","This is the best movie of all time. I have probably watched it 20+ times! The acting is superb and the story is pretty close to the Bible story of Joseph. There are some fillers added but, if there weren't, the movie would be too short. It's beautiful and will keep your attention from beginning to end. Parents please be aware that, even though this is a family story, there are a couple of surprisingly sensual scenes where Potaphar's wife is seducing (molesting, really) Joseph. These scenes may not be appropriate for children. When the scene comes up where Joseph is bathing, you may want to send the kids to the kitchen to grab the popcorn!",5,This is the best,1347408000,"09 12, 2012",0.2647
52,A3363BZCLRNQSQ,5119367,Leanne M. Wilkinson,"[3, 3]","If it weren't for the seduction scene with Potiphar's wife, this movie would have been excellent. That scene was so sensual that it was borderline R rated in our book. I almost shut it off at that scene. Before the actual Biblical account of Jospeh running off, leaving his garment behind him, there is a scene in which Potiphar's wife joins him in a bathing room and (while he is in a pool) clearly and very erotically reaches her hands under the water and strokes his private parts. He doesn't flee that time! This scene ruined the movie for us, and though we've enjoyed other movies from this series, we couldn't keep this movie because of that one scene. Too bad!",3,A little too sensual for us to keep this one.,1348185600,"09 21, 2012",0.0756
53,AN5BGXH80BF65,5119367,Leese,"[0, 1]","Acting was very good, the story line was well done and included all the important parts of the tale without adding too much conjecture in.",5,Well done,1388188800,"12 28, 2013",0.7264
54,A1KBS25348HT3T,5119367,Linda D,"[1, 1]",This version I liked. Went behind the scenes. Not totally accurate but great version of this story.,5,:),1404518400,"07 5, 2014",0.4049
55,AKMMCNA8BDB5C,5119367,Linda G. Hoeck Linda of Bel Air,"[3, 3]","As most movies, this story takes a little liberty with Bible history; the way the story is laid out, it brings reality to the likely interaction between Joseph, his family and those he met in Egypt. A warning to parents - the DVD has scenes you may not have seen in the tv version (a couple of them gratuitous-a scene showing nudity in the pool of his wife and children and the hanging of the baker); the scene with Joseph and Potiphar's wife does a great job of showing just how difficult it must have been for Joseph to stand firm in his principles (would be a little mature for young audiences).",5,AWESOME Portrayal of Joseph,1360886400,"02 15, 2013",0.4406
56,AQ851YXOGMLTX,5119367,Linda J. Major movie monster,"[0, 0]",i buy films mainly for my family memebers as gifts. this is a great depiction of this story from the bible. very well done for the period it was taken from.,5,bible collection review.,1260662400,"12 13, 2009",0.3211
57,A1M0G9T633G1C3,5119367,Lorrie L Owen,"[3, 3]","I liked this movie, except one scene where Potipher's wife is seducing Joseph, and he has a hard time resisting at first, whereas, Biblically, I think he was stronger than that. I REALLY like the actor playing Potipher. Because of the scene mentioned, I am hesitant to allow my younger children to view it. But, other than that, it was done excellently.",4,Pretty Good Movie,1361318400,"02 20, 2013",0.5016
58,A2214VIWOIUMVD,5119367,Marilyn R. Hampton Marilyn Hampton,"[0, 0]",Joseph is my favorite movie out of the Bible Collection. I am going to get one movie at a time as I can afford it until I have the whole collection.,5,Joseph,1140566400,"02 22, 2006",0.2294
59,A28YRBK2MMMHOP,5119367,Mark Streeter Texasrefugee,"[0, 0]",A believable re-telling of the story while respecting it. Exceptional performances by stellar cast. And all of it at a great price!,4,One of the standout movies in an exceptional series,1371686400,"06 20, 2013",0.3842
60,AUFK6UT2DU87H,5119367,Meredith L. Burton Bookworm,"[2, 2]","There are no words accurate enough to praise this enthralling television miniseries. Joseph is one of the most fascinating of biblical accounts, and I will not rehash the plot since it is done superbly by other reviewers here. I will simply say that this timeless true account of a faithful and courageous young man is a wonderful tool to use with teenagers. Satan has planted so much filth in the movie industry, and I praise God that there are filmmakers who still desire to present the truth. Joseph presents a magnificent story of forgiveness and integrity that all teenagers can learn from.This miniseries is one of the best biblical retellings in film fashion I've ever come across. The story grabs you from the very beginning and is never dull. Paul Mercurio is excellent in his portrayal of Joseph, presenting a teenager and young man with exceptional character. Mercurio brings a vulnerability to this man that endeared him to me at once. The scene where he cries for mercy after his brothers' betrayal moved me to tears. Joseph struggles with temptations and is flawed like us all. Ben Kingsley is excellent as Potipher, portraying a man of integrity and care. The actors portraying Joseph's brothers are equally excellent.Several reviewers have complained about the scene with Joseph and Potipher's wife, a femme fatale portrayed with unabashed glee by Leslie Ann Warren. This scene is sexually charged, but I believe it is accurate with Scripture. The Bible doesn't sugarcoat things, nor should we think the Bible hereos were not susceptible to temptation. Although God never reveals if Potipher's wife was a temptation to Joseph, I logically don't see how she could not have ben. He was, after all, seventeen when the attempted seduction took place. Wouldn't any of us struggle in this area at this age? Besides, seeing Joseph struggle makes the viewer empathize with his predicament. Anyway, I say this only to encourage you not to let this one scene put you off. Please give this wonderful film a chance. Happy viewing, and God bless you.",5,Magnificent! The way biblical accounts should be rendered,1275609600,"06 4, 2010",0.2842
61,A2UWXLLEE0UOI8,5119367,Metal Gimp MetalGimp,"[2, 2]",This is the best and most accurate rendition of Joseph's life. This is great for the family.,5,Fantastic video for whole family,1203379200,"02 19, 2008",0.6309
62,A1LQZ9X9AR2UTR,5119367,M. Frey,"[0, 0]","I recommend this movie, Joseph. It is a great reprentation of of a truly kind, just, and merciful God and the people He loves. We all need positive and true to life movies that are not only good for the heart, but for the soul.",5,Excellent,1331078400,"03 7, 2012",0.5556
63,A27GTBNUF8DUEF,5119367,Michael P.,"[0, 0]","I thought the movie was sufficiently close to the Bible story. The sets were often lacking, but I enjoyed the movie anyway. I had a copy that I bought with the Bible Collection 7 or 8 years ago that I loaned out and never got back. I was happy to get this at around $7.I recommend the Bible Collection highly.",5,Josep (The Bible Collection),1369180800,"05 22, 2013",0.3501
64,A3LPKE97OT6Q8C,5119367,Mikka Semenoff mikka31,"[4, 4]","I have always enjoyed the story of Joseph and it is so good to actually see a excellent movie version that is accurate according to scriptures. The acting was excellent also and each individual played their part very well, even Potiphar's wife.As for Potiphar himself? the bible never said anything against him and the actor lived up to that. It is a brilliant story with so much purpose and meaning and i'm sorry to say it but, have those tissues ready when Joesph reveals himself to his brothers and when Jacob finally comes to egypt to meet him after twenty years. PS: Better have that box of tissues nearby",5,Excellent Viewing,1017446400,"03 30, 2002",0.5645
65,A1XZF9Y0O61CMH,5119367,Mwaa sister321,"[0, 1]","The series are amazing! Thank God such biblical figures are protrayed with the Lord God as foundation.I was expecting those usual blurry versions, but this is entirely different. Its a way to invite friends and know the characters in the bible and how they can relate that man in his nature is sinful and only through the Lord's grace can we only be part of the family. The story shows the fallen nature of man---jealousy, anger etc and it also shows that God knows the heart of men and gives according to His own glory.Watch it!",5,Biblical and Graphic,1140652800,"02 23, 2006",0.1993
66,A3TIEP0VIAW6UM,5119367,Nancy K. McLain,"[1, 1]","I'm always on the look out for quality films but especially for the holidays. I had seen this movie many years ago on television. I believe they made it into a mini series. The acting was wonderful. The story line uplifting. Great example of faith, hard work and being true to your beliefs no matter the circumstances and hardships.",5,old time movie fan,1390176000,"01 20, 2014",0.3344
67,A1T9WRQ9C9OSNT,5119367,Naomi,"[1, 1]","This is my go to movie for when I need to be humble. This telling of Joseph is very, very close to the Bible, and that is what I was looking for. Sometimes when you purchase this movies it is strictly Hollywood version. This time they got it right.",5,Joseph,1388966400,"01 6, 2014",0.0
68,A1JG66DXVHVDE1,5119367,Neil nwcs,"[3, 7]","Of all the TNT movies, this one is actually the weakest. But it is still a good movie. The movie covers the period before Esau sold his birthright and blessing to Jacob through his time with Laban and finally his confrontation with Laban and later Esau.The disappointment with this movie was its over-focus on him and Rachel. The lessons God was teaching him were kind of talked about, but not focused on. The non-Scriptural parts, though, were pretty consistent with early Near Eastern customs and not contrary to Scriptural understanding. In that way, it was very good.If you choose to watch this movie, you won't find yourself wishing you hadn't. It is a good movie and well produced. Just be sure you don't base much theology on it. ;-)The movie is a solid PG movie.",4,"A good movie, fun for a Saturday afternoon",978566400,"01 4, 2001",0.0943
69,A3MX33CYX9OWYA,5119367,Oliver L. Johnson,"[0, 0]",This is a wonderful story of the beginning rise of the nation of Israel. I would almost rate this movie as good as the Ten Commandments. I found myself in tears at the end of this movie so new watchers beware!,5,Awsome Story,1316908800,"09 25, 2011",0.2394
70,A2LCPZSVBJIURD,5119367,Patricia Gimbel,"[1, 1]","This is one of my most favorite stories in the Bible, recommend this one to anyone who loves a good Bible story.",5,Excellent,1400284800,"05 17, 2014",0.908
71,A3K8K7BXQG3J39,5119367,Pauline H. Williams,"[0, 0]",My son has been collecting the different books of the bible for a while now. He is so excited that I am able to order these from Amazon. He has a few more DVD'S that we need to order to complete his collection. I'm am very pleased with the DVD and quick shipment.,5,Bible Collection,1292284800,"12 14, 2010",0.2702
72,A1F12ZFB3LP2JB,5119367,raisins24,"[7, 9]","I thought that this film was really good, i just wish they had made it sutible for children by cutting out a few things and putting some clothes on the egyptian women. I really liked the end, it was so good, best part in the entire movie and worth buying just for that. This movie made the story so real especialy when Joseph's brothers throught him in the pit, it makes you realize just how hard it was for him, that his own family would betray him. And to the person that said that Joseph's brothers didn't like him because he was a proud arrogant tattle tale that is so un-true. His brother's hated him because he obeyed their father and because Jacob loved Joseph more than them. Joseph was ALWAYS faithful and obeyed God. He was sold into Egypt not because he needed to be straightened out, but because God had a plan to save all the land from famine including Joseph's family.",4,Joseph,957139200,"05 1, 2000",0.275
73,A37DRT5HJQDTSF,5119367,Rika (german),"[1, 1]","I really loved this movie ,it describes the biblical account pretty accurate. it starts w/ Joseph being sold to Egypt and backtracks after Joseph is accused from Potiphars wife, when Joseph defends himself in front of Potiphar through telling him his life story.I was clued to the screen the whole time. Also the actor for Joseph is very likable and also Jacob(Martin Landau) did a great performance.",5,great movie about Joseph,1268438400,"03 13, 2010",0.3804
74,AZ3SNS9WZ16LL,5119367,ROSIE,"[1, 1]","I had these three DVD, this one Joseph and David and Abraham for a long time. I believe it was in the late 1990,s and I got them on VHS and then I donated them to a nursing home because I knew they would really enjoy them. And then I brought them on DVD. So I have enjoyed this movies for a long time. I also got Abraham on VHS and I gave it away and brought it on DVD. All were excellent.",5,Joseph (the Bible Collection),1358035200,"01 13, 2013",0.2775
