,reviewerID,asin,reviewerName,helpful,reviewText,overall,summary,unixReviewTime,reviewTime,Sentiment
75,A27JGSWCNHI63W,5119367,R. Sanchez booker,"[0, 0]","This entire series of Bible stories by this Italian production group is simply splendid. These are relatively low cost films but they are very skillfully produced to maximize the quality of the story being told. Of course we Christians and Jews will sit around and pontificate about every little error or short cut the movie script incurs, never the less, it is ultimately left to the actors and directors and their considerable skill to pull off what I consider to be, for the most part, some of the most successfully done Bible story dramatizations that have ever been produced on film, with or without a big budget. My favorite is the story of Abram, the movie Joseph coming in a close second, and this movie, Moses, coming in a close third or even equalling Joseph. Bravo bravo - Please make more! My five stars applies to this complete series of movies - Obviously some are done a little better than others, but the effort is exemplary.",5,Great Bible Story Dramatizations,1171756800,"02 18, 2007",0.2473
76,A2P9RFHSSHMMCY,5119367,Russell Strimple,"[1, 2]",Just what I ordered. No surprises. I am a pastor and we just finished studying the book of Genesis and w finished that book by watching this movie.,5,Good Movie!,1364428800,"03 28, 2013",-0.0565
77,A2RI2ACXXYPQJB,5119367,sharp eye klf klf,"[13, 23]","The acting was good, the story was correct, but naked backsides was not necessary. Also the Potiphers wife did not need to be so very seductive of a naked Joseph. Not a Christian movie. I felt that even though it was probably portrayed truthfully, Christans do not need to see so explicit a scene. This should be rated PG 13 at least.",1,Nakedness not necessary!,1298851200,"02 28, 2011",0.1357
78,A175TVQLNLP30,5119367,smlwoman smlwoman,"[1, 1]","Very well done. Great acting for most of it. towards the end the main character loses me a little bit, but for the most part I like it a lot.",5,love this interpretation of Joseph,1387756800,"12 23, 2013",0.4738
79,A2CVD8DLA9BXVZ,5119367,*STAR*,"[10, 10]",I bought this film after seeing most of it on A&amp;E. This film is by far the best way to see Joseph. The settings are beautiful and the entire look of the production are perfect in presenting the story. The casting choices could not have been better! Paul Mercurio is a perfect Joseph. Everyone of the cast was perfect for their parts. This film is the best Joseph movie to date.,5,The Best way to see Joseph,1068940800,"11 16, 2003",0.4731
80,A1W584W9UW3XEU,5119367,strega2 strega2,"[13, 13]","TNT has put together a surprisingly good account of the Biblical story of Joseph, betrayed into slavery in Egypt by his jealous brothers. Martin Landau as Jacob and Ben Kingsley as Potiphar give their usual first-rate performances, with the role of Joseph also well-acted. Leslie-Anne Warren is the lustful wife of Potiphar, who unsuccessfully tries to seduce Joseph, and lands him in the Pharoah's prison. This film offers a very credible depiction of life in the ancient Near East, from the desert tents of the Hebrews, to the claustrophobic walled towns like Sichem, to the lushness of civilized Egypt and the Pharoah's court. The film is faithful to the Biblical account, and succeeds in making it come alive on the screen. A well-acted, well-scripted, and entertaining film. END",5,A very entertaining Bible epic,906768000,"09 26, 1998",0.0119
81,A1IK57GUIBOV8M,5119367,Susan Coon,"[0, 0]",Very good movie. Another great Bible character truly comes to life and is a good message for the family.,5,Great movie!,1295136000,"01 16, 2011",0.6824
82,A3EX36SNRYD5VL,5119367,TammyJo Eckhart TammyJo Eckhart,"[7, 8]","This four hour video looks a the familiar &quot;Joseph&quot; story from the Bible but with a few wonderful twists. First, it just jumps into the Egyptian setting. Second most of the actors do a great job on their roles -- I want to say &quot;brava&quot; to Leslie Ann Warren for making Potiphar's wife engaging and even more scary than the original tale suggests. Finally, the customs and backgrounds are the best yet that I've seen in a film version of the tale. However, my &quot;four star&quot; rating refers to the &quot;flashback&quot; section of the film. Yes, why it happens makes sense internally but did they need to spend so much time on it? It very sad that Paul Mercurio's careers seems to have turned off onto the &quot;B&quot; grade track -- I think he is excellent in this movie and also in Exit to Eden.",4,"Great beginning, great ending",1031702400,"09 11, 2002",0.3335
83,A3VC1CIRFDXJAY,5119367,Teresa SWEETHEART,"[1, 1]","This movie is almost like the story of Joseph, thats written in the Bible. Joseph was a remarkable man! If only the leaders of the world today was like Joseph was, a wise man, who listened to God, and kept the Ten Commandments!Please read God's story of Joseph, thats in the book of Geneis, in the Holy Bible first, so that you can know Gods true account of Joseph firsthand! This is a awesome, and remarkable true story, of so long ago!My favorite part of the movie, is when Joseph meets the Pharoah of Egypt face to face! WOW! This movie was very well done, this movie is one of my favorite versions of Joseph! God blessed Joseph greatly, and had big plans for him all along, for living his life as a godly man! I loved the way Joseph, and his Egyption master(Ben Kingsley), became friends, and earned each others trust and respect, eventhough Joseph was still a slave.It always amazed me, how Joseph was able to forgive his brothers, especially after what they did to him! Joseph was a very wise, and brillant man! I highly recommend this movie, it is based on a very true, and awesome story, thats in the HOLY BIBLE! This movie is very good, and I loved it very much! You will end up watching it more than once!",5,"FROM THE PIT TO THE PALACE! THIS IS A VERY GOOD, OUTSTANDING MOVIE!",1233273600,"01 30, 2009",0.6662
84,A6QOECTD2CPH6,5119367,The Golden Child,"[3, 6]","Overall, I enjoyed this movie, espescially its ending. The casting was great (Okay fine, Josephs former master was a white woman, so what? She played her part well I thought). Sexually explicit scenes? Give me a break. There were no sexually explicit scenes. There was a scene of Joseph in the bath being tempted by Potiphar's wife. This is no different from a man/woman dealing with sexual thoughts/temptations daily, and that powerful scene would give any Christian in the spirit a visual illustration of the pressure Joseph felt. I especially liked his line when he said to her please, you push the limits of my body to more than it can bear. The other added scenes did not take anything away from the movie, but gave it dimension. I will take 1 star away only because I do not think that scene where the brother slept with the prostitute who turned out to be his other brothers wife or whatever was necessary. Besides one or two minor things, overall I thought it was a great film, and the reunion at the end was well acted.To the critics harping on sexually explicit, blah blah, gimme a break. There were no sexually explicit scenes in the film. Everything was very PG-13 if not lower. If you call that sexually explicit then you should be censoring Songs of Solomon in the Bible which gives some steamy accounts from Solomon to his lover, or better yet, you should censor Jesus Christs crucifixion, which was very R-rated (being beaten, flogged, and nailed to a cross seems R-rated to me). Christianity focuses on the heart before appearances so lets all appreciate this great adaptation of Joseph's life. Great film!",4,Great depiction!,1248652800,"07 27, 2009",0.2527
85,A37A44LEGU3T45,5119367,Todd Hudnall,"[5, 5]","Joseph masterfully brings the pages of Genesis alive with the same grit, power, and passion of the Biblical narrative. The acting is of the highest quality, being highlighted by Ben Kingsley's brilliant portrayal of Potiphar. Despite some Hollywood license, Joseph remains true to the Biblical narrative, even including the sorted accounts involving Tamar and Dinah (which should mark the movie with a PG rating). It is an epic motion picture, lasting over 3 hours, but there is nothing I would have been left on the editing room floor. Joseph does have its weaknesses, yet the movie receives my very highest recommendation. In fact, it is so good, I consider it one of my all-time cinematic favorites. It left me inspired, encouraged, and in awe of God's faithfulness. You will not be disappointed!",5,You will not be disappointed!,1023062400,"06 3, 2002",0.4176
86,A3AW8XP45YVIIZ,5119367,Utah Blaine,"[5, 5]","This film is a recounting of the Genesis tale of Joseph. Joseph is the most loved son of his father, and has a gift for prophecy. His older brothers hate him because of it and sell him into slavery. Joseph winds up in Egypt where he eventually becomes the second most powerful man in the kingdom after the Pharoah. During a famine, Joseph's brothers come to Egypt begging for grain, not knowing that the man who will decide their fate is their brother (whom they believe to be dead). This is one of a series of made for TV movies about important figures in the Old Testament. I've previously reviewed several other stories in this series, but this is the best of a strong series in my view. The acting is top notch, and I found the final confrontation between Joseph and his brothers to be particularly moving and well done. Like many of the films in this series, it is a story about faith and perserverance. The writer and producer did a particularly good job of fleshing out the story of Joseph from Genesis without adding lots of non-Biblical threads. One thing that I like about this movie (and about the series as a whole) is that they are not overdone. These aren't special effects-laden films with casts of thousands, but rely on writing and good acting to convey the tale. The sets and the costumes are realistic and give the film a Biblical feel without being ostentatious. The bottom line is that this is, in my opinion, the way that the Bible should be brought to film.",5,Superb dramatization of the Old Testament story of Joseph,1172620800,"02 28, 2007",0.2206
87,A2YN8XPTHXC41Q,5119367,vejigirl,"[1, 1]",This was a great DVD. It tells the story of Joseph and his family. Good for the whole family and great for reinforcing your knowledge of the Bible.,5,Great DVD,1376524800,"08 15, 2013",0.4718
88,A1LSHLA6SY0N1S,5119367,Vital,"[0, 0]","How wonderful that a story about precognitive dreams has become such a famous and beautiful story. We are all wise to pay attention to our dreams, but not all of us have a talented and high-minded interpreter like Joseph. Even Freud in The Interpretation of Dreams admits that precognitive dreams are not unusual.",5,Unlimited by Time,1319932800,"10 30, 2011",0.8448
89,ASJMQXL151RHN,5119367,W. Barnes,"[1, 1]","Joseph clearly tells how God can use anyone. Despite his background of brothers who hated him and sold him into slavery, he held on through prison years in Egypt and became the second highest, most powerful leader in Egypt. When his brothers finally came to the realization that this leader under Pharoah was indeed their very own brother, it was then that Joseph forgave them for what transpired in his youth. It's a lesson we can all take to heart.",5,Joseph....A Godly Man,1384300800,"11 13, 2013",0.0112
90,A1LEMO6BI9LTPF,5119367,WIFE,"[2, 2]","I must admit this bibical movie has it all.Passion,Suspense and Temptation.I think this is more for a mature audience.Due to some scenes in this film I wouldnt advise children to view it.But the cast and movie is wonderful.It's truly a movie worth watching!",5,For the grown believers/non believers!,1400284800,"05 17, 2014",0.8383
91,A3RYTYQPF0OZ48,5119367,Willie G.,"[1, 1]","You will enjoy the story of Joseph , it's very entertaining , it will keep you watching, what's going to happen to Joseph next . The good think about the story of Joseph is where he ends up at the end . Good story excellent film.",5,Love the story of Joseph,1390262400,"01 21, 2014",0.6518
