,reviewerID,asin,reviewerName,helpful,reviewText,overall,summary,unixReviewTime,reviewTime,Sentiment
0,AJSYTZQVJJOYW,5119367,A. Abela,"[1, 1]","A truly wonderfully made film, mostly accurate to scripture and brilliantly acted. Joseph's brothers are the stars here in their own right but Paul Mecurio is in fine form as well.",4,Wonderful!!!,1152144000,"07 6, 2006",0.7442
1,A1QNGKV688Q8TE,5119367,Aaron D. Koehler,"[1, 1]",Joseph is amazing story to read and watch. A person with the lord's help goes through trail. goes from a lowely shepard boy to the second highest person in Egypt.,5,Joseph,1272672000,"05 1, 2010",0.3293
2,A36311XF4O81IK,5119367,A. J. Trivette,"[4, 4]","This WONDERFUL film is a total treat on every level! I admit my reason for the first viewing was strictly as an enthusiast of films set in ancient Egypt. On this level, the film is probably the best I've seen to recreate what that era must have really been like. The sets and costumes have a complete feel of reality, unlike the many Hollywoodized Egyptian ventures. But, that's not the reward I got by the end of the film. It's as much a tear-jerker as the old Ross Hunter/Lana Turner films! And, the performances, especially that of Paul Mercurio in the title role, (WHY don't we see more work from him?), Martin Landau as his father Jacob, Ben Kingsly as the Egyptian over-seer Pontiphur, and Lesly Ann Warren as his wife, are exceptional! There is even a most erotically charged scene or two between Pontiphur's adulteress wife and a scantily clad Joseph. Most everyone already knows the story. Joseph is the favored son of his father, inspiring lethal jealousy from his other sons, Joseph's brothers. They conspire to get rid of Joseph, but can't bring themselves to actually kill him, so they sell him into slavery. He ends up in Egpyt and, over the years, thanks to his talent for explaining the meanings of dreams, rises to a position of power second only to Pharaoh. Circumstances reunite Joseph with his brothers, although they don't know who he is. The revelation of his identity to them and his reunion with his father will touch the heart of anyone who has one! Originally shown as a 2-part TV mini-series by TNT a few years ago, I'm eagerly awaiting the DVD release - uninterrupted by commercials, and including a making-of featurette. Don't let this jewel get by you!",5,As real as it gets!,1110844800,"03 15, 2005",0.1468
3,AQ8DU6XVA3USJ,5119367,Alejandra Vernon artist & illustrator,"[102, 106]","Though this interpretation of Joseph's life has been substantially embellished, the heart and soul of the story remain intact, and is ultimately quite faithful to the Biblical account covered in Genesis Ch. 33:18 through Ch. 46:30.Much of the acting is marvelous, especially Ben Kingsley as Potiphar, whose part has thankfully been enlarged, because he is riveting in every scene he is in.Martin Landau is also excellent as the patriarch Jacob, who mourns the apparent loss of his favorite son, Joseph.Australian actor/dancer Paul Mercurio (&quot;Strictly Ballroom&quot;) is good in the lead, and others in the cast include Leslie Ann Warren as Potiphar's lying wife, the always beautiful Dominique Sanda as Leah, and some fine character actors playing Joseph's brothers, notably Michael Attwell (Judah), and Vincenzo Nicoli (Simeon).Included in this film, and intrinsic to Joseph's life are the stories of Tamar and Judah, and the horrific tale his sister Dinah, both done effectively.The only parts that are less than first-rate are the scenes in Pharoah's court; almost campy in costuming and acting, they can provide some amusement in the midst of all the drama. Stefano Dionisi is a most unlikely and modern looking Pharoah, and has the ultimate babe for a wife, the pulchritudinous Monica Bellucci. The entire film though, is always mentally and visually entertaining, and has much spiritual content. As with so much of the Old Testament, there are allegories that run through its narrative that point to the New Testament, and the story of Joseph has much of this symbolism.Filmed in Quarzazate, Morocco, with its exotic ancient structures and landscapes, the cinematography by Rafaele Mertes is wonderful; this is a way above average production for television, and a film about a man who &quot;does nothing against his conscience even on pain of death&quot; is worth watching again and again.",5,a man of character and faith,1077321600,"02 21, 2004",0.3776
4,A1ZLFCUF4XX7RZ,5119367,Alex,"[1, 1]","I loved this story about Joseph. It's one of my favourite stories in the Old Testament. I felt the actors brought this very important story to life in a manner that was refreshing and interesting. The direction was very good, the costumes inhanced the film, and acting was top notch. I almost forgot that this was a made for TV film. If you're looking for someway to present this story this is a very good way. It's close to Scripture without being confusing and perfect for those who are beginners and delightful for those who aren't.",5,True Faith,1232582400,"01 22, 2009",0.4479
5,AZ4UA2B3Q0WNP,5119367,Amazon Customer,"[1, 1]","gave it as a gift to my sister she love it. a good telling of the life of Joseph, son of jacob.",5,great gift,1360195200,"02 7, 2013",0.6184
6,A2SPHTIPK9IKDQ,5119367,Anony Mous,"[1, 1]","Magnificent acting, writing, directing, set design--the story is extremely compelling and the ending uplifting. It teaches many principles of virtue without in the least being preachy. There is much conflict, suspense, surprise, and believable twists in this absorbing drama. I watched it many times and learned many useful lessons from it. Buy it and enjoy it.",5,Magnificent!,1219881600,"08 28, 2008",0.4061
7,A38JOO8UOEKX6J,5119367,assurance,"[0, 0]",to see how they take a name from bible (JOSEPH) and turn it in to a dvd movie to show how it was in the bible days,5,i'm glad i order this dvd,1370649600,"06 8, 2013",0.0
8,A1E5K7NWAQY0R7,5119367,atobteam atobteam,"[1, 1]","One of the best-done Bible movies ever, if not the very best. I'm a pastor. Great acting; great story telling. Pretty good regarding Biblical faithfulness. The theology in this has nothing objectionable, and I'm a stickler on getting theology right, since that's my job. Even the extra-Biblical stuff that's in the movie is not Biblically-off. Great theological themes pervade the movie. Like someone else said, I could've done without the bath scene. There's no nudity in it, and something like this might have happened, sure; but it makes me unable to hand the DVD over to my younger daughters. I always have to watch this with them and flip by that scene when it comes up. Don't let that deter you from buying this, though. This is in the series done by Ted Turner. I wish Christians, in making Biblical movies, would be as theologically and Biblically accurate and excellent as this film. Bravo! I love this movie.",5,"Great, and Biblically/theologically accurate!",1370390400,"06 5, 2013",0.2822
9,A2FL0EKQ2EQ9E6,5119367,a viewer a viewer,"[7, 7]","When this film debuted in 1994 as a miniseries on television, at a time when biblical stories were being made into miniseries, I was skeptical because I had been disappointed in the stories of Abraham and Jacob.This film, though, is the best filmed biblical interpretation of the life of Joseph. It is truly astounding with a stellar cast! Paul Mercurio is incomparable as Joseph and deserved an emmy for his performance. He tears the heart right out of you! No less superb is Lesley Ann Warren as Potiphar's lascivious wife who tries to snare him into her web but fails.This film is incredible and not to be missed! I always cry buckets of tears at the end! A true masterpiece in every way!",5,THE BEST BIBLICAL FILM ON JOSEPH!!!,1104969600,"01 6, 2005",0.0547
10,A1WJSSCF4K4LFI,5119367,A. Wich,"[0, 0]",I really enjoyed this movie. I thought the relationship between Potifer and his wife and his wife and Joseph really striking. Several things that I had not thought of before. Such as: why didn't Potifer have Joseph killed when his wife accused him of rape? and How did his brothers react to him after he became Pharaoh's advisor.,5,Great movie,1356393600,"12 25, 2012",-0.0704
11,ACOO1NZKALM44,5119367,AzureBlu,"[3, 3]","I would have to say that this is one of the best made-for-TV (on TNT) biblical films I've seen. The acting was phenominal, the scenery..EVERYTHING. This movie is dead-on when it comes to accuracy from the Bible, which is pretty rare..almost unheard of in this day in age. It's a refreshing movie that has an honest, uplifting theme that will inspire you and your family. It could have easily been released in the theaters and it probably could have been bigger in popularity with a wider-span of audience around the world. Even so, I'm just glad that I can now buy the DVD! :)",5,Awesome!,1173312000,"03 8, 2007",0.5086
12,A22GZ2B2A12RZP,5119367,bb23,"[1, 1]","I love the story of Joseph and his brothers. As the world might say, a tale of Joseph, Nothing in the Bible is a tale or fabricated as the world might say. Love the actor also love Ben Kingsley.",5,Joseph son of Jacob,1385424000,"11 26, 2013",0.4975
13,A1BNHMIPVZN99Z,5119367,Beawoman,"[0, 0]","Ah, my favorite Bible story. After watching this and seeing how well produced it was, I can only say that I watch it ast lease twice a month.",5,Joseph,1329955200,"02 23, 2012",0.366
14,A3TUONF81AOTY7,5119367,Bluebell,"[0, 0]","This movie is very inspirational to me, it helped me through my trails and tribulations during the time I needed it most, this movie relates to me.",5,inspirational,1353715200,"11 24, 2012",0.5563
15,ADES8B01WRPI3,5119367,"Bryan E. Leed Jesus says, 'Go and Sin No More!","[7, 7]","This movie, JOSEPH, is in-depth and interesting. They put in some surprising Bible scenes that aren't usually included in the story of Joseph, but they don't waste much time with making up non-Biblical scenes, so I quite enjoyed the unique choices of Bibles scenes which they put in this movie.They have the always great Ben Kingsley portraying Potiphar, so they beefed up his role a lot more than he appears in scripture, though sometimes they rewrite some minor details of the story to beef up Potiphor's role. But it's still so close to the Bible telling that you almost have to look it up to verify if it's wrong or not. I've seen a lot worse done in other Bible films, and I can forgive it in this one since the bulk of it is so faithful to the scripture.Also, to accommodate having Ben Kingsley as the biggest name star, they start the story when Potiphar is buying Joseph as a slave. They later go back to long flashback scenes to fill in the earlier sections of the story of Joseph.I thought it was thought provoking to see how they put in the rape of Dinah as being an influence on Joseph. I never thought of that aspect, and neither does the Bible specify how it affected Joseph, but it makes sense, after seeing it in this movie.They make Joseph more humble than he is usually portrayed, especially as a youngster. I usually see the young Joseph as an arrogant, spoiled kid who only learns humility AFTER being sold into slavery. It is definitely something to consider while rereading the Bible story.This film also does a short passage on the story of Tamar and Judah, Joseph's brother, from Genesis 38, which surprised me. Having this story included really helped to flesh out the family dynamics and show the character of Joseph's brother.They also do an interesting job of showing the character of all of Joseph's scheming brothers as a gang of rowdies with mob mentality.The scene with Joseph in prison with the Pharoah's baker and waiter is interesting, in that they portray them as outranking Joseph in prison.This is a fine movie to have on DVD. It is 3 hours long, so you might want to stretch it out over two nights.There is another DVD that I can recommend, starring Maritn Landau as Abraham, with Jacqueline Bisset as Sarah, called IN THE BEGINNING, which is also very good. It, too, covers the story of Joseph in a faster, more condensed version. IN THE BEGINNING is perhaps more faithful to the linear flow of events, but it is not as in-depth as this JOSEPH DVD.JOSEPH is part of a recently released group of films from TNT, the cable TV channel, under the subheading The Bible Collection. I have also seen JACOB and can recommend that one as well. Actually, TNT is just releasing the DVD versions. I think that a European company called LUBE Productions made a handful of these great Bible films in the 1990's. There are also a few others that have been out on DVD for years, of these LUBE movies. Look for ESTHER, JEREMIAH, and SOLOMON, as well. These three come in a money-saving collection called THE BIBLE SERIES BOX SET, which is well worth the price.",5,Great Telling of the Story of Joseph! Good Acting! Surprising Moments!,1125273600,"08 29, 2005",0.1972
16,A1GH9PAOGGPBPC,5119367,Charles A Foote,"[0, 0]",I have watched this movie several times. I really enjoy it. It is an accurate account from the Bible.Thanks candpfoote,5,Great movie,1366416000,"04 20, 2013",0.1804
17,A3N95R1VKWROWF,5119367,Christopher Schwinger,"[0, 0]","A movie never presents a story exactly as you envisioned it, but nevertheless, every movie version you see gives you new insights into the story. This is a very Biblically accurate version of the Joseph story, not changing the Biblical story but rather developing it. (For example, in this version, Potiphar believes Joseph is innocent of immorality with his wife, and Joseph tells him about his past as a flashback, not found in the Bible.) The massacre at Shechem in Genesis 34 is included and shows what rotten people some of Joseph's brothers were. The actors for the brothers do very well demonstrating individuality but also a group mentality, and they show powerful character change by the end. It's interesting that the movie shows the brothers have really changed just by showing their eager attitude in blessing the name of God with their father Jacob (Blessed be His name)! The actor for Jacob does very well, too. (The actor for Joseph is fine, too, but the character couldn't have too much personality, because every viewer has a preconceived expectation of what he should be like.) The movie introduced me to an interesting idea, which is that Jacob may have been involved in preserving genealogies and stories from Abraham. The Book of Genesis does have a much more continuous account of Jacob's life, whereas stories of Abraham's life are like disconnected snapshots. So what I got most out of this movie was the interesting idea that the Book of Genesis was recorded before Moses' time.",5,Stimulating,1322870400,"12 3, 2011",0.3043
18,A2YB31Z4QU3I6M,5119367,C. Meyer,"[3, 3]","As the title says, unbelievably good! They included all the information that the Bible has about this period of time that is usually excluded from a traditional telling of the story of Joseph in Egypt. This information helps explain why Jacob took the birthright away from the older boys and gave it to Joseph. Ben Kingsley was magnificent as Potiphar and he had a great script to work from. I felt that the attitudes and relationships between the characters was very real. Paul Mercurio was very good as Joseph and Joseph's manner was always respectful and submissive to those over him, which always worked to his benefit in the end. Joseph's family scenes showed a very wonderful relationship with his wife, Asenath. The movie is three hours long because I believe originally it was a made-for-cable mini-series. Well worth sitting through.",5,Unbelievably Good!!!!,1173312000,"03 8, 2007",0.364
19,AWIF8AR75LL9L,5119367,Colorgirl Spreading color around my world,"[19, 19]","Having just seen this movie for the first time last night, I have to say that in spite of the very white actors in a culture that would clearly be darker in appearance, this movie in writing, production, and acting overcame that one glaring inconsistency with accuracy and with beauty.Bible in hand, we marveled to see that this story followed the actual biblical account with astounding accuracy almost never seen in biblical productions. Entirely enjoyable and a marvelously acted piece, my entire family loved this movie. We had been expecting another biblical mish mash eliciting merely yawns, but were startled to see such a wonderful movie.Martin Landau (Jacob) gave a fantastic performance, as did Ben Kingsley(Potiphar), Paul Mercurio(Joseph) (which bumps STRICTLY BALLROOM out of #1 on my Paul Mercurio list of favorite performances), Leslie-Anne Down was good as Potiphar's wife, and the 11 brothers of Joseph were fabulous. The supporting cast was excellent.The sensitive and well rounded way in which this story was handled was fresh, creative, yet took no liberties in veering from the original story. Although it is not as spectacular in production as THE TEN COMMANDMENTS and other such movies, this movie was more like it &quot;really&quot; would have happened complete with humanity in all of its misery and magnificence.I can not speak highly enough of this movie. What a pleasant surprise. We even got a chuckle out of it now and then!",5,AMAZING!,1052784000,"05 13, 2003",0.5912
20,A1BXVZSQOJE6UE,5119367,Ctwink,"[3, 3]","I was extremely skeptical when this movie came out. I mean, what kind of movie can Bible-basher Ted Turner produce on one of the great heroes of the Bible - Joseph? Boy was I wrong. This is one of my all-time favorite movies and the best part is it faithfully tells the story directly out of the Bible with very few Hollywood additions. The acting is great. The actors are well known and correctly cast. Even the unknown lead of Joseph (Paul Mercurio) does a wonderful job. Even the scenes and settings are wonderful. Two thumbs way up!!For fans of this movie, look for other TNT offerings in this series - Moses, Abraham, David, Jacob, and others. Most of them are equally good - with I think David being my next favorite followed by Abraham.",5,Best Of TNT's Series Of Bible Characters,1173916800,"03 15, 2007",0.3256
21,AE62TIY3899YL,5119367,Daniel J. Silva Superman_242,"[0, 0]",I've watched this movie every six months or so for about 12 years or so. Every time I'm touched. It really is fantastic acting and a wonderful script. Forgiveness is the main message and Joseph's character exemplifies it many times in this story.,5,Best of the Bible Collection AND best telling of the Joseph story ever,1339372800,"06 11, 2012",0.2737
22,A25V8W2UH7BG5W,5119367,Daniel Rivera,"[0, 0]","The best movie ever seen and own. Its actually my favorite movie of all time. its worth to have, its so accurate from the bible. very inspiring and educational. Buy It",5,:) :),1367366400,"05 1, 2013",0.3595
23,A2DHK114WTMZ17,5119367,David A. Rivera coming judgement,"[5, 5]","Although I had enjoyed the Bible movies that were broadcast by Turner on TNT, Joseph turned out to be a cut above the rest in regard to the scope of the production, the writing, and the performances of the actors. It really seemed to capture the essence of the story in the book of Genesis.",5,An Unexpected Pleasure...,1126569600,"09 13, 2005",0.148
24,A28V715ZW8DCU,5119367,Denw,"[0, 0]",This portrayal of Joseph's story is very good. It is biblically pretty accurate and features good performances by the actors. I recommend it to individual and family audiences! It's one of the great stories of the Bible.,5,Joseph Really Delivers,1350259200,"10 15, 2012",0.5661
25,ASZMNJBMM91MZ,5119367,Diane,"[1, 2]",I like anything that is biblical. I have bought a few of them in the past few weeks. The Ten Commandments and the Story of Ruth are my all time favorites.,4,Biblical stories,1365033600,"04 4, 2013",0.2609
26,A16FJ7TC571JZC,5119367,Dwight,"[1, 1]","No matter how many times I watch it, it is still very moving. Excellent acting, excellent adherence to the true story, and something I will soon not forget and enjoy watching again. I bought several copies to give as gifts.",5,Best production of the Joseph story ever done.,1393200000,"02 24, 2014",0.2768
27,A29WU2UUFP3H5B,5119367,Earth Trekker Winsome Traveler,"[2, 2]","This is an accurate and realistic depiction of Scripture. It is nice to watch a Bible story that is not a cartoon and not an overacted, way too serious presentation. Bible heroes on film are often treated as if they walked on earth with a halo constantly hovering over them. This is a story about a man who follows God's heart through thick and thin (mostly thin), but you can relate to him because he is portrayed as an ordinary, albeit tremendously faithful, man.",5,Very good movie.,1229904000,"12 22, 2008",0.3798
28,A1TKYAYESYHIA2,5119367,Elijah Chingosho Dr Elijah Chingosho,"[3, 4]","Joseph is an epic motion picture; another excellent and inspiring Bible story which was creatively and sensitively produced. It traces the story of Joseph in Genesis and brings it to life in a powerful and compelling way.This film did a good job of interpretation the Biblical story on the life of Joseph. The production is superb and settings are excellent. Everyone of the cast was perfect for their parts. Paul Mercurio plays Joseph exceptionally well. Equally impressive is Lesley Ann Warren who plays as Potiphar's lewd wife who unsuccessfully attempts to ensnare Joseph. Also marvellous to watch is Martin Landau (Jacob) and Joseph's eleven brothers. The supporting cast was fantastic.Although I have read the story of Joseph, this film brings it to life and reinforces my understanding of it. I thoroughly enjoyed the film which was very well done.The only area that one may criticize is the very white actors when in fact the people at the time were much darker in complexion. However, this shortcoming is compensated by the accuracy of the actual biblical account of the story which is rare in many biblical productions.Overall impression: a pleasant and well acted movie that was a joy to watch that I highly recommend for those who need to reinforce their knowledge of the Bible and appreciate a well-done movie based on it.",5,Excellent Viewing,1143072000,"03 23, 2006",0.582
29,A39ZX6ML4X7E67,5119367,Ethel B.,"[1, 1]",I read the Bible quite often and teach Bible classes from time to time. This is a very accurate account of the &#34;Joseph&#34; story.,5,A well told Bible story,1402444800,"06 11, 2014",0.0
30,A2RV78U1G3MGLH,5119367,Fredrick L. Murphy,"[12, 14]","This film is closer to the Biblical text of this account, than any we've yet seen....it's very emotional and very encouraging as well. Long film, but not too long! The only real problem (meaning unacceptable) is the bath-tub scene with Joseph. He's seen from waist up, in a pool relazing/bathing, and in comes his boss's wife who's been after him sexually. Potiphar's wife seductively rubs up and down his chest, until (WITH MUSIC AND SOUND EFFECTS GOING ALONG WITH THE SEDUCTIVITY) she goes down into the water below his waist and connects with his genitals (yes, for real). Both Joseph and her are shown to react to the moment ever so....slightly and then she leaves him alone until the next time she confronts him. We had this film for YEARS and thought how awesomely Biblical (compared to any other film) this movie was, but never noticed this part until this year. Why? because we had younger children at the time, and so the inferred sexual tension of her rubbing his shoulders over the bath-tub/pool was something we'd simply pass by w/ the fast-fwd button a mere several seconds. We didn't do that this year, and WHOOOAH!! We were SHOCKED at what transpired in those few moments. They don't show below the water, but they PLAY UP the moment big time to let you know what is happening. For this reason, i say DON'T BUY THE MOVIE unless you can edit it. If i had this film on VCR, i'd simply tab the edit tab on the VCR tape and i'd record a whole minute or two over that one moment (which wouldn't hurt a 3-plus hour long film!).It's truly a shame that the film makers snuck in a scene of this degree, they simply could have ended with the woman rubbing Joseph's shoulders in flirtation (showing her constant pursuit of him) and played up the moment that way, at that time. However, they stuck a little leaven in to satisfy Hollywood and to leaven the whole loaf with making it clear that she was touching his genitals for a bit and he was helpless to deal with the tempation for a few moments. This cheap move by the film makers reminds me of the Sampson film put out by the Bible Collection film makers....which is TOTALLY TRASHY...taking the sexuality way OVERBOARD for the Sampson screen (don't buy it! My family was apalled!). Again, i say if you cannot edit the movie, DON'T BUY IT.",2,"if you can edit 1 scene, BUY THIS!",1264723200,"01 29, 2010",0.0598
