,reviewerID,asin,reviewerName,helpful,reviewText,overall,summary,unixReviewTime,reviewTime,Sentiment
0,A2XOY9T8A2NDH8,615274641,aferdman olfu,"[1, 1]","In our politically correct USA this movie doesnt fit anything. Yes, most facts are not readily available. This movie shows only facts but not what led to all these human disasters. Some other facts are missing like comrade Stalin mass killing his own military leaders. By accident I own a DVD from Russia with promising title Dictators which does include comrade Hitler and comrade Stalin the point being is Russian DVD include only safe facts which make all DVD laughable but this is how we are trying to rewrite history. Use safe facts and worry about nothing.",5,stating facts is not politically correct,1349395200,"10 5, 2012",-0.1656
1,A2DWVSQNNOW5HA,615274641,Ann E. Parrish,"[1, 1]",I bought this after seeing a portion of it. I bought it so my children who are adults do NOT forget what happened.This is a part of History that has been buried along with the truth and needs to be revealed.,5,History revealed..,1397952000,"04 20, 2014",0.2263
2,A3MMYQG3B9FU4J,615274641,Asa Ferguson,"[1, 1]","It is amazing how much like todays current events are leading in the same direction as this Soviet Story. It is also the story of the book of Judges. How easy it is for new generations to fall into the same errors as our fathers did. The impact on every generation and every nation is more than evident. Yet! Some how my generation didn't fully understand what took place in WWII our else they failed to instill in the succeeding generations the importance of submitting ourselves to the obedience of grace .To God's credit he hasn't destroyed us yet .He keeps reworking the clay into a image that seams good for him to make ,what it should look like is in the mind of the potter. It is truly amazing how God uses every thing in our life to perfect in us all the qualities of the Christ .",5,History dose repeat its self,1396051200,"03 29, 2014",0.3873
3,ADDNMC77PJBRD,615274641,bjamnjm,"[2, 2]","The most important story apathetic Americans don't want to know. We know through and through the sociopathic structure of Nazism as it pertained to attempting Genocide of the Jewish race, at least in all occupied territories yet we knew nothing of the Empire in the East whom inspired the Nazi Party and indeed it is difficult to find significant differences between the two totalitarian philosophies. Shamefully, this documentary will be seen or believed by precious few in America before it's too late. Communism was committing atrocities of the type Nazis did except they did for ~ 80 yrs. Further, it's little known that Mao Zedong, murderer of as many as 80,000,000 of his own people who perfected the purge (of the committed ranks) long before Stalin adopted the tactic",5,Documentary should be required viewing in History classes across the Country,1386460800,"12 8, 2013",0.0906
4,A3CZ6OEF26RRX5,615274641,Bob North,"[8, 75]",The film is junk... as are most of these reviews. It is an example of why one can not depend on reviews that are published without an editor.,1,This thing is lame,1273968000,"05 16, 2010",0.0
5,A26QJW82E7L2MJ,615274641,C. W.,"[4, 4]","It is estimated that Hitler killed between 11-17 million people in his camps and extermination programmes. And I am so thankful that Hollywood has produced numerous factual documentaries and fact based films exposing the horror of the Nazis and the Holocaust. It strikes me as strange that there is no similar size body of work by Hollywood exposing the 20 million murdered by Soviet Communist leader Josef Stalin or the 40 million murdered by Chinese Communist leader Mao Zedong or the other atrocities of Communism. While precise figures may never be known, it is estimated that as many as 259 million people were murdered under Communist regimes between 1917-1987.With a growing number people from labour leaders to politicians to those who consider themselves the intellectual elite openly endorsing socialism and communism as a model for America, this film together with Faith of the Century: A History of Communism and Socialism A Clear and Present Danger are films every American should watch. The promised utopia has never been realised by any socialist/communist country and communism has been responsible for more death and suffering in the last 100 years than any other single system of belief. Even today, political prisons operate in countries like China, North Korea, Vietnam and elsewhere. And there are indications that a growning number of former Russian Communists including Putin are wanting to return to the old ways.",5,Communism exposed,1329004800,"02 12, 2012",-0.2211
6,A3SKGJ8KVUNYUE,615274641,"Cynthia Danute Cekauskas, LCSW Lithuanian Am...","[2, 3]","I was told about this film by a friend of mine who is the son of Lithuanian refugees who fled their native country rather than face certain imprisonment, death or deportation to Siberia. I am only too aware of how many Lithuanian people were deported to frozen outlying areas of the Soviet Union in an effort to recolonize their country with Russians from other parts of the former U.S.S.R. Two of my mother's cousins, in fact, froze to death in Siberia dying of exhaustion, starvation and overexposure. It has been a source of pain for me and my family for decades. What is MORE painful, however, is to realize that the West, as depicted in this film and as it truly is, has done NOTHING to call to account the atrocities done to millions of innocent people in Eastern Europe before, during and after the Second World War. While there is an overabundance of literature, movies, books, etc. on Nazi crimes very little exists about what the Soviets did in their murder of 20 million people. This film was very unique in that you could choose to have subtitles in any number of languages. I chose Lithuanian because this is the language I grew up speaking. I also agree with the creators of the film and the author ofFROM IMMIGRANT TO U.S. MARINE:Kaunas-Dresden-Quantico-Da Nang-Tam Ky-Potsdam-Santo Domingo, LTC Dominik Margele, USMC, Ret who quite clearly asked the question: WHERE ARE THE NUREMBERG TRIALS OF THE COMMUNIST WAR CRIMINALS? They murdered many more people than the Nazis EVER did. The footage in this film is powerful and dramatic. It will move you to tears and make you very angry that there are many individuals out there well known for their heinous genocide of Eastern Europeans who are walking around free and not being held accountable for their actions. THAT is the real crime.",5,"Shocking, painful to watch, makes you angry at the passivity of the West.",1320451200,"11 5, 2011",-0.2924
7,A65AF4E1N6GUO,615274641,Damon Enola,"[11, 20]","This documentary does demonstrate the many evil deeds enacted by Stalin (and could've added more) and I'm glad there is a documentary that demonstrates some level of parity between the more obvious evil Adolf Hitler and the less obvious evil Josef Stalin. It also does a great job at exposing the way-too-comfortable relationship between the Nazis and the Soviets during 1939-41. And it definitely demonstrated that there was anti-Semitism in both the Nazi and Soviet camps.All that being stated, I have 3 problems with this documentary.1) In terms of just providing balance, it would've been worth noting the heroism of the Red Army between 1941-45 in stopping Nazi aggression and providing a solid Eastern Front (at the cost of over 14 million soldiers) that helped the Allies as a whole defeat Nazi Germany. Even the most right-wing person could recognize that the Allies' task of defeating Hitler would've been much harder, if not impossible, without the tremendous help from the Soviets. Yes, the Red Army committed atrocities too (as did the other Allies to a much smaller extent) but it was part of the necessary war to defeat Hitler.2) The idea of the Nazis being just junior Communists is just ludicrous. Yes, both believed in totalitarian systems. Yes both believed in murder and repression in order to maintain rule. However, the Nazis were Socialist in name only (and that was to acquire votes in German elections prior to 1933). Hitler despised Bolshevism (and what he called Judeo Bolshevism). Hitler's idol was Frederick the Great (hint, not a Socialist) and Hitler wanted a return to a Prussian empire. He considered as friends Mussolini and Franco and backed Franco and his Fascists in the Spanish Civil War. The Soviets supported the Republicans in the Spanish Civil War. If the Nazis and Soviets were so chummy, then how come Hitler decided to launch Operation Barbarossa in the first place (the documentary completely neglects this)? Why did Stalin respond with such ferocity (the documentary completely neglects this too)?3) Marx/Engles may have called for mass executions and Lenin did order executions be carried, but neither one is on the scale or ideology of Stalin. Stalin was his own creature and not a blind follower of Marxist-Leninist ideology. In fact, while Stalin claimed to support the beliefs of the Marxist-Leninists, he had no problem ordering the executions of many of them including Trotsky, who denounced him, and Kirov, who supported him but was too much of a threat. Stalin has more in common with Ivan the Terrible than he does with Lenin. It's quite telling that all the original Party members ended up dead under Stalin's rule (with Trotsky, I believe, being the last holdout). The documentary paints the picture that it was the teachings of Marx-Engles and Lenin that drove Stalin to cause the deaths of over 20 million Russians which denies Stalin's own psychological makeup as the true cause of this scale of death. It's quite telling that when Khrushchev took power after Stalin's death, he set out to de-Stalinize the Soviet Union but kept Marx and Lenin in, implying just how rogue Stalin was.This documentary would've been more credible if it just focused on Stalin, his atrocities, and the troubling thought that there are people in Russia (including its leaders) today who are willing to ignore these atrocities altogether and focus on how great Stalin was. Blood on the Snow is a much better documentary for this. Linking all these deaths to the Communist Manifesto is just intellectually dishonest.",4,Why 4 stars?,1269043200,"03 20, 2010",-0.2384
8,A2JCDEK5UVKU1Q,615274641,D. Demro Vietnam War and WWII historian,"[0, 0]","As someone who has extensively studied WWII history, I was well aware of the millions of murders committed by the Soviet Union against its own citizens. But until one watches a documentary such as this does the horror and gravity of Soviet evil hit home. I think few people are aware of the fact that it was Russia who initiated gassing of the unwanted by running the exhaust pipes of trucks back into the truck so all aboard would be dead by the time of its arrival. Likewise, it was Russia that initiated the extermination of certain races and it was Germany who merely perfected it. It was Karl Marx who professed we must rid ourselves of those who don't produce, and it was the Soviets who put this into practice long before Germany. Thank you Edvins Snore for shining a light on one of the best-kept secrets. I only wish I had seen this documentary prior to 2008 when I travelled to Ukraine to teach a semester at the University of Science and Arts in Kiev. I would have liked to question the Ukranians about the massive starvation of 1932-33 when Stalin ordered the removal of all food from Ukraine, resulting in the starvation of SEVEN MILLION people in one year! Russian history is something few people in Ukraine cared to discuss due to the level of suffering that was enduring by so many. There are still many wounds left open in people whose parents or grandparents were victims of Stalin and Lenin. My personal library has many documentaries on Nazi atrocities, but this DVD adds to a very small collection of those related to Soviet atrocities. Due to the allied ties to Russia, much of the horror documented in this DVD sadly went unpunished or even reported. In contrast, those who were responsible for these atrocities were ultimately decorated for their actions. This is something that should be shown in all colleges and universities along with all the other critical history that is tragically ignored.I also recommend watching the DVD Katyn which tells the story of how Russia murdered over TWENTY-TWO THOUSAND polish soldiers and educated at the beginning of WWII, then tried to frame the Nazis for this atrocity. The DVD Katyn is a sobering tale of cold-blooded murder, with most of the trigger-pulling committed by one man!",5,Truly Sobering Documentary on Russian Atrocities,1383091200,"10 30, 2013",-0.1558
9,A3NEV245WZD2AA,615274641,Eleni,"[11, 19]","Finally an outright condemnation of that awful quartet - Marx Engels Lenin and Stalin - along with those other admirers of genocide in the service of creating a monstrous utopia - Hitler and his gang of killers. But why stop there? Why even begin with these characters? Why do we leave out the originators of concentration camps meant for wholesale slaughter - ethnicide, genocide, etc? Who are they? The Turks! They ethically cleansed over 4 MILLION Christians between 1915-1923 - 4 million in such an awful haste! Lenin was present and supportive--Hitler was awed...in fact why is NOTHING mentioned in this documentary about the Turkish-German-Soviet alliance to utterly destroy any remnant of Christianity in Asia Minor and in the Soviet Union? We know about the Jews, we know about kulaks in Ukarine, but the word Christian does not come up once! And it was first and foremost Christians that the Nazis, the Communists and the Muslims were wiping out.",3,gets it partially right; therefore suspect,1289174400,"11 8, 2010",-0.2369
10,A2JWTJREIWLKN3,615274641,Goat Lovin' Mama,"[1, 1]","Eye opening and informative! This is something I will hold onto, as 3 of our daughters are from Eastern Europe. It is part of their heritage.",5,EYE OPENING!,1386806400,"12 12, 2013",0.0
11,A1OBO27DTPQ411,615274641,HR Wolfe,"[22, 24]",This film is a must see. To little is known about the true ruthlessness of the Soviet era. As pointed out in the film it did not stop when Stalin died. American schools do not teach this and a recent column by Barry Rubin pointing out just how this has been glossed over and ignored by virtually everybody. Not only should you watch it but it should be shared with all who will sit for it.One critique I might have is when they go into Trotsky's murder they should tell you that he set up Lennin's secret policde and did mor than a little murder himself. He was no marter.,5,A Story that must be told,1292976000,"12 22, 2010",-0.2514
12,ABP0RCZCVMRRG,615274641,J. DeMeo naturalenergyworks,"[10, 13]","This documentary is highly recommended, for all the reasons given by the other 5-star raters, and more. I would also recommend to reviewRussia's War: Blood Upon the Snowalthough it does give a white-wash at the introduction pretending Marx, Engels, Lenin and Trotsky were innocents, when in fact they laid the foundations for communist atrocity (Marx, Engels) or implemented the betrayal of the Russian Revolution's democratic aspirations, as well as initiating the first stages of the massive genocides to follow (Lenin and Trotsky). Also seeWorld War II: Behind Closed Doorsfor coverage details on the Hitler-Stalin pact not found so much in Soviet Story nor in Blood Upon the Snow.But I should point out there is a confusion on the citations given for one of the most damning quotations presented in the documentary, where the terms Revolutionary Holocaust are presented, along with the term racial trash. Because of the citation errors, people go looking for the original and don't find it so easy. This is reflected in the two negative reviews, and should be corrected by the producers. The original quote appears to be from Friedrich Engels, The Magyar Struggle, Neue Rheinische Zeitung, January 13, 1849. This paper appeared, according to citations, in the book Karl Marx, The Revolutions of 1848, Political Writings Vol. 1, London, Penguin Books, 1973. So it sometimes gets attributed to Marx. Here's the quote:Among all the nations and sub-nations of Austria, only three standard-bearers of progress took an active part in history, and are still capable of life -- the Germans, the Poles and the Magyars. Hence they are now revolutionary. All the other large and small nationalities and peoples are destined to perish before long in the revolutionary world storm [revolutionary holocaust] For that reason they are now counter-revolutionary. ... these residual fragments of peoples always become fanatical standard-bearers of counter-revolution and remain so until their complete extirpation or loss of their national character... [A general war will] wipe out all these racial trash [V&ouml;lkerabf&auml;lle - original was given at Marxist websites as petty hidebound nations] down to their very names. The next world war will result in the disappearance from the face of the earth not only of reactionary classes and dynasties, but also of entire reactionary peoples. And that, too, is a step forward.See the full article text at [..] website, but with the toned-down language. The term world storm is a literal translation, but in the context, the term holocaust is a reasonable translation also. Note how the [..] website -- run by dedicated communists -- deliberately softened the really ugly word V&ouml;lkerabf&auml;lle (racial trash) into revolutionary hidebound nations, whatever that means. Something like running dogs I suppose, whatever that means.But it is not as if Marx is let off the hook. Both of them have numerous quotes advocating genocide, wiping out whole ethnic populations, exposing terrible racism against blacks, serbs, Poles, and with intensive Jew-hatred. For that kind of material see the listings at marxwords.blogspot.com. Soviet Story should be seen by everybody, young and old, if only to refute the garbage revisionist history being vomited up in most of the universities by Marxist professors hoping to trigger communism in the Americas. This DVD is a good vaccination against falling sucker to Marxist propaganda.",5,An Excellent Overview,1266192000,"02 15, 2010",-0.086
13,AUPNJTQRXTV64,615274641,John R. Mallernee John Robert Mallernee,"[2, 2]","Thanks to repeated government indoctrination and Hollywood &#34;political correctness&#34;, everybody knows the Nazis were bad guys who murdered Jews.But, there's much more to that story - - -This movie, &#34;THE SOVIET STORY&#34;, reveals how Hitler and the Nazis learned their extermination methods by copying Stalin and the Soviets, with whom they were formally allied for many years, and even after the war, the Soviets continued to use the Nazi concentration camps.Everyone needs to see this movie.I've bought extra copies to as gifts for friends and family.",5,EVERYONE MUST SEE THIS SHOCKER ! ! !,1357430400,"01 6, 2013",-0.7783
14,AVQDTTQJLNM5L,615274641,JT,"[1, 1]",Read the 1-star reviews to see the best evidence of the effectiveness and necessity of this film. You will see in those reviews how many Russians have a false sense of nationalism that causes them to defend the indefensible.Stalin exterminated at least 80 million people. Seeing the shockingly fascist responses of Russians this film conservatively and prudently limited its focus to the irrefutable evidence of the genocide of 7 million people. And wow! Look at how the Russian fascists of today react!Nationalism and false patriotism are very powerful motivators. Putin knows this. Putin is rallying Russia in exactly the same manner as Hitler. Read the 1-star reviews to see the irrational false national pride that Putin is fomenting and wielding.And if you think that the danger is contained within the borders of historically tyrannical Russia better think again. If you live in the U.S. you are surrounded by future Brown ShirtsYou'd be shocked to find out how many of your neighbors can be easily convinced that it is okay to take your possessions and imprison you under some pretense of doing a &#34;greater good for the many&#34;.,5,Priceless,1397692800,"04 17, 2014",0.1713
15,AGSVIWQUZULOY,615274641,Lunareist CHIORD,"[0, 0]","A lot of history is here and this is not the stuff of textbooks. The things Stalin did are beyond horrific and compared to Hitler, this man was truly a monster. I'd like to see a lot more on this topic.",5,"compared to Hitler, this man was truly a monster.",1387152000,"12 16, 2013",0.0
16,A1IGABVZXMQSK2,615274641,Meijer Goldstein,"[3, 6]","Nowdays,most Americans do not know who Stalin or even Hitler was(but they know 50 cent), so this movie would confuse most in the USA. Hitler and Stalin were both Communists and were basically on the same team. Marx called for the elimination of Trash Races like the Lithuanians, Poles, Britons, etc. He said those races were too backward to be revolutionary ! So much for all of you Useful Idiot commies. George Bernard Shaw is on the video calling for the development of a poison that would be humane and kill rapidly ( Zyklon B). A lot of information that would not be aired in the USA as it caused a big furor in Europe.The same Blood bankers that created communism then are still running London and Washington and this movie alludes to that.",5,Too shocking for dumbed down Americans.,1278806400,"07 11, 2010",-0.0808
17,A29X9U79LWG6YT,615274641,OBEONECANOBI JEORGE,"[1, 1]","Here is the story of Stalin, the man who murdered millions of people and got away with it, and the world ignored it. Not only did the world ignored it, the world actually helped this man survived. This is a good story about the man that ran the Soviet union (now Russia) and became part of Hitler's Axis himself with Hitler cooperating in annexing other countries under their rules. He was one of many Hitler's puppets I believe the smartest of them all. He agreed to divide Poland in half with Hitler and also annexed some other land from Finland, but was not able to get thru all of it, Those Finnish people are one tough Cookie!!and stopped him cold later on, taking back what Stalin had taken away. Hitler's despised communism and wanted nothing to do with Stalin and his way of thinking, doctrine introduced by Lenin and Karl Marx ( a German by birth ) So as planned, Hitler finally decided to turn on him and try to take over the Soviet Union, which he Was almost successful, Stalin then felt necessary to join the allied forces, for survival and asking Churchill for assistance and Roosevelt and we gave it to him! Bottom line is, that with our help even after he was part of Hitler's Axis powers, he then at the end of it all, the Soviet union ended up controlling and imposing their communist way to about almost 100% of the land Hitler's had taken taking over all of eastern Europe and half of Germany!, so this particular documentary which is very graphic of all the millions of people that between him and Hitler's killed, so it really makes you think, What did we really accomplish when WWII ended? we switched from one mad man to another and then came the cold war!. This is a very educational documentary that after seeing it, makes you really think!!",5,TRUTH STORY ABOUT ANOTHER WAR CRIMINAL DICTATOR,1381449600,"10 11, 2013",-0.0267
