,reviewerID,asin,reviewerName,helpful,reviewText,overall,summary,unixReviewTime,reviewTime,Sentiment
18,A4ECYB20UWH3N,615274641,R. Bono Riccardo,"[75, 88]","Occasionally there are films of such import to historical understanding that they stand out head over heels over all else...This is one such film. It supports the thesis that, not only was Nazism the heir to Communism, but that its leaders, Hitler, and Lenin, and Stalin, substantially cooperated with one another and learned from one another. Nazism was only different from Communism is that it was ethnically and racially based...whereas Communism was economically and class based. Philosophically, as Goebbels publicly wrote, they were the same, in their employment of repression, and mass murder, and fear to achieve their idealistic aims.The romantic leanings of too many in the West, then as now, always seem to pit early Communism against Nazism....one being good and idealistic, and the other being pure evil. This DVD demonstrates like no other film, that nothing could be further from the truth...for Nazism and Communism, aside from occasional distrust, from the beginning, were bound together with bonds of friendship, affection, and cooperation. That alliance ceased when Hitler broke his written pact with Stalin in their common plans for dividing a post war Europe....as had ALREADY been achieved with their joint invasion of Poland. It's often portrayed that it was Hitler who began WW II. True, as far as it goes...But the full truth is that, in fact, it was both Hitler and Stalin who planned and executed the 1939 attack on Poland.In addition, this DVD is an excellent antidote in smashing the illusions of all too many North American liberals, and Euro and South American leftists...who still believe that somehow...it was only Stalin who abandoned the ideals of Communism....to become one of the two bloodiest murders of the 20th century. These illusions still exist today, in the all too gentle reminder, that Lenin was somehow the good communist. In fact, this DVD documents Lenin's class warfare and mass murder of ten million, as the ideological solution paving the way for his ideal communist state...and the New Soviet Man. This Hitler directly copied with the New German Man. Nazism also emulated the concentration camps, which were FIRST established in Lenin's regime....BEFORE Stalin....and served as the Nazi template for the Holocaust....20 years before it occurred.The Soviet Story is a powerful documentary...for it speaks the truth with first person interviews, and weaves a quite convincing review of the Soviet era historic documentation...key parts of which, were smuggled out of today's new Russian state apparatus. In fact, it's well to remember Putin's absurd statements about the fall of the USSR being one of the great tragedies of the twentieth century. This is why this DVD remains timely...as the new Russia still retains significant elements of the old USSR. It remains timely, because the same coterie of delusional western intellectuals still remain fuzzy about the harsh reality of Russian history. As the reviewer for The Economist wrote, this film is a powerful antidote to the sanitization of the past.For Americans, history will show a period of hesitation about the post war intentions of Stalin. But by 1948, those intentions were abundantly clear to all but the most willful deniers. The key roles of George Kennan, Harry Truman, and Dwight Eisenhower defined our initial responses to the USSR. Containment in it's peaceful impulse, and in its defensive impulse, in NATO and MAD, BOTH played their role in the evolution of the leadership of the USSR. The world did avoid a nuclear holocaust. And, as an addendum on the ending of the Cold War, it's well to note that it was the big tent Republican, Ronald Reagan, who opposed his own right wing, to negotiate with Micheal Gorbachev. Both, along with Lech Walesa and the Pope, with the big exception of the old Yugoslavia, paved the way to the relatively bloodless denouement to the Cold War.I can therefore also highly recommend:The Rebellion of Ronald Reagan: A History of the End of the Cold War, by Jim Mann.",5,The Harsh Reality,1257811200,"11 10, 2009",-0.0308
19,A2IY4RP3YJAQT8,615274641,Rick Plesnik,"[8, 12]",Blows the door open on Socialism for all to see. We always suspected that something was not quite right behind the facade of the Soviet peoples paradise and this film confirms it. Some images are not for the faint of heart but are heart rending in the brutality displayed. This film should be curricula in High Schools across North America. Maybe then we could put this fascination and obsession about the glory of Communism to rest once and for all. The survivor interviews were particularly touching. Only a heartless b**tard or a devout Socialist / Communist could fail to be moved by the emotion on display. A must see to fully appreciate the democracy we all enjoy.,5,Chilling,1270684800,"04 8, 2010",0.0977
20,A2XRMQA6PJ5ZJ8,615274641,Roger J. Buffington,"[2, 2]","The Soviet Union brought a holocaust upon its own people through the imposition of Communism, and caused untold harm to other neighboring countries as well. Although Stalin tried to get in bed with Hitler, with whom he had much in common, Hitler had other ideas and only then did the Soviet Union become allied with Britain and America. This alliance of conveniences has caused many in the West to forget that Soviet Communism was just as vicious as German Naziism. This film tells the unvarnished truth about the old Soviet Union, an institution which Russia and the world are well rid of. RJB.",5,An inconvenient truth,1390608000,"01 25, 2014",-0.068
21,A1JYIPLD7GP4MC,615274641,Roy Hight,"[1, 1]","Some reviews have pointed out that this film doesn't capture the whole story. While true, I think it's an excellent overview and a good prompt to thinking, particularly among Western audiences which have simply not been given the facts associated with Marxism-Leninism, the birth of the Soviet state, and the fact that practically every Nazi idea we despise was actually invented in the USSR.Excellent film, and worth watching. One of the few DVD's I've actually bought in the last few years and loaned to friends.",4,Excellent First Effort,1384041600,"11 10, 2013",0.4376
22,AF3X7J0XC391L,615274641,Stratiotes Doxha Theon 2 Thes 2:15,"[1, 1]","Wartime alliances between the west and Stalin's USSR that seemed necessarily to defeat Adolf Hitler's regime only gave way to a regime worse than Hitler's. It has been argued that the USSR and Third Reich were in a war of attrition that would likely have ended with both regimes bled dry had the US not entered the war and joined the alliance with Stalin. Perhaps standing back and letting the two regimes annihilate one another would have been inhumane but perhaps it would have resulted in far fewer deaths than the subsequent rise of Stalin in a victorious Soviet Union. In the end, the two, both insisting they were polar opposites of the other, were essentially the same devil. This documentary traces the key points that demonstrate how Nazism and Soviet Communism are simply variations on the same theme. A brilliant documentary that gives rise to a new perspective on 20th century (and particularly cold-war) history.",5,An alliance that paved the way for the most murderous regime,1401408000,"05 30, 2014",-0.2173
